,Datetime,Favorites,Text
494,2020-06-06 03:15:34+00:00,102,Let us remember who we fight for. #WhiteCoatsForBlackLives #GeorgeFloyd #EricGarner #AhmaudArbery #BreonnaTayor #PhilandoCastile #FreddieGray #TrayvonMartin #MikeBrown #NoJusticeNoPeace #BlackLivesMatter 
495,2020-06-06 03:13:23+00:00,128,"Yeah, that’s right! ... SOMEONE had to say it!!! We killed it today!!! #acab #BlackLivesMatter #BlackLivesMatterATL pic.twitter.com/oMJDnCuZMo"
496,2020-06-06 03:02:24+00:00,8900,Since the TL seems to be going back to normal let’s not forget. Human rights are not politics. Human rights are not drama. Human rights are not a trend. Human rights are not a fad. Human rights are not something you just suddenly forget about. #BlackLivesMatter
497,2020-06-06 03:02:09+00:00,69,#SeattleProtest #BlackLivesMatter This is how Seattle does a protest 11th &amp; Pine 
498,2020-06-06 02:59:24+00:00,285,Manvel High School c/o 2020 ... we love to see it !!! #BlackLivesMatter 
499,2020-06-06 02:45:01+00:00,29,"Just in case anyone was wondering: Ryan Dawson, the racist and anti-semitic white dude complaining about #BlackLivesMatter protests in Osaka (subsequently roasted by Naomi Osaka), lives in Ikoma, Nara. Do with that what you will. "
500,2020-06-06 02:44:40+00:00,258,Candace Owens gives an amazing speech about the murder of George Floyd. https://www.pscp.tv/w/1MYGNklYaYZJw?t=2m47s #BlackLivesMatter
501,2020-06-06 02:43:20+00:00,1350,My heart broke. The disregard for black lives. Over a stop sign. #BlackLivesMatter 
502,2020-06-06 02:38:49+00:00,98,"One of my students took this photo today in Pleasanton, California. Never thought I would see it. #BlackLivesMatter "
503,2020-06-06 02:30:17+00:00,662,Ottawa showed up today . Let’s keep it going ! The work is far from done ! #blmottawa #blacklivesmatter 
504,2020-06-06 02:25:53+00:00,20,THIS IS THE REVOLUTION. THE REVOLUTION IS NOW. #BlackLivesMatter 
505,2020-06-06 02:23:37+00:00,15331,To the white people who say “I grew up poor. And have worked hard for everything I have. How can I possibly have white privilege?” Here’s where I break it down: #BlackVoicesMatter #BlackLivesMatter 
506,2020-06-06 02:16:50+00:00,107638,We turned on the night light for him so he dreams about #BlackLivesMatter Plaza 
507,2020-06-06 02:16:20+00:00,69,Love of my life #BlackLivesMatter 
508,2020-06-06 02:13:44+00:00,21,hi everyone i am selling 100% cotton handmade face masks in support of BLM! each mask is $8 and 100% of the proceeds will go towards whichever fund(link in bio) you pick! dm me to order :) #BlackLivesMatter 
509,2020-06-06 02:12:40+00:00,19159, . Kimberly I’m here for you!!!! And more importantly I hear you and will make change for US!! I will not stop until I see it. #BlackLivesMatter 
510,2020-06-06 02:11:58+00:00,456,"Twitter can we make this go viral?? June 19 ,2018 Jim Love snuck out his back door and through a field so he wouldn’t be seen after Xavier Hartman was in an accident in front of Jim’s home. He needed help, and this man brought a gun. #justiceforxavier #blacklivesmatter "
511,2020-06-06 02:11:27+00:00,313,Singing Happy Birthday to #BreonnaTaylor! #DefundPolice #GeorgeFloyd #JusticeForGeorgeFlyod #BlackLivesMatterchicago #LasVidasNegrasImportan #BlackLivesMatter #ChicagoProtests
512,2020-06-06 02:04:02+00:00,4838,"A #BlackLivesMatter march in Harvard, Nebraska—a town with fewer than 1,000 residents and exactly one African American man. Something is, indeed, happening in America and not just in big cities. (H/t @redcloud_scribe)"
513,2020-06-06 01:56:24+00:00,8385,Why didn’t #BlackLivesMatter to Democrats when they enslaved us? Why didn’t #BlackLivesMatter matter to Democrats when they segregated us? Why didn’t #BlackLivesMatter to Democrats when they told my great-grandmother to sit at the back of the bus?
514,2020-06-06 01:55:26+00:00,587,Tom Ellis out here speaking facts #blacklivesmatter 
515,2020-06-06 01:50:14+00:00,243,"Black people ignited a movement that brought down Jim Crow and passed the Civil Rights Act of 1964 the following year the Immigration and Nationality Act of 1965, abolishing the race-based immigration quota system. This is why all Immigrants must support #blacklivesmatter"
516,2020-06-06 01:44:26+00:00,19,"“This is not a moment, this is a movement.” #BlackLivesMatter "
517,2020-06-06 01:40:39+00:00,91,"NEXT TUESDAY 6/9 We have an opportunity &amp; responsibility to demand SFUSD cut financial ties with SFPD, while redirecting resources to services that are vital for the health &amp; well-being of students. We echo national demands to #DEFUNDPOLICE &amp; proclaim #BlackLivesMatter!! "
518,2020-06-06 01:37:37+00:00,303,"Peaceful protest in Temecula, CA today. Never thought I would see people come together in this town. #BlackLivesMatter pic.twitter.com/kBjTwpx4OR"
519,2020-06-06 01:37:36+00:00,47830,"As previously seen in the Iraq war, the U.S. regime forces are now conducting a 'hearts and minds' campaign to pacify protestors and insurrection as curfew approaches in Atlanta. ( @JennyJarvie) #ICantBreathe #GeorgeFloyd #BlackLivesMatter "
520,2020-06-06 01:32:16+00:00,415,#blacklivesmatter March for Racial Equaility in #bozeman. The largest protest in City history. pic.twitter.com/Fjeekgk4nu
521,2020-06-06 01:32:15+00:00,228,Your fight is OUR fight #BlackLivesMatter 
522,2020-06-06 01:32:06+00:00,43,"Peaceful Protest in Monessen tonight. “This is not a moment, it’s the movement.” #blacklivesmatter "
523,2020-06-06 01:23:34+00:00,3,first protest #BlackLivesMatter 
524,2020-06-06 01:17:47+00:00,1584,This is awesome ⁦@MayorBowser⁩! #BlackLivesMatter 
525,2020-06-06 01:15:53+00:00,6,"Protest for Justice in Cedar Hill, TX! #blacklivesmatter "
526,2020-06-06 01:09:53+00:00,656,The best white ally out there. #BlackLivesMatter 
527,2020-06-06 01:08:30+00:00,76,"I’m a little late, but I just watched #WhenTheySeeUs and all I can say is that Linda Fairstein, Elizabeth Lederer and every single person involved in the jogger case deserve to rot in hell for all eternity. #BlackLivesMatter"
528,2020-06-06 00:59:42+00:00,200,"It's time that we ask, #WhereAreTheBlackDesigners?"" Please join us in starting this conversation at our virtual conference on June 27th, 2020! #BlackLivesMatter "
529,2020-06-06 00:59:00+00:00,855,"MTV stands against police brutality and systemic racism. Enough is enough. #BlackLivesMatter We recognize that changes need to be made on our platforms, at our company, and in the entertainment industry as a whole."
530,2020-06-06 00:54:37+00:00,248,"dana point, california protest singing where is the love #blacklivesmatter "
531,2020-06-06 00:50:51+00:00,10,"GUYS THIS GIRL IS GOING TO UNIVERSITY OF TAMPA IN THE FALL, HER NAME IS BROOKE BEYMA. SHE IS COMING FROM GREECE ATHENA HIGH SCHOOL IN ROCHESTER NEW YORK. I NEED YOU ALL THE EMAIL HER SCHOOL admissions@ut.edu or conduct@ut.edu TO LET THEM KNOW ABOUT HER #blacklivesmatter "
532,2020-06-06 00:50:31+00:00,311,"Over 10,000 people in Edmonton, Alberta Canada. #BlackLivesMatter "
533,2020-06-06 00:48:25+00:00,59,Hawaii police showing up to protests in Aloha shirts instead of riot gear. #BlackLivesMatter 
534,2020-06-06 00:45:00+00:00,5348,I. Must. Speak. Out. #BlackLivesMatter 
535,2020-06-06 00:42:13+00:00,480,Loud and proud #blacklivesmatter #oatsstrong22
536,2020-06-06 00:41:21+00:00,789,"[thread] Want to hear something beautiful? The Autistic People of Color Fund (APOC) has received over $5,000 in donations in less than 4 Days! This grant program helps #autistic PoC &amp; their families w/food, shelter, homelessness, school, medicine, etc. #BlackLivesMatter"
537,2020-06-06 00:38:59+00:00,1442,Mac Miller has said more for #BlackLivesMatter than a lot of these celebrities right now 
538,2020-06-06 00:38:12+00:00,8,We must do better. We must take action. We must speak out. #BlackLivesMatter 
539,2020-06-06 00:37:57+00:00,20638,We reached out to our community and an unprecedented number of creators donated over 740 projects to be part of what we believe is the largest bundle ever. The Bundle for Racial Justice and Equality is now available #BlackLivesMatter 
540,2020-06-06 00:35:58+00:00,235,"As a Marine Biology PhD student, I care deeply about how our ocean communities are responding in support of the #BlackLivesMatter movement. I’ve been surprised and disheartened by the silence of so many orgs. #STEM #coralreefs"
541,2020-06-06 00:31:00+00:00,8,At the #ableg waiting for @jkenney to speak to his voters about #blacklivesmatter. Not sure when he is up. Anyone know ? 
542,2020-06-06 00:27:15+00:00,12,we fucking MARCHED today #BlackLivesMatter #BLM pic.twitter.com/sctavtv1ne
543,2020-06-06 00:24:03+00:00,223,"Marching down High Street in Portland, Maine, hour three of eight. #blacklivesmatter "
544,2020-06-06 00:22:24+00:00,130,Armed #BlackPanthers marching in the #BlackLivesMatter / #GeorgeFloyd protest in Atlanta:
545,2020-06-06 00:21:53+00:00,4,Amazing peaceful protest here in San Jose #BlackLivesMatter – at San Jose City Hall
546,2020-06-06 00:19:51+00:00,193,"#BlackLivesMatter Hollywood, Ca 6.2.20 "
547,2020-06-06 00:19:18+00:00,2477,".@woolworths how do you feel about your brand dominating and sharing a page that calls #BlackLivesMatter protestors “COVIDIOTS”? regardless of the wisdom of the demonstration, @theheraldsun has deliberately chosen an inflammatory, dismissive stance. you fund this @woolworths!"
548,2020-06-06 00:17:26+00:00,45,Come out! #blacklivesmatter #TampaProtests
549,2020-06-06 00:16:00+00:00,310,Black Lives Matter #BlackLivesMatter 
550,2020-06-06 00:12:34+00:00,5,"One of Breonna Taylor's murderers is also a RAPIST. Two women, Margo Borders & Emily Terry, have come forward with their stories about Brett Hankison. #metoo #SayHerName #BreonnaTaylor #LockHimUp #JusticeForBreonna #JusticeForBre #BlackLivesMatter "
551,2020-06-06 00:10:43+00:00,13,2020 Photo of the Year #BlackLivesMatter 
552,2020-06-06 00:06:59+00:00,480,"in honor of black lives and pride, i am doing a gc2b binder giveaway for a black trans person in need! - 2 winners! - no need to follow - rt=1 entry - giveaway ends next week, june 12, 12pm PDT qrt if you want to boost! #blacklivesmatter #pride"
553,2020-06-06 00:06:23+00:00,101,"#BlackLivesMatter rally today in Prince George, BC. "
554,2020-06-06 00:05:55+00:00,97074,I can not stop sobbing. Black lives matter because only a black man would be pulled over at gun point for MISSING A STOP SIGN. His 90 year old grandmother has fully broken me. WHEN IS THIS ENOUGH #blacklivesmatter 
555,2020-06-06 00:05:52+00:00,19,After I lost my uncle to a police shooting when I was 12 I hoped it would end in the future...I'm 19 and still hoping...thanks for all the support. Being a black woman is scary right now but we can push through together and make a change! #blacklivesmatter #nsfwVA #BlackArtist
556,2020-06-06 00:05:28+00:00,922,Fox News wants you to know Killing Black people is really Great for the Stock market! Investors make a lot of money! Are you fucking kidding me! Who posts this disgusting shit!? #BlackLivesMatter pic.twitter.com/aJ61DYBLQu
557,2020-06-06 00:05:17+00:00,50,"‘Target down’ Digital paint, 2020 #blacklivesmatter #PoliceBrutality"
558,2020-06-06 00:05:08+00:00,11459,#Idlib believes #BlackLivesMatter and shameful #POTUS hides behind his barricades
559,2020-06-06 00:05:04+00:00,358,"Happy Birthday BREONNA TAYLOR! From, Louisiana. #BlackLivesMatter "
560,2020-06-06 00:04:50+00:00,113,Prostest is also prayer #blacklivesmatter #saytheirnames
561,2020-06-06 00:04:06+00:00,6497,Out in these streets !! #BlackLivesMatter 
562,2020-06-06 00:03:46+00:00,124,Stand for something or fall for anything #BlackLivesMatter #GrabTheBaton
563,2020-06-06 00:03:29+00:00,2,"Washington, DC earlier today #BlackLivesMatter "
564,2020-06-06 00:03:26+00:00,12,"I’m 35 years old and I’ve literally never had @benandjerrys before but after these statements I feel I have to support! Thanks for coming out strong, @benandjerrys! All brands should follow your lead! #BlackLivesMatter "
565,2020-06-06 00:03:20+00:00,244,Dave Chappelle on the end of apartheid #blm #blacklivesmatter - The Bird Revelation (2018) 
566,2020-06-06 00:03:02+00:00,348,"#Providence #RhodeIsland made #History tonight with a youth-led #grassroots #protest to support #blacklivesmatter. There were an estimated 10K #revolutionaries in attendance, making this event the largest #rally *ever* held in the state."
567,2020-06-06 00:02:07+00:00,197,"Large rally today in support of #BlackLivesMatter in Knoxville, TN. My community &amp; I stand strong alongside our black brothers and sisters here in East TN and across the nation. But our support can’t stop once we return home from rallies. This isn’t a trend. It’s a movement. "
568,2020-06-06 00:01:12+00:00,1899,"Instead of tweeting #AllStars5 tonight, we'll be texting ""demands"" to 55156 to support the Black Community and #BlackLivesMatter. Join us. Research being a better ally with anti-racism resources: https://on.vh1.com/30f8El8 Donate to a bail fund: http://nationalbailout.org"
569,2020-06-06 00:01:02+00:00,45,"Photos from protests in NUTLEY, NEW JERSEY! Bring peaceful protest into your community and START CONVERSATIONS about #BLM #blacklivesmatter #nutleyforblacklives"
570,2020-06-06 00:01:00+00:00,767,Stop killing Black people. #BlackLivesMatter #RightsNow
571,2020-06-06 00:00:53+00:00,2086,This newly revealed piece of “Duel Of The Fates” concept art has some strong #BlackLivesMatter vibes! 
572,2020-06-06 00:00:42+00:00,199,"Today Team SFO came together and sat, knelt or stood in solidarity against racial injustice. I could not be more proud to be a part of this incredible family . #BlackLivesMatter @vjpassa @weareunited"
573,2020-06-06 00:00:24+00:00,16,"Bit of a boring post, but I was recommended by a friend to read this, and so far, absolutely amazing! if you haven't had the chance- this is an uncomfortable read, but it's so important that we educate ourselves. #BlackLivesMatter "
574,2020-06-06 00:00:18+00:00,86,"A thread about #BlackLivesMatter: I have been a teacher for 14 years. It is my life’s calling, and so much of my life is centered around it. Most of the people that I know and love are from my life as a teacher."
575,2020-06-06 00:00:10+00:00,9,I can't breathe #blacklivesmatter 
576,2020-06-06 00:00:09+00:00,1195,Actions speak louder than words #BlackLivesMatter 
577,2020-06-06 00:00:09+00:00,4,"Supporting Black-owned businesses by purchasing their products is one small, meaningful way you can voice and show your support for Black creators and their brands. #BlackLivesMatter "
578,2020-06-06 00:00:09+00:00,87,Change cannot happen without action and action cannot happen without dialogue and a coming together. #BlackLivesMatter #AllForUnity
579,2020-06-06 00:00:09+00:00,0,YouTube has deleted this video for being a scam when all they were doing was donating the revenue to #BlackLivesMatter charities. @YouTube wtf
580,2020-06-06 00:00:08+00:00,15,"We've compiled an ongoing list of donation funds, petition links, Black-owned businesses, protesting safety tips, and more. #BlackLivesMatter https://worldofwonder.net/ways-we-can-all-help-victims-families-and-get-involved-with-black-lives-matter-organizations/"
581,2020-06-06 00:00:07+00:00,0,This guy gets it! #blacklivesmatter 
582,2020-06-06 00:00:06+00:00,0,"It's a start, but more needs to be done. #Minneapolispd #GeorgeFlyod #blacklivesmatter "
583,2020-06-06 00:00:05+00:00,1,"I'm just in the boat that protests were kinda dumb when the left and right did it, even though I'm #blacklivesmatter and think small businesses should be allowed to safely operate to survive. There's a pandemic , "
584,2020-06-06 00:00:05+00:00,1,"If you're racist, fuck you, you don't deserve football. #BlackLivesMatter "
585,2020-06-06 00:00:05+00:00,0,This made my day U know we can live together peacefully #Blacklivesmatter #MuslimLivesMatter #AllLivesMatter
586,2020-06-06 00:00:04+00:00,0,I would like to protest for the NFL and all the white people who burned Nike’s and jerseys and such who are now pro-#blacklivesmatter to #APOLOGIZEtokaepernick @Kaepernick7 !!! He tried to tell the world but y’all crucified him and here we are today 
587,2020-06-06 00:00:04+00:00,21,"Tameka builds community, joy and strength. Tameka is Black Excellence. #BlackExcellence #BlackLivesMatter #BlackWomanMagic"
588,2020-06-06 00:00:04+00:00,2073,.@BTS_TWT showed their support for #BlackLivesMatter on Twitter and made a charitable donation. 
589,2020-06-06 00:00:03+00:00,5,"""In the United States, many black people are born into a life of trauma."" #blm #BlackLivesMatter #Trauma #learn #Listen #mentalhealth https://buff.ly/2AJGYtG"
590,2020-06-06 00:00:03+00:00,58,"it’s this lovely lady’s birthday today and she’s the most radiant ball of sunshine I’ve ever had the pleasure of meeting also all of her June income from twitch is going towards #BlackLivesMatter please do yourself a favor and go meet kim, she’s live now @bakerisbaking "
591,2020-06-06 00:00:03+00:00,10,my entry for a dtiys by @/tinanass.illustrations on ig but also for #BlackLivesMatter #PrideMonth #BLMartcommunity repost bc i think i accidentally deleted the original twt of this 
592,2020-06-06 00:00:02+00:00,3,"A gesture, a phrase said to make a stance, Black Lives Matter. #BlackLivesMatter @Clayritind @elisabethfaithh"
593,2020-06-06 00:00:01+00:00,1,YALL ARE STUPID #blacklivesmatter 
594,2020-06-06 00:00:01+00:00,0,Pray for the healing of all those who have been affected by racism and its consequences. #BlackLivesMatter #Pray4ChangeSunday #MournWithMe
595,2020-06-06 00:00:01+00:00,0,"A short film, the #African American protagonist will be shot by the white police no matter what he does for no reasons. Injustice, discrimination, and racism Helplessness, sadness, and sarcasm #BlackLivesMatter "
596,2020-06-06 00:00:00+00:00,2,"In recent weeks, they've reportedly shifted their focus to assisting the #BlackLivesMatter movement. "
597,2020-06-06 00:00:00+00:00,0,"This will be long but educational Please Read⁣ ⁣ To my white ""friends"" who know me because of the radio and or twitter calls us friends...⁣ Read this: https://bit.ly/2TRlAcD #BlackLivesMatter #ThisIsAmerica"
598,2020-06-06 00:00:00+00:00,16,Let’s get this #BlackLivesMatter follow train goin
599,2020-06-06 00:00:00+00:00,7,Plaques have appeared underneath street names in Glasgow with anti-slavery alternatives #BlackLivesMatter 
600,2020-06-06 00:00:00+00:00,6,#ICYMI: The White House is located on #BlackLivesMatter street! A reminder that we built this country! https://www.usatoday.com/story/news/politics/2020/06/05/black-lives-matter-mural-painted-near-white-house-mayors-behest/3153364001/ #ShiftHappens
601,2020-06-06 00:00:00+00:00,0,"WE ALL #MADA. You matter, They matter, We all /ˈmadər/. Make America Diverse Again // MAKE US #MADA // And because #BlackLivesMatter"
602,2020-06-06 00:00:00+00:00,22,"You don’t speak for me @paulgazelka. #IAmASuburbanMom and #BlackLivesMatter does not scare me. I am, however, tired as hell of old white men who abuse power and work against equality."
603,2020-06-06 00:00:00+00:00,590,#BlackLivesMatter 
604,2020-06-06 00:00:00+00:00,98,"El movimiento #BlackLivesMatter toma el control de las cuentas de @ladygaga y @selenagomez en Instagram, con más de 220 millones de seguidores entre ambas "
605,2020-06-06 00:00:00+00:00,33,This has been an emotional week for all of us. We encourage all of you to tune in to #DLUncut now as @RealDLHughley discusses how to move the community forward with @iamjamiefoxx @killermike and @kirkfranklin. #BlackLivesMatter Watch - http://bit.ly/LOLPLUTOTV
606,2020-06-06 00:00:00+00:00,0,#amazon #ethics #blacklivesmatter 
607,2020-06-06 00:00:00+00:00,0,"أوساكا: ""ليس لأن الأمر لم يحدث لك يعني أنه لا يحدث"" https://www.albawaba.com/ar/%D8%A5%D8%AE%D8%AA%D9%8A%D8%A7%D8%B1-%D8%A7%D9%84%D9%85%D8%AD%D8%B1%D8%B1/%D8%A8%D8%B9%D8%AF-%D8%AA%D8%B9%D8%B1%D8%B6%D9%87%D8%A7-%D9%84%D9%84%D8%AA%D9%86%D9%85%D8%B1-%D8%A8%D8%B3%D8%A8%D8%A8-%D8%A8%D8%B4%D8%B1%D8%AA%D9%87%D8%A7-%D9%84%D8%A7%D8%B9%D8%A8%D8%A9-%D8%A7%D9%84%D8%AA%D9%86%D8%B3-%D8%A7%D9%84%D9%8A%D8%A7%D8%A8%D8%A7%D9%86%D9%8A%D8%A9-%D8%A3%D9%88%D8%B3%D8%A7%D9%83%D8%A7-%D8%AA%D8%AF%D8%B9%D9%85-%D8%A7%D8%AD%D8%AA%D8%AC%D8%A7%D8%AC%D8%A7%D8%AA-%D8%A3%D9%85%D8%B1%D9%8A%D9%83%D8%A7 #NaomiŌsaka #BlackLivesMatter"
608,2020-06-06 00:00:00+00:00,38," Over 450 state, local, &amp; national orgs stand in solidarity with #BlackLivesMatter. Together, we commit to dismantling white supremacy, white nationalism, &amp; the anti-Blackness that permeates our society, including within our movement. Read our letter: https://www.nilc.org/wp-content/uploads/2020/06/Letter-of-Solidarity-from-the-Immigrant-Justice-Movement-with-Signatories-6.5.20.pdf"
