,Datetime,Favorites,Text
331,2020-06-06 15:43:03+00:00,11175,The #BlackLivesMatter protest in Piccadilly Gardens #Manchester right now.
332,2020-06-06 15:40:38+00:00,219,he’s a gallaudet student. loves to play football and wrestle too. he had a bright future in front of him but his life was cut short. SAY HIS NAME! #EricSmith #BlackDeafLivesMatter #BlackLivesMatter 
333,2020-06-06 15:29:39+00:00,2835,For my all lives matter folks. We want you to understand. #BlackLivesMatter #alllivesmatter
334,2020-06-06 15:26:51+00:00,1030,"Peaceful protest at Christchurch Park, Ipswich. The people take a knee for eight minutes and forty three seconds. #BlackLivesMatter "
335,2020-06-06 15:25:00+00:00,4506,#BlackLivesMatter. More information: https://go.sony.com/3dBam3W
336,2020-06-06 15:22:34+00:00,2,i am black and i am proud #BlackLivesMatter 
337,2020-06-06 15:08:06+00:00,4556,"As the media and general public continue to erase #TonyMcDade, a Black trans man killed by Tallahassee police last week. Help by sending an email to officials demanding that those officers are fired. #BlackLivesMatter template by @/meghan_flowers on IG http://tinyurl.com/yanbmcf3"
338,2020-06-06 15:04:11+00:00,1879,"Hundreds (I’d estimate 500) at the #BlackLivesMatter demo in the shadow of the Cathedral on Palace Green, Durham. Socially distanced, disciplined &amp; average age around 20, I’d say. Very inspiring &amp; moving. #ICantBreathe"
339,2020-06-06 15:00:18+00:00,102,gen z will change the world #BLACK_LIVES_MATTER #blacklivesmatter 
340,2020-06-06 14:58:30+00:00,169,"Thousands turn out for a #BlackLivesMatter demonstration at Piccadilly Gardens and Market Street, Manchester, UK. "
341,2020-06-06 14:57:12+00:00,6920,It’s not the ANTIFA or #BlackLivesMatter radicals who are gonna tip us over the edge. It’s every witless stooge who goes along with them because they don’t understand what’s happening. Very similar to people on the Right supporting lockdowns. It’s the naïveté that’s kills us.
342,2020-06-06 14:52:47+00:00,57,#lilwayne talking about #BlackLivesMattters is priceless. #RealTalk #GOAT #bestrapperalive #blm #blacklivesmatter 
343,2020-06-06 14:52:20+00:00,681,Heated scenes as people have arrived at the #blacklivesmatter protest holding a sign in that says “White lives matter”. Not long before it’s snatched away and torn up. @LBC @LBCNews
344,2020-06-06 14:51:24+00:00,794,We looked at Fox News advertisers in recent weeks. Many of them have claimed to support Black Lives Matter on social media. Full list: https://www.mediamatters.org/fox-news/fox-news-advertisers-claim-support-black-lives-matter-social-media #FoxNewsisRacist #BlackLivesMatter
345,2020-06-06 14:49:10+00:00,17938,"As my brother Paul said The Beatles always stood for equal rights&justice and I’ve never stopped working for peace&love ever since. #blacklivesmatter,#peaceispossible-I send my peace love&amp;continuous support to everyone marching &amp; speaking up for justice &amp; a better world "
346,2020-06-06 14:38:30+00:00,45,Humans are the real monsters. #animallivesmatter #JusticeForZohra #BlackLivesMatter 
347,2020-06-06 14:37:40+00:00,6,"#BlackLivesMatter When two minds can find peace together, what does color matter? - Bhante Venerable Bhante Sujatha "
348,2020-06-06 14:20:19+00:00,76,Sydney for #BlackLivesMatter and #AboriginalLivesMatter. The fight against racism and fascism is global.
349,2020-06-06 14:18:05+00:00,725,Keep up to date with the several #BlackLivesMatter protests taking place in the UK. #BLM
350,2020-06-06 14:16:07+00:00,182,A symbol of our support for #BlackLivesMatter at @ZuckermanBrain
351,2020-06-06 14:15:12+00:00,18,shot of BLM movement protest in Brisbane Australia #BlackLivesMatter 
352,2020-06-06 14:15:10+00:00,1149,#CNNSesameStreet: Elmo and his dad were on CNN this morning explaining the purpose of the #BlackLivesMatter protests. 
353,2020-06-06 14:13:40+00:00,581,"The protest in Seoul, South Korea, in support to #BlackLivesMatter "
354,2020-06-06 14:07:53+00:00,5,#blacklivesmatter protest in shrewsbury today. 
355,2020-06-06 14:07:37+00:00,1181,RISE and RUN Dallas Solidarity PRIDE 5k Run/Walk! #BlackLivesMatter #BlackTransLivesMatter
356,2020-06-06 14:06:52+00:00,11303,This is definitely the biggest crowd I've ever seen in Manchester for a protest #BlackLivesMatter 
357,2020-06-06 14:12:37+00:00,5,My favourite sign today #BlackLivesMatter 
358,2020-06-06 14:12:35+00:00,2263,protesters have stuck #blacklivesmatter signs on the statues in parliament square #BLMLDN – at Parliament Square
359,2020-06-06 14:06:23+00:00,2092,0161 says racism can do one #blacklivesmatter 
360,2020-06-06 14:06:00+00:00,1103,A young lady waiting for a bus in Crystal Palace opposite the #BlackLivesMatter #BLMLondon protest took the knee...that’s power
361,2020-06-06 14:04:49+00:00,220,HAMBURG TODAY: 500 permitted. ~ 15.000 came. Statement. #hh0606 #BlackLivesMatter 
362,2020-06-06 14:03:19+00:00,54,Milo Yiannopoulos doing what he does best. Please share so I can get blocked by more illiiberal-liberals #BlackLivesMatter 
363,2020-06-06 13:59:40+00:00,26,Perfect answer to Bollywood propagandists on #BlackLivesMatter by #KanganaRanaut
364,2020-06-06 13:58:01+00:00,6143,I’m proud to see people coming together in solidarity to march against injustice and say #BlackLivesMatter. But I say to Johnson and the Govt: don’t you dare try to shift the blame onto protesters if there’s a second #COVID19 peak! My @MetroUK column 
365,2020-06-06 13:57:57+00:00,51,The times they are a changin’ #blacklivesmatter – at Capitol Hill Neighborhood
366,2020-06-06 13:56:06+00:00,186,"My name, Liam Ayowale and I’m Sickle Cell carrier. Unfortunately I won’t be at the BLM protests. Instead I’ll continue supporting by offering my IT services free throughout 2020! • Hardware Repairs/Upgrades • Software Packages • Network Managment #BlackLivesMatter "
367,2020-06-06 13:50:56+00:00,2095,Italy today. United to stand against racism. #BlackLivesMatteritaly #BlackLivesMatter 
368,2020-06-06 13:41:49+00:00,4809,"The #BlackLivesMatter movement has spread to Japan, a nation where challenging authority is rare. Thousands gathered in Tokyo to protest the death of George Floyd "
369,2020-06-06 13:32:38+00:00,505,so many people turned up today at the manchester protest! #BlackLivesMatter 
370,2020-06-06 13:31:59+00:00,76,"N.B I am *only* interested in a move towards a World and a Church in which ALL #BlackLivesMatter That includes Black LGBTQ+ lives. And I have EVERY eye on all of you, of every hue, who are only prepared to do half the work and who just want peace without justice and equality."
371,2020-06-06 13:28:41+00:00,7239,Everyone just took the knee here between Parliament Square and Downing Street. #BlackLivesMatter @LBC
372,2020-06-06 13:27:42+00:00,22,New @banksy about #blacklivesmatter 
373,2020-06-06 13:22:06+00:00,40,When art can make a powerful statement. #Banksy #BlackLivesMatter 
374,2020-06-06 13:15:53+00:00,51,We are not born racist #BlackLivesMatter #Sheffield
375,2020-06-06 13:13:55+00:00,760,"Me too, buddy. Me too. #BlackLivesMatter "
376,2020-06-06 13:05:00+00:00,4,Glow your skin with SHEA GOLD Available in wholesale and retail Very affordable.. Contact 0248313831/0547201419 for yours now Please retweet this for me...my customer may be on your TL #AccraBlackOut #BlackLivesMatter #TropicalHouseCruisesToJamaica Nana Aba Sarkodie
377,2020-06-06 13:02:59+00:00,6854,Thread of Businesses ran by Black Harry Styles Fans #BlackLivesMatter
378,2020-06-06 12:59:24+00:00,8,Heaton knows the score. #BlackLivesMatter 
379,2020-06-06 12:57:52+00:00,2327,Crowd moving towards Market St #BlackLivesMatter #manchesterprotests #Manchester
380,2020-06-06 12:47:13+00:00,15364,LOOK: Aerial footage shows thousands of people gathered in London's Parliament Square to protest against George Floyd's death and police brutality #BlackLivesMatter 
381,2020-06-06 12:38:35+00:00,15,That’s on #racism pooh #BlackLivesMatter 
382,2020-06-06 12:35:08+00:00,855,Hundreds of south Londoners take a knee and chant #BlackLivesMatter on Tooting Bec common 
383,2020-06-06 12:32:02+00:00,197,BLACK LIVES MATTER 1000s here in Cardiff #Cardiff #Caerdydd @YesCymru in solidarity with #BLM #BlackLivesMatter 
384,2020-06-06 12:27:26+00:00,2429,"‘This is the scene, right now, in central London. 'Despite the rain, thousands are standing in solidarity with the family of George Floyd’ #BlackLivesMatter protests are taking place throughout the UK today More here: https://www.itv.com/news/2020-06-06/thousands-expected-to-attend-black-lives-matter-protests-across-uk-as-public-warned-against-mass-gatherings/"
385,2020-06-06 12:24:37+00:00,21480,"Hi, I’m a 20 year old Nigerian Male, I’m an aspiring concept artist and illustrator, I enjoy making fictional environments and characters that are African themed, and I’m proud to be #drawingwhileblack #BlackLivesMatter #blackartists #blackart"
386,2020-06-06 12:21:18+00:00,6,Banksy’s latest mark #banksy #banksyart #blacklivesmatter 
387,2020-06-06 12:21:11+00:00,231,Powerful stuff from #Banksy. Just incredible. #BlackLivesMatter 
388,2020-06-06 12:20:53+00:00,4095,A few of the signs on show today. #BlackLivesMatter #BlackLivesMatterUK #MCRBLM
389,2020-06-06 12:18:41+00:00,5,The man can't even quote a verse out of the bible. #BlackLivesMatter 
390,2020-06-06 12:15:30+00:00,2097,Leicester I am so proud of you. The revolution will be televised. #NOJUSTICENOPEACE #BlackLivesMatter 
391,2020-06-06 12:14:57+00:00,7529,Now: Thousands protesting at Berlin's Alexanderplatz. #BlackLivesMatter 
392,2020-06-06 12:09:06+00:00,146,"As companies rushed to support #BlackLivesMatter, their words often rang hollow. Bottom line: big business has exacerbated inequality, targeted minorities, and failed to hire, promote and fairly compensate black men and women. My Sunday Biz cover. 1/ "
393,2020-06-06 12:07:41+00:00,614,it's important to remember that it wasn't the government or some big international organization that rallyed all of us in Winnipeg. it was our YOUNG BLACK WOMEN who stood up and led the charge. this thread highlights them #JUSTICE4BLACKLIVESWINNIPEG #BlackLivesMatter 
394,2020-06-06 12:05:51+00:00,224,Every woke leftie liberal ‘skinny latte extra shot’ attending #londonprotests today for #BlackLivesMatter should listen to this 
395,2020-06-06 12:04:08+00:00,15,Not been on protest for years. Many ppl - including those I love - feel I’m putting others at risk. I just feel moments for change are fleeting and I’ve been passive for to long. #BlackLivesMatter 
396,2020-06-06 12:04:03+00:00,11,Just taking pics in #jozi #SingleFlames #BlackLivesMatter 
397,2020-06-06 12:01:36+00:00,47,I have a responsibility. #BlackLivesMatter 
398,2020-06-06 11:59:52+00:00,4615,DON'T STOP DON'T STOP DON'T STOP DON'T STOP DON'T STOP DON'T STOP DON'T STOP DON'T STOP DON'T STOP DON'T STOP DON'T STOP DON'T STOP DON'T STOP DON'T STOP WE HAVE TO KEEP FIGHTING! #BlackLivesMatter http://blacklivesmatters.carrd.co
399,2020-06-06 11:56:52+00:00,1310,"WATCH VIDEO - the truth of what’s happening right now with the riots, protests #blacklivesmatter and #alllivesmatter watch and RT the truth."
400,2020-06-06 11:55:49+00:00,442,1/2 It’s been a dark week. I’ve been trying to process everything & when I feel like this I often turn to art to help make sense & get a feeling of empowerment to channel pain. I found myself revisiting a project (Instagram) @__adey__ and myself had started... #BlackLivesMatter 
401,2020-06-06 11:53:57+00:00,2,#BlackLivesMatter we are the black community 
402,2020-06-06 11:51:25+00:00,3,#BlackLivesMatter #OtherSideOfAmerica #MeekMill Meek is a big Voice
403,2020-06-06 11:36:19+00:00,1642,#blacklivesmatter protest at Central Milton Keynes station. 
404,2020-06-06 11:33:19+00:00,22,It’s really just this simple... #BlackLivesMatter 
405,2020-06-06 11:31:52+00:00,34,. The coming of the Saviour has been guaranteed by the God. Let's pray for it... He will not abuse his power; He will not take advantage of people; He will rule with kindness and justice. #ThePromisedSaviour #BlackLivesMatter 
406,2020-06-06 11:28:43+00:00,4371,PLEASE GO VOTE!!! #BlackLivesMatter 
407,2020-06-06 11:26:29+00:00,1294,#Banksy #BlackLivesMatter The brilliant Banksy 
408,2020-06-06 11:22:04+00:00,1103,Let’s talk contracts and collective bargaining... unions try to create voice & fairness & better working conditions for our members. Contracts should protect against false allegations but they should never shield misconduct. Not for police or anyone . #BlackLivesMatter
409,2020-06-06 11:16:52+00:00,295,"To all those in India who had so passionately trended #BlackLivesMatter You can still save George floyd. She's Alive, languishing in prison, and she's pregnant. #FreeSafooraZargar"
410,2020-06-06 10:52:55+00:00,842,"NEW BANKSY ""It's not their problem, it's mine"" #BlackLivesMatter "
411,2020-06-06 10:49:54+00:00,213,"Hi! We're a collective building a book of short TTRPG adventures for a variety of systems including D&D, MÖRK BORG & Trophy Gold to raise money for #blacklivesmatter bail funds We'll be publishing next Thursday so give us a follow to keep up to date! #RPG4BLM"
412,2020-06-06 10:44:00+00:00,4,All lives can’t matter until #BlackLivesMatter 
413,2020-06-06 10:41:59+00:00,6860,New Banksy #BlackLivesMatter 
414,2020-06-06 10:37:56+00:00,18566,Let’s all meet here soon. #BlackLivesMatter 
415,2020-06-06 10:37:45+00:00,123,We have put together a guide on how to protest safely #BlackLivesMatter 
416,2020-06-06 10:28:03+00:00,170,Together with @R_Forwards we acknowledge racial injustice around the world and stand with #BlackLivesMatter in the #rstats community. Read our joint statement at https://blog.rladies.org/post/blm/ #rladies 1/n
417,2020-06-06 10:26:22+00:00,425,some tips for hijabi protestors (c/o hautehijab) #BlackLivesMatter 
418,2020-06-06 10:16:32+00:00,20,Glasgow's Miles Better . . . . #BlackLivesMatter 
419,2020-06-06 10:11:46+00:00,6427,"This is Sean Rigg. Arrested for exhibiting “strange behaviour” in the street. Chased by four officers, leant on for 8 minutes. Suffered cardiac arrest in police van. Officers didn’t call 999 claiming he was “faking it”. He died. In BRIXTON, LONDON, UK. #BlackLivesMatter #BLMUK"
420,2020-06-06 10:05:22+00:00,9,Lol my brothers are all Jay Ellis. Shout #BlackLivesMatter then go home to their white neighborhoods and white wives. 
421,2020-06-06 09:59:27+00:00,300,One of my heroes. Not a week goes by I don’t quote her words & writing to someone. MAYA ANGELOU “STILL I RISE” #BlackLivesMatter 
422,2020-06-06 09:58:54+00:00,189,DID SHE LIE? DID SHE LIE? DID SHE FUCKING LLLLLLLIE? #BlackLivesMatter pic.twitter.com/5kBVRQYoVc
423,2020-06-06 09:32:07+00:00,524,This is #Gujarat #India #RSS lynching black migrant workers. #BlackLivesMatter #BLM
424,2020-06-06 09:31:36+00:00,20,"""We know that education can and should play a role in tackling racism."" #BlackLivesMatter "
425,2020-06-06 09:21:36+00:00,14327,Proud to be one of 166 MPs calling for UK to stop teargas and rubber bullet exports to America. We should not be helping Donald Trump repress his own people #blacklivesmatter #LDNBLM
426,2020-06-06 09:14:21+00:00,42,"NYC MathTeacher here. Join me in urging electeds to ask @DOEChancellor explain why responding to #BlackLivesMatter w ""AllLivesMatter"" is not ok. It is awkward, exhausting &amp; not the responsibility of PoC to educate colleagues uncomfortable discussing race. 1.1M kids deserve better "
427,2020-06-06 08:55:14+00:00,7913,New message when you load up Apex Legends. #BlackLivesMatter 
428,2020-06-06 08:53:05+00:00,4565,Britain first are a bunch of racist scum bags and need their heads flushing down the loo. #BlackLivesMatter 
429,2020-06-06 08:46:30+00:00,44,Ya don’t use the word “CRACKER” . #BlackLivesMatter 
430,2020-06-06 08:34:35+00:00,1910,"More than 50,000 people showed up to today’s #Sydneyprotest in support of #BlackLivesMatter "
431,2020-06-06 08:19:20+00:00,634,The island nation of Guam stands with you #BlackLivesMatter 
432,2020-06-06 08:18:50+00:00,328,The aerial view of THAT Washington DC street painting is a sight to behold.... #BlackLivesMatter 
433,2020-06-06 08:09:10+00:00,72,I can’t believe my eyes... #katerajenkins #justiceforkaterajenkins #blacklivesmatter 
434,2020-06-06 08:08:03+00:00,126,"The Tokyo rally against police racism marched for 90 mins. It’s a small thing to do, but I’m glad I was there. This is a problem in Japan. This is a problem in America. And if you think it isn’t a problem where you are, I guarantee you’re not paying attention. #BlackLivesMatter "
435,2020-06-06 07:57:51+00:00,407, Lithuania showing support for #BlackLivesMatter 
436,2020-06-06 07:53:26+00:00,5,Muslim lives matter too. There is no racism in Islam. #BlackLivesMatter #MuslimLivesMatter
437,2020-06-06 07:51:25+00:00,11,Beauty at her finest... #BlackLivesMatter 
438,2020-06-06 07:47:30+00:00,298,we got the monks guys GO GO GO GO GO GO WHOS NEXT ??? #blm #blmprotest #blmprotestsydney #Sydneyprotest #protest2020 #protest #2020Protests #blacklivesmatteraustralia #blacklivesmatter #blacklivesmatterprotests
439,2020-06-06 07:44:16+00:00,90,Saw this at the Brisbane protest today! They held it for an hour #Brisbaneprotest #BlackLivesMatter 
440,2020-06-06 07:38:09+00:00,57,was feeling a little creative #BlackLivesMatter 
441,2020-06-06 07:29:09+00:00,1032,"Idk who made this, but I am screaming #BLM #Benandjerrys #BlackLivesMatter "
442,2020-06-06 07:22:28+00:00,40,Was handed to me at a #blacklivesmatter protest. Anaheim PD is using MRDEW (microwave radiation directed energy weapons) on civilians! These are military grade and are used on regular people in their homes! This is inhumane and must be stopped. 
443,2020-06-06 07:22:00+00:00,572,"black lives matter protest in brisbane, australia #BlackLivesMatter #protest2020 #GeorgeFloydProtests #brisbane #australia #AboriginalLivesMatter #NoJusticeNoPeaceProsecuteThePolice"
444,2020-06-06 07:01:50+00:00,3,LISTEN TO BLACK VOICES #BlackLivesMatter #blm
445,2020-06-06 07:00:00+00:00,413,We kneel together #blacklivesmatter 
446,2020-06-06 06:54:55+00:00,54,Young black king #BlackLivesMatter 
447,2020-06-06 06:52:35+00:00,6,#BlackLivesMatter in my neighbourhood! 
448,2020-06-06 06:48:23+00:00,1765,"Unreal this is Sydney, Australia at this very moment marching for #BlackLivesMatter "
449,2020-06-06 06:46:22+00:00,26126,OMFG: The @SeattlePD just refused to let an AMBULANCE through a peaceful protest. Absolutely disgraceful. #DefundSPD #BlackLivesMatter 
450,2020-06-06 06:31:07+00:00,179,Sunnyvale is a bubble and we are more than privileged to be able to have a peaceful protest unlike many other places. Use your voice and spread love #blacklivesmatter 
451,2020-06-06 06:26:16+00:00,30573,Melbourne #blacklivesmatter protest ⁦@theheraldsun⁩ pic.twitter.com/XUMOZEPyWt
452,2020-06-06 06:25:59+00:00,6,Our lives matter too.stop killing us #BlackLivesMatter. 
453,2020-06-06 06:16:13+00:00,6,No justice no peace Fuck police #BlackLivesMatter pic.twitter.com/Hzpn5LiSN6
454,2020-06-06 06:05:28+00:00,38,"More than 1,000 people at Lismore’s #blacklivesmatter rally. "
455,2020-06-06 06:04:56+00:00,7,LONDON #BlackLivesMatter #londonprotest #london
456,2020-06-06 05:58:15+00:00,48,This is how some of you sound... like for real... #BlackLivesMatter #PoliceBrutality #ATLA
457,2020-06-06 05:52:33+00:00,232,If Clay Jensen was black he would have been shot #BlackLivesMatter #13reasonswhyseason4
458,2020-06-06 05:51:22+00:00,227,What it’s like getting on Twitter vs Instagram right now #BlackLivesMatter 
459,2020-06-06 05:37:56+00:00,22027,#blacklivesmatter Link in bio for ways to help. 
460,2020-06-06 05:36:11+00:00,118,take a break from watching videos of police brutality and enjoy this vid from today’s peaceful protest in LA #BlackLivesMatter 
461,2020-06-06 05:30:58+00:00,853,Listen to the chants! Pretty mesmerizing !! #BlackLivesMatter 
462,2020-06-06 05:29:10+00:00,112,"When I say I come from a small, white, conservation town this is what I mean: #BlackLivesMatter protestors were PEACEFUL the whole time "
463,2020-06-06 05:24:02+00:00,85,"Providence, Rhode Island #BlackLivesMatter "
464,2020-06-06 05:18:43+00:00,2609,"Raw video from an anti-racism rally taking over downtown Edmonton streets Friday, where in a show of solidarity Edmonton police took a knee and participated in a moment of silence with peaceful protesters shortly before 11 p.m. #BlackLivesMatter #yeg #yegdt"
465,2020-06-06 05:18:31+00:00,1833,Sydney Town Hall #BlackLivesMatter 
466,2020-06-06 05:09:06+00:00,128,#BLACKLIVESMATTER ARE YOU LISTENING? 
467,2020-06-06 05:07:27+00:00,151,"san jose showed out today at the protest, proud of my city #sanjoseprotest #BlackLivesMatter "
468,2020-06-06 05:04:55+00:00,7300,"All you mob, here they are, Barristers Stephen Lawrence and Felicity Graham, fighting for our mob all the way from Dubbo and winning the #blacklivesmatteraustralia Court of Appeal decision! Huge thanks to these legal geniuses and fighters for our mob #BlackLivesMatter "
469,2020-06-06 04:53:39+00:00,4767,"Urooj Rahman, the Pakistani human rights attorney accused of carrying out firebombing attacks at a Manhattan riot, gave an interview the same night where she said, “This s–t won’t ever stop unless we f–kin’ take it all down."" https://nypost.com/2020/06/05/molotov-lawyer-urooj-rahman-blames-de-blasio-for-not-calling-off-nypd/?utm_campaign=SocialFlow&amp;utm_source=NYPTwitter&amp;utm_medium=SocialFlow #antifa #BlackLivesMatter "
470,2020-06-06 04:50:51+00:00,337,Now that's a protest #blacklivesmatteraustralia #BlackLivesMatter #AboriginalLivesMatter #blm #adelaide #Australia
471,2020-06-06 04:47:59+00:00,444,The people can march!!! Power to the people!!! #blacklivesmatteraustralia #BlackLivesMatter 
472,2020-06-06 04:46:20+00:00,1828,#Breaking: NSW Court of Appeal has ruled Sydney #blacklivesmatter protest IS an authorised public assembly
473,2020-06-06 04:38:04+00:00,351,"I have been working on making profile header images for LGBTQ+ LEGO fans to celebrate #Pride month, but considering the more important current events I also felt I should make one to show support for #BlackLivesMatter. Use as you like. #LGBTQIA #PeopleOfColorMatter"
474,2020-06-06 04:33:00+00:00,1624,Holy shit in Dallas today they used the protest tactic of blocking off the highway - with their cars. #BlackLivesMatter pic.twitter.com/Nb9p6v5Mid
475,2020-06-06 04:28:10+00:00,195,"#BlackLivesMatter Brisbane really stepping up with a protest of 30,000 "
476,2020-06-06 04:20:29+00:00,21,Even Avatar Kyoshi says #BlackLivesMatter 
477,2020-06-06 04:19:23+00:00,2,Show Up! #BlackLivesMatter 
478,2020-06-06 04:14:27+00:00,12,Some images from around the #seattleprotests #CapitolHill area for the immunocompromised comrades who cant come out to support #BlackLivesMatter 
479,2020-06-06 04:11:20+00:00,276,Thousands of people have hit the streets for #BlackLivesMatter demonstrations around the country. 
480,2020-06-06 04:07:48+00:00,1199,"EVERYONE NEEDS TO WATCH THIS. #SandraBland talks about why #BlackLivesMatter before she was harassed unnecessarily arrested, injured &amp;murdered. Retweet "
481,2020-06-06 04:05:22+00:00,147,#Vancouver showed up today! Aerial view of the protest today. #BlackLivesMatter 
482,2020-06-06 03:59:53+00:00,10,Just hangin' wit my queens and my oh so delicious black kings ! #snowbunny #blackmenonly #BlackLivesMatter pic.twitter.com/P6aO2LeoMa
483,2020-06-06 03:57:53+00:00,29,I have opened a fundraiser for bail for American protesters in our boys' names. Please help if you can #BlackLivesMatter #BlackOutTuesday https://secure.givelively.org//donate/the-bail-project/kim-hanbin-kim-jinhwan-kim-jiwon-song-yunhyeong-koo-junhoe-kim-donghyuk-jung-chanwoo
484,2020-06-06 03:50:47+00:00,67,It’s time for action! More detailed demands coming soon... #blackducksmattertoo #blacklivesmatter 
485,2020-06-06 03:45:40+00:00,164,Vancouver police officers on their knees after some passionate protesters demanded. #BlackLivesMatter #vancouverprotest
486,2020-06-06 03:42:09+00:00,1470,"Organisers saying over 30,000 people marching in Brisbane. #blacklivesmatter "
487,2020-06-06 03:33:47+00:00,20,"𝘽𝙡𝙚𝙨𝙨𝙚𝙙 𝙩𝙤 𝙨𝙚𝙚 26 𝙩𝙤𝙙𝙖𝙮..!!! 𝘾𝙖𝙣’𝙩 𝙖 𝙎𝙤𝙪𝙡 𝙤𝙣 𝙩𝙝𝙞𝙨 𝙀𝙖𝙧𝙩𝙝 𝙩𝙚𝙡𝙡 𝙢𝙚 𝙤𝙧 𝙢𝙮 𝙥𝙚𝙤𝙥𝙡𝙚 𝙩𝙝𝙖𝙩 𝙤𝙪𝙧 𝙡𝙞𝙫𝙚𝙨 𝙙𝙤𝙣’𝙩 𝙢𝙖𝙩𝙩𝙚𝙧, 𝙬𝙝𝙚𝙣 𝙬𝙚 𝙝𝙖𝙫𝙚 𝙧𝙤𝙮𝙖𝙡𝙩𝙮 𝙛𝙡𝙤𝙬𝙞𝙣𝙜 𝙩𝙝𝙧𝙤𝙪𝙜𝙝 𝙪𝙨 !!! #BlackLivesMatter "
488,2020-06-06 03:30:21+00:00,585,#Catholics in New Orleans hittin the streets! #BlackLivesMatter 
489,2020-06-06 03:23:41+00:00,41,My mom managed to relate my appendicitis to #BlackLivesMatter and I love it 
490,2020-06-06 03:23:15+00:00,611,Reclaim the Block has received a ton of donations already and has released a huge list of other pro-black organizations they’d like you to donate to instead! I’ll post the link to the google doc in this thread. #blacklivesmatter #abolishthepolice
491,2020-06-06 03:20:45+00:00,3780,"Teen choked and arrested for selling water in Las Vegas....good thing they were there to take this criminal off the streets, who knows what might’ve happened #BlackLivesMatter "
492,2020-06-06 03:19:10+00:00,924,The #BlackLivesMatter rally in #Brisbane is easily the largest one there’s been in King George Square since it was re-‘developed’ over ten years ago. Crowds spilling out down surrounding streets on all sides - reminiscent of the Iraq War rally in 2003 #AboriginalLivesMatter
493,2020-06-06 03:18:09+00:00,33,Cute 4th of July shirt idea! All proceeds go to #BlackLivesMatter 
