,Datetime,Favorites,Text,Retweets
327,2020-06-22 15:06:30+00:00,682,"This isn't a ""show"", it's blatant intimidation. A defiant show of force. In a historic neighborhood where thousands of people of color live. At 3 f'ing AM! Likely, with no permission or warning. Disgusting, abusive and inexcusable. @NYGovCuomo @NYPDShea #BlackLivesMatter",155
328,2020-06-22 15:04:14+00:00,2532,Allllsooooooooo In this house we #speakout #blacklivesmatter Want the cops arrested for #BreonnaTayor And #JusticeForGeorgeFloyd These aren’t bandwagon hashtags these are REAL ISSUES that affect REAL PEOPLE. Be good to each other y’all,629
329,2020-06-22 15:03:42+00:00,29," MILWAUKEE please retweet + share! we are looking any Black/Brown performers, vendors, and organizers OR individuals to be a part of the caravan. #blacklivesmatter #MKE ",60
330,2020-06-22 15:01:16+00:00,349,"Incase y'all forgot! It's still FUCK STARLITE DRUGS!!! this is from a current employee at starlite, I obviously had to block her name. #BlackLivesMatter #TTBLM pic.twitter.com/rPkwAh5Fo4",329
331,2020-06-22 14:56:41+00:00,58,Housing justice is racial justice. #BlackLivesMatter ,30
332,2020-06-22 14:54:57+00:00,113,"#BlackLivesMatter is brought to you with the full support and backing of J**ish neoliberal international capitalism and anti-White plutocratic corporations. “If you think otherwise, you’re a fool.” -Sam Hyde ",46
333,2020-06-22 14:54:56+00:00,416,Bike protest in New York this weekend! Energy is being kept! #BlackLivesMatter || Instagram/pynges ,103
334,2020-06-22 14:52:58+00:00,43,A lot of White Christians against #BlackLivesMatter are bout to be mad when they realize the God they serve stands FOR Justice and stands FOR the oppressed. Psalms 103:6 Psalm 50:6,23
335,2020-06-22 14:47:53+00:00,207,I am extremely impressed with how my law firm has become an ally for #BlackLivesMatter . They are walking the walk! You love to see it! @NLawGlobal,11
336,2020-06-22 14:45:53+00:00,484,Why doesn't #BlackLivesMatter ever talk about solving systemic black-on-black crime or demand the closing of abortion clinics which disproportionately kill unborn black babies? Why is #BLM raising money for blacks then giving it to White Democrat candidates?,240
337,2020-06-22 14:45:34+00:00,238,I was walking home from physical therapy a few minutes ago when I saw the National Geographic Society unfurling a #BlackLivesMatter banner across the strert from its #DC headquarters @NatGeo,29
338,2020-06-22 14:43:15+00:00,136,"I know there’s been a lot going on in the wrestling world the past few days, but let’s not forget that #BlackLivesMatter and they need to arrest the criminals that killed Breonna Taylor.",65
339,2020-06-22 14:43:10+00:00,48,"Borrowed the Bard’s bars to talk #BlackLivesMatter Huge thanks to @The_Globe for the platform and the vocal support. Also, weirdly this was recorded pre-Colston-Gate, but life imitates art as always!",13
340,2020-06-22 14:42:19+00:00,89,"Prof. @ClaraPonsati MEP: ""Non-essential trips to the #EuropeanUnion remain restricted, but in the meantime return procedures ""must continue as much as possible"", the @EU_Commission replies. Meanwhile, the #EU is making empty statements about #BlackLivesMatter..."" ",104
341,2020-06-22 14:39:03+00:00,151,"JUST OUT: @RevYearwood in @byshondaland ""We cannot achieve climate justice without racial justice, and we cannot achieve racial justice without climate justice."" #BlackLivesMatter #Think100 #ClimateJustice",95
342,2020-06-22 14:38:39+00:00,246,Happy National Windrush Day... we stand on your shoulders... ALL of us do. #blacklivesmatter #blackliveshavealwaysmattered #blackliverebuiltthiscountry https://www.instagram.com/p/CBvSPpnJJY9/?igshid=n0rjh2goio8m,26
343,2020-06-22 14:37:22+00:00,155,"This is incredible. Everything you need to know about #BlackLivesMatter including places to donate, educational tools, an automated email to get those #JusticeFor emails to council and so much more. I’d highly suggest supporting.",87
344,2020-06-22 14:36:26+00:00,52,"To Hell With Bolton, Barr & 45's ENTIRE #tRumpCrimeSyndicate. Register People To VOTE. WE MUST #VoteBlue2020 Down Ballot To REMOVE 45 REMOVE Mitch #SnakeMcConnell Remove Racist Sheriffs TAKE The PRESIDENCY TURN The SENATE BLUE KEEP THE HOUSE #BlackLivesMatter VOTE Like It. ",44
345,2020-06-22 14:36:21+00:00,123,"Father’s Day weekend has been a violent one in Chicago, with 60 people shot, including nine fatally. WHERE IS #BlackLivesMatter WHERE ARE THE PROTESTS WHERE ARE THE RIOTS #MondayMotivation",158
346,2020-06-22 14:35:18+00:00,109,BLACK LOVE is beautiful Proudest mother ever Thankful. Grateful. Humble. Introducing Mr. &amp; Mrs. Phillips #BlackLivesMatter #KappaMan,9
347,2020-06-22 14:33:49+00:00,336,#BlackLivesMatter Sarkodie - Brown Paper Bag ft. M.anifest (Official Video) https://youtu.be/tmhF9AdAj0k via @YouTube,60
348,2020-06-22 14:33:48+00:00,27,in case you forgot its still #BlackLivesMatter #JusticeForShukriAbdi #JusticeForBreonnaTaylor,24
349,2020-06-22 14:32:17+00:00,38,"How utterly insincere. The #Windrush generation still haven't been compensated and many have been left to rot overseas. Windrush Day is the worst of gesture politics. Go now, racist. #BlackLivesMatter #racism",22
350,2020-06-22 14:30:53+00:00,107,"Let’s see Dugan try to lie his way out of this one. This is why we take the streets demanding for justice. This isn’t a one time occurrence. This is everyday, in your own community. Silence is not an option #BlackLivesMatter #TampaProtests",105
351,2020-06-22 14:29:07+00:00,77,We still have a long way to go! #BlackLivesMatter ,56
352,2020-06-22 14:28:45+00:00,189,"Rhode Island announces it is dropping use of part of the official state name -- the ""and Providence Plantations"" part -- in response to the #BlackLivesMatter movement ",57
353,2020-06-22 14:28:33+00:00,70,#WindrushDay2020 is a symbol of what the #WindrushGeneration achieved - the #WindrushScandal &amp; the racist #HostileEnvironment is proof of the endemic racism in British society #TakeTheKnee Weds 24 June 6pm to say #BlackLivesMatter #WeDemandChange #Windrush,46
354,2020-06-22 14:23:19+00:00,113,"For anyone curious to see the E 93rd St Black Lives Matter mural in a little more detail, here’s a look at all the individual letters from above! #BLM #BlackLivesMatter #ElevateTheEast #ThisIsCLE",28
355,2020-06-22 14:17:26+00:00,46,Day 101 I can’t even find the words today. Just arrest Breonna Taylor’s murderers. ARREST THEM. CHARGE THEM. HOLD THEM ACCOUNTABLE. ARREST: Jonathan Mattingly. Brett Hankison. Myles Cosgrove. #CallThemOut BLACK WOMEN MATTER TOO. #BlackLivesMatter #JusticeForBreonnaTaylor,88
356,2020-06-22 14:17:18+00:00,138,As someone who was formally incarcerated..this is exactly what they do to break you down.. next will be rolling blackouts of electricity and water...OUR CHILDREN DONT DESERVE THIS! #BlackLivesMatter #fuckthepolice,19
357,2020-06-22 14:12:58+00:00,134,"For those asking for the full video from Saturday, here ya go! #SpeakUpAndDribble #BlackLivesMatter ",25
358,2020-06-22 14:12:17+00:00,355,All of my sex worker friends on this platform have been unflagging in their support for #blacklivesmatter. % My clergy friends on here 60/40. This is why Jesus loves sex workers. They are real ones when it comes to liberation. I see you real ones. I love you.,49
359,2020-06-22 14:11:46+00:00,234,"Black Lives Matter is a movement, not a moment. #blacklivesmatter ",140
360,2020-06-22 14:10:43+00:00,80,1/4: The police have released photos of alleged Colston statue topplers that they want to talk to. Some media outlets in the city have published them. The Bristol Cable will not. https://www.facebook.com/thebristolcable/videos/298923484599489/ #BlackLivesMatter #BlackLivesMatterUK,28
361,2020-06-22 14:07:57+00:00,3116,#BlackLivesMatter and @TheRevAl do not care about Black police officers who give their lives to protect and serve the Public. For example #DavidDorn. Let me be clear: I do NOT support #BlackLivesMatter @seanhannity @BLMLA @FoxNews. I oppose defunding the police,1298
362,2020-06-22 14:05:55+00:00,90,"#Truth. If #BlackLivesMatter, @TheDemocrats would defund under-performing school districts &amp; provide #SchoolChoice instead. Good EDUCATION emancipates poor Blacks from the victim mentality &amp; environment that enslaves them. Why don't #liberals want Blacks to #RiseUp &amp; #WalkAway?",147
363,2020-06-22 14:02:09+00:00,487,"#mondaythoughts : The people behind #BlackLivesMatter are NOT black, nor do they care about anyone's life! THIS WAS ALWAYS ABOUT DESTROYING OUR HISTORY AND TURNING OUR HEROIC FOUNDERS TO MONSTERS! #WakeUpAmerica #Trump2020NowMoreThanEver ",702
364,2020-06-22 14:02:08+00:00,60,#BlackLivesMatter it doesn’t stop..... ,19
365,2020-06-22 14:01:29+00:00,159,"Romelu Lukaku, Olivier Giroud and Allan Saint-Maximin all took a knee after scoring to show their support for #BlackLivesMatter ",5
366,2020-06-22 14:01:22+00:00,148,"Baltimore City, Patterson Park Neighborhood. My neighborhood. This is on South Linwood Ave. Photo credit: Chris Beall. Love my city. #Baltimore #BlackLivesMatter – at Patterson Park",28
367,2020-06-22 13:57:28+00:00,176,Schooled on systemic Racism. My hero of the day goes to this guy Arkansas #BlackLivesMatter ,86
368,2020-06-22 13:54:57+00:00,345,This is my community. Paint is just paint - it doesn't alter systemic structures or dismantle white supremacy. But symbols have power. That's why we tear down statues that represent evil. This paint feels like love and that's good for now. #BlackLivesMatter – at Patterson Park,54
369,2020-06-22 13:54:35+00:00,168,An Overdue Debt — Why It’s Finally Time To Pay #Reparations To Black Americans #BlackLivesMatter #ADOS #RacialJustice #BLMAllies,85
370,2020-06-22 13:53:22+00:00,208,Young black males. No other group has homicide listed as their number one cause of death. Why isn't this the leading story when it comes to black men in America? Do these #blacklivesmatter or do they only matter… https://www.instagram.com/p/CBvV_X3gSZa/?igshid=11966jds122o6,48
371,2020-06-22 13:52:28+00:00,61,"The ""No justice...No peace"" chants are DEAFENING!!! Al Sharpton has a lot of funerals to go to. #BlackLivesMatter ",46
372,2020-06-22 13:51:59+00:00,895,"I came to this country #undocumented many years ago. Now I'm a citizen, and this November I will #VoteBlue IN PERSON OR BY MAIL to help @JoeBiden kick RACIST @realDonaldTrump out of the @WhiteHouse #VoteBlueToSaveAmerica #BlackLivesMatter #LockHimUp http://www.nestorgomezstoryteller.com/audio.html",64
373,2020-06-22 13:48:51+00:00,123,"""Professional societies should protect Black people by meeting only in cities that implement evidence-based policies to limit the use of force by police....using their power of the purse to oppose racist policing..."" https://science.sciencemag.org/content/368/6497/1322.1 #BlackAndSTEM #BlackLivesMatter ",48
374,2020-06-22 13:47:57+00:00,143,Just ran out the house in my mumu and crocs to see this. I live in the most stably diverse neighborhood in Baltimore. I love my community. I love my city. #BlackLivesMatter #Baltimore #pattersonpark,16
375,2020-06-22 13:47:25+00:00,92,June 20th 1967 - Muhammad Ali was sentenced to 5 years in jail for refusing to fight for USA in Vietnam #MuhammadAli pic.twitter.com/IOtOwYkhwZ #KnowYourEnemies #Trump #BlackLivesMatter,71
376,2020-06-22 13:37:52+00:00,206,“Zionism is the belief that Palestinians can and must be expelled from their homeland so that settlers can take their place.” - @AliAbunimah Zionism is racism #PalestineTooCantBreathe #BlackLivesMatter @Zionocracy,120
377,2020-06-22 13:36:39+00:00,140,101 days. It's been 101 days since #BreonnaTaylor was murdered by the police while sleeping in her own bed and still no arrests have been made. #JusticeForBreonnaTaylor #SayHerName #BlackLivesMatter #StopKillingUs,100
378,2020-06-22 13:36:09+00:00,380,"Oi Antifa, there were some other uniformed Blackshirts once who spoke like this too. What were they called again? Far-left Pink Floyd dude goes full neo-Nazi. #BlackLivesMatter Guard Your Left flank! ",139
379,2020-06-22 13:35:30+00:00,3706,Dutch Police vs anti-coronavirus lockdown protesters during yesterday’s protest in the Hague. The police allowed #BlackLivesMatter to protest for 3 weeks (even took the knee with them) but immediately struck down these Dutch protesters? #DoubleStandards,1625
380,2020-06-22 13:35:03+00:00,123,"We recognise that until society works for Black autistic people, we won’t have succeeded. So here’s what we’re going to do to tackle this important issue: https://bit.ly/2Ngc4fI #BlackLivesMatter ",50
381,2020-06-22 13:32:48+00:00,63,#Resistance #OneVoice this tweet...this tweet right here should be reported to @TwitterSupport this tweet needs to come down because he is lying and practicing a type of #VoterSuppression #BlacklivesMatter ,42
382,2020-06-22 13:32:27+00:00,118,"How netball can embrace the BLM movement to create more diversity from top to bottom. @EnglandNetball players @EboniBChambers, @LaylaGuscoth and @Sasha_Corbin want to increase opportunities for young black athletes. #BlackLivesMatter ",55
383,2020-06-22 13:32:11+00:00,159,"It’s still and always #blacklivesmatter y’all. Don’t think because other shit is being discussed on the timeline that’s changed, because it most definitely has NOT.",73
384,2020-06-22 13:31:50+00:00,590,Do you get it now? #WHITEPRIVILEGE #BLACKLIVESMATTER #FIGHTTHEPOWER,199
385,2020-06-22 13:30:49+00:00,946,"Let’s change mindsets! There is a lot of Fixed-Comfort mindset when it comes to the #BlackLivesMatter movement. Instead, let’s switch it over to a Growth-Courage mindset. Perhaps these can help you or people you know. Improvement and awareness are vital! Pass it on. ",710
386,2020-06-22 13:23:51+00:00,98,"Chris Rock: American Airlines can't like, ""most of our pilots like to land but we just got a few apples, that loves to crash in the mountains"". Stop making excuses for racist cop! People, America has an institutional racist problem. #BlackLivesMatter ",56
387,2020-06-22 13:23:32+00:00,204,Sickened to hear about a noose placed in garage of #Nascar driver @BubbaWallace . Yes ALL LIVES MATTER but ALL LIVES are not treated the same .In America there are scum that would do this heinous act. When us whites say #BlackLivesMatter it's reminding racists we want equality,16
388,2020-06-22 13:13:57+00:00,62,"""It is time to act decisively to end racism against people of African descent and other minority groups."" @Atayeshe joins other senior @UN officials of African descent in a call to action to #FightRacism: http://unf.pa/q5d #BlackLivesMatter ",29
389,2020-06-22 13:05:42+00:00,2118,#BlackLivesMatter doesn’t give a shit about black lives or they’d be protesting in Chicago today. There were over 100 shootings this Father’s Day weekend! #Truth,1303
390,2020-06-22 13:05:02+00:00,797,"“They’re terrorists—they’re terrorizing the community. I agree with the peaceful protests…Black Lives Matter is not a peaceful protest."" #MuhammadAli Jr., son of the late boxer, said that his father would have been against the #BlackLivesMatter movement. ",351
391,2020-06-22 13:04:57+00:00,87,Bolanle in prints and in denim....Both are @bolanleolukanni #ZenMagazine #BlackLivesMatter ,19
392,2020-06-22 13:00:00+00:00,33,This week's episode focuses specifically on anti-black racism and health in the context of COVID 19. To get you started thinking about it check out this post by @AJohnsonHist via @AAIHS and @BlkPerspectives #BlackLivesMatter ,22
393,2020-06-22 12:58:05+00:00,36,"This is disgusting ! When does it end ? #BlackLivesMatter Footage showed the man, who did not appear to be resisting, repeatedly tasered by an officer during an arrest in Sydney’s eastern suburbs. During the arrest the man can be heard saying “I’m not even fighting you”. ",31
394,2020-06-22 12:53:14+00:00,47,"It’s #WindrushDay celebrating the huge contribution the British Caribbean community makes, especially nurses, midwives &amp; nursing associates in health and social care and my own colleagues at @nmcnews Thank you #BlackLivesMatter ",20
395,2020-06-22 12:53:02+00:00,122,"102 shot, 14 fatally, over Father’s Day weekend in Chicago Five children were among the 14 people killed, including a 3-year-old boy and 13-year-old girl killed in separate shootings in Austin on Saturday. Where are you, #blackLivesMatter?",103
396,2020-06-22 12:52:39+00:00,1365,"On #WindrushDay I pay personal tribute to BAME colleagues who came to help set up the NHS, and to the many thousands who support our health &amp; care today. We must continue to drive out discrimination of our staff, of any kind. #BlackLivesMatter #YearoftheNurseandMidwife #teamCNO",345
397,2020-06-22 12:51:14+00:00,132,"Stuart Douglas: ""I wanted to get the job on merit – because of my drive, determination, hard work and credentials as a physiotherapist. The fact I’m Black has no relevance."" In an honest interview, Stuart talks about tackling racism: https://tinyurl.com/yde5g99u #BlackLivesMatter ",22
398,2020-06-22 12:50:27+00:00,29,The British wing of #BlackLivesMatter finds itself split between older revolutionaries and younger pragmatists ,21
399,2020-06-22 12:47:42+00:00,45,ChecKKKered Flag: NASCAR's Only Black Wheelman Bubba Wallace Has Noose Placed In His Garage After Driving #BlackLivesMatter Car (Image via Jared C. Tilton/Getty Images) http://bossip.com/1912047/checkkkered-flag-nascars-only-black-athlete-bubba-wallace-has-noose-placed-in-his-garage-after-driving-blm-car/,25
400,2020-06-22 12:41:21+00:00,142,"Hey #BlackLivesMatter ! In-your-face Love, Haters! ",136
401,2020-06-22 12:38:44+00:00,100,NASCAR's @BubbaWallace has been leading the #BlackLivesMatter conversation and encouraging change within the sport. This repugnant act won’t stop the Movement. We stand with Bubba in the relentless fight against racism. ,24
402,2020-06-22 12:38:17+00:00,490,Yes. I think this is definitely my favourite tweet in support of #BlackLivesMatter so far. Screenshot for posterity. ,108
403,2020-06-22 12:37:27+00:00,300,Russian PsyOp tactics on full display. Hey #BlackLivesMatter the hard-left are enemies to minorities. Wherever they have come to power they have usually tried to genocide us first. Guard Your Left Flank! ,74
404,2020-06-22 12:36:01+00:00,914,"We need to fight racism. Well, *some* racism. Maybe others... at some point. Depends who's doing it tbh. #BlackLivesMatter ",150
405,2020-06-22 12:34:25+00:00,156,Your money choices really influence our money choices! #BlackLivesMatter,22
406,2020-06-22 12:31:41+00:00,133,Stand off currently going on at Capitol Hill since 5 AM this morning when TN state troopers decided to come down and remove Ida B. Wells Plaza sign. #FreeCapitolHillTN #BlackLivesMatter ,37
407,2020-06-22 12:31:05+00:00,4909,"In other news... Chicago: 101 shot, 14 fatally, over Father’s Day weekend https://chicago.suntimes.com/crime/2020/6/20/21297470/chicago-fathers-day-weekend-shootings-homicide-gun-violence-june-19-22 #BlackLivesMatter? #Chicago #FathersDay",2603
408,2020-06-22 12:28:40+00:00,240,"Thank you, @NASCAR, for taking this seriously. I'm livid that this has happened but I'm glad you're handling it the right way. Racism should have no place anywhere. #BlackLivesMatter.",3
409,2020-06-22 12:26:36+00:00,213," ""This is amazing what's happening in football but education starts at school with our children"" @Tim_Cahill on #BlackLivesMatter ",18
410,2020-06-22 12:24:15+00:00,69,#blacklivesmatter means Justice for Janvier Kigeri. COPS SHOT AND KILLED A BLACK MUNYAMULENGE MAN AND LATER HIS ORGANS WERE REMOVED in Ohio. #justiceforjanvierkigeri #justiceforjanvierkigeri #justiceforjanvierkigeri #justiceforjanvierkigeri #justiceforjanvierkigeri,28
411,2020-06-22 12:22:30+00:00,432,"New CO-VID on The Gandhi Trap, discussing the efficacy and limits of nonviolent protest in the face of violent injustice. #BlackLivesMatter ",215
412,2020-06-22 12:21:05+00:00,56,"Just fvcking stop ffs. Enough is enough #AboriginalLivesMatter #BlackLivesMatter Indigenous man repeatedly tasered in face, chest and neck during arrest in Sydney ",31
413,2020-06-22 12:19:39+00:00,98,"As #BlackLivesMatter protests continue, several prominent Black leaders are pushing back against demands to defund or even dismantle police departments across America. #JustTheNews",46
414,2020-06-22 12:18:14+00:00,125,Oh nooooooo what happened to #BlackLivesMatter??? ,48
415,2020-06-22 12:11:45+00:00,68,"NYT 1619 Project Lead Reporter Pushes Conspiracy Theory, Appears To Delete And Reactivate Her Twitter Account | The Daily Caller #1776unites #BlackLivesMatter ",37
416,2020-06-22 12:06:01+00:00,44,"New episode of @profdavidharvey's Anti-Capitalist Chronicles on the #BlackLivesMatter protests, the fragile state of the #US economy and how this represents a collision of forces that requires a response. Listen to the podcast on the ROAR blog.",25
417,2020-06-22 12:05:59+00:00,145,Special shout out to @TonzyMixer for putting together this video that was aired during #dragwars. I replayed it during the Color of Change charity streamathon yesterday. Thank you to all of our Content Creators of Color on @WatchMixer. The message STILL STANDS #BlackLivesMatter ,52
418,2020-06-22 12:04:08+00:00,68,Pleased that #SWFC have come out and said something on #BlackLivesMatter after some of the comments made. It was the right thing to do. https://www.thestar.co.uk/sport/football/sheffield-wednesday/sheffield-wednesday-live-owls-reiterate-blacklivesmatter-message-loan-deals-and-top-performers-2891027,8
419,2020-06-22 11:59:57+00:00,18051,Everyone taking a knee for #BlackLivesMatter movement. Sadio Mane: ,4386
420,2020-06-22 11:56:48+00:00,348,Let this sink in... Peaceful #AntiLockdown protesters arrested in the Netherlands. vs Peaceful #BlackLivesMatter protesters NOT arrested in the Netherlands. ,288
421,2020-06-22 11:56:12+00:00,237,"I have just spoken with @HarperCollins, regarding @BorisJohnson's racist, sexist and homophobic novel 'Seventy-Two Virgins'. The publisher stated they ""fully support"" the #BlackLivesMatter movement and are investigating. I will update on here when I receive further communication.",106
422,2020-06-22 11:55:09+00:00,174,As an #AfricanAmerican: Londoner for 30 yrs; citizen- 25: I say it's great saying #blacklivesmatter...but analysis in UK is DIFFERENT: #class is the other #prejudice. #AfricanCaribbean people-not high up. #ColourAndNationalOriginAreClass #WindrushDay2020,41
423,2020-06-22 11:53:02+00:00,81,"How can @Verizon claim to support #BlackLivesMatter when it pays Trump-loving racist enabler and enemy of social justice @mschlapp $40,000 to lobby Congress on its behalf? via @JuddLegum",69
424,2020-06-22 11:47:36+00:00,30,Good morning! #BlackLivesMatter we not letting it die.,22
425,2020-06-22 11:46:07+00:00,42,Here are the panellists for our upcoming #BlackLivesMatter event with @MTYoungBar! Thank you for your support for this event. There are still some non-student tickets available for booking. Hope to see you there!,21
426,2020-06-22 11:45:34+00:00,72,"Thabo Mbeki was in exile in , Harare. He resided at an ANC Safe House in Mabelreign in the Western suburbs of. Harare. Yet you hear someone pushing this rubbish of #ZimbabweansMustFall. No dear #ZimbabweansWillRise #BlackLivesMatter #AfricaDay",23
427,2020-06-22 11:43:50+00:00,54,There is no low to which the Telegraph won’t stoop to. I though they had reached it already but this is incredible @realzoestrimpel now arguing that #BlackLivesMatter protests are antisemitic. In this Orwellian world you are racist if you are anti racist. ,12
428,2020-06-22 11:40:08+00:00,106,A snippet of @Podcast_TBG x @SkySports collaboration featuring @morrisonclinton which is currently running on the hour. More exclusive clips coming soon #TBGPOD #BlackLivesMatter #SkySports #SSN,57
429,2020-06-22 11:35:54+00:00,4545,"Matt is upset because @Verizon canceled his lobbying contract after @JuddLegum asked about his tweets attacking #BlackLivesMatter protests as ""hostile to families, capitalism, cops, unborn life and gender” and said companies support BLM because boards are “infected w/ leftists.” ",1309
430,2020-06-22 11:35:53+00:00,654,"Rigged elections are a @realDonaldTrump move, like asking #Russia to help @POTUS win over @HillaryClinton ... #TrumpMeltdown #VoteBlueToSaveAmerica #BlackLivesMatter http://nestorgomezstoryteller.com/immigration-stories.html",109
431,2020-06-22 11:30:03+00:00,2007,The Journey Remember this viral (first) picture back then in 2016? That’s him in the other pictures. Salute to this lady who is being a mother to lil one #BlackLivesMatter ,404
432,2020-06-22 11:28:26+00:00,89,GIVE A BIG THANK YOU to the tireless & brave campaigners for the 3 MILLION biz owners & freelancers excluded from income support @ExcludedUK @ForgottenLtd @ForgottenPAYE #Justice4thenewlyselfemployed @TheWentaGroup #BlackLivesMatter #MicroBizMatters,56
433,2020-06-22 11:27:45+00:00,212,I miss the days when @BarackObama was president and DID NOT share links from #WhiteSupremacist sites like @BreitbartNews as @realDonaldTrump often does #TrumpMeltdown #VoteBlueToSaveAmerica #BlackLivesMatter http://nestorgomezstoryteller.com/immigration-stories.html,21
434,2020-06-22 11:19:38+00:00,79,"Happy Monday, here’s a few reminders, enjoy! Arrest the cops who killed #BreonnaTaylor You can’t pick &amp; choose which Black lives matter if you truly believe #BlackLivesMatter (includes lgbtqia+, womxn, disabled, etc.) Allow people the space to learn from their mistakes &amp; grow",53
435,2020-06-22 11:18:17+00:00,238,Genevieve is so GORGEOUS @GenevieveNnaji1 #ZenMagazine #BlackLivesMatter ,29
