,Datetime,Favorites,Text,Retweets
289,2020-06-24 00:00:29+00:00,5,"I wish I could say I am shocked that you have turned into yet another tRump lapdog. Disappointed to see someone whom I once respected yapping out the same partisan GOP bullshit, when you know full well that it's just window dressing. #BlackLivesMatter ",1
290,2020-06-24 00:00:21+00:00,8,How Those in the Anime and Gaming Community are Speaking up for Black Lives Matter Read more: https://bit.ly/31gDoTn #BlackLivesMatter #BLM #animetwitter,0
291,2020-06-24 00:00:11+00:00,6,The new #BlackLivesMatter mural on Greenpoint Avenue ,1
292,2020-06-24 00:00:11+00:00,2,"Join me as I sit down with #Entrepreneur and #SocialMediaInfluencer Joe Atang! Watch as we talk about our quest to spread #positiveenergy, growing our platforms, and #BlackLivesMatter. https://zcu.io/Hqbp #TheVibeWithKy #KyrusHasFriends #blackbusiness #goodvibes",1
293,2020-06-24 00:00:11+00:00,1,I’m exhausted... enough is e-fucking-nough #blacklivesmatter ,1
294,2020-06-24 00:00:07+00:00,0,@realDonaldTrump #BlackLivesMatter epic failure,0
295,2020-06-24 00:00:02+00:00,1,#BlackFathersMatter I was hoping my shirt would of came before fathers day but I'm still going to rock it. Thank you daughter #blacklivesmatter pic.twitter.com/W7uy69Hf4Q,0
296,2020-06-24 00:00:02+00:00,0,Where was #BlackLivesMatter??? Probably protesting &amp; rioting for career criminals. ,0
297,2020-06-24 00:00:01+00:00,0,ding ding! DING & ding... ding* ding* Ding. ding #PennState #BlackLivesMatter #JusticeForAll,0
298,2020-06-24 00:00:10+00:00,0,#BreonnaTalyor #blacklivesmatter ,0
299,2020-06-24 00:00:10+00:00,4,طالما كان في نيتكوا انكوا تمتحنونا ، كنتوا امتحنتونا من الاول ، مش تستنوا لغاية ما العدد يوصل ل ٥٦ الف ويا عالم بعد ماننزل العدد يوصل لكام ، حسبنا الله ونعم الوكيل #Egypt_kills_graduates #BlackLivesMatter,10
300,2020-06-24 00:00:04+00:00,3,"Bubba Wallace is a microcosm of the entire radical wave of violence we are seeing in #Democratic cities across America. ALL OF IT is based on lies, perpetuated by #Blacklivesmatter. #AllLivesMatter #BlueLivesMatter @realDonaldTrump",1
301,2020-06-24 00:00:01+00:00,1,"If you remember this incident, please reach out to either of us. We are trying to compile the accounts of other students who witnessed this incident. Thank you in advance! And remember, #blacklivesmatter ",0
302,2020-06-24 00:00:00+00:00,0,Gives me hope! #blacklivesmatter ,0
303,2020-06-24 00:00:00+00:00,0,"WE ALL #MADA. You matter, They matter, We all /ˈmadər/. Make America Diverse Again // MAKE US #MADA // And because #BlackLivesMatter",0
