,Datetime,Favorites,Text,Retweets
0,2020-06-24 23:57:46+00:00,951,Please help us find this cold blooded killer who gunned down 2 kids on Chicago's South Side this weekend. Please RETWEET this even if you're not from Chicago a RETWEET will make this spread far and wide. #BlackLivesMatter #SilenceIsViolence,1896
1,2020-06-24 23:41:07+00:00,58244,Your daily reminder that the #BlackLivesMatter protests aren’t going anywhere. This is Boston right now. Week 4. ,31658
2,2020-06-24 23:29:09+00:00,593,Elijah McClain should be alive today. My heart is heavy for him and his family. His case must be reopened. He and his family deserve justice. And we've got to work to increase accountability and oversight to end systemic racism in our criminal justice system. #BlackLivesMatter,151
3,2020-06-24 23:12:59+00:00,14,Hank Newsome Brotha is a Black Hitler #BlackLivesMatter is a radical hate group just like the KKK. Hate is Hate #BlackNotDemocrat,8
4,2020-06-24 23:05:12+00:00,40,#BlackLivesMatter protesters marching down Elmwood Avenue in Buffalo ,14
5,2020-06-24 22:54:36+00:00,8753,#BlackLivesMatter: Today would be a good day to finally arrest the cops who murdered #BreonnaTaylor.,3330
6,2020-06-24 22:45:38+00:00,221,"Called it, the dems would rather STALL police reform talks until a ""Joe biden victory"" so they can take credit for it, rather than give a win to the GOP. Democrats, you are being SWINDLED. #BlackLivesMatter #Trump",71
7,2020-06-24 22:44:18+00:00,1050,"Jamaica is to request a redesign of the badge worn by Governors General since independence, to remove the imagery depicting St Michael standing on the neck of a chained Black man portrayed as a devil. #BlackLivesMatter ",425
8,2020-06-24 22:00:58+00:00,189,Mauritania another African country still subject their people to slavery. Where’s #BlackLivesMatter ?? ,98
9,2020-06-24 22:00:51+00:00,11698,"Dear God. This is unconscionable. How many more must we watch til some stop making this political and acknowledge there’s a crisis in America? If you’re a POC, DO NOT LEAVE HOME WITHOUT A SMARTPHONE. If u see something, tape it. Denounce it. Make it public. #BlackLivesMatter ",4688
10,2020-06-24 21:59:35+00:00,3720,"continue to speak out, your voice matters #BlackLivesMatter ",1049
11,2020-06-24 21:48:53+00:00,24902,IM AT A RACIST HOTEL RIGHT NOW! I can’t believe what I’m dealing with right now! This is Torture & Abuse Where is #BlackLivesMatter ? I WANT JUSTICE! Please Help me share my story with the world! PLEASE RETWEET &amp; USE #JusticeForTerrenceKWilliams @w_terrence,7579
12,2020-06-24 21:29:26+00:00,14,PREACH!!!... #BlackLivesMatter #RACISM...,4
13,2020-06-24 21:07:34+00:00,1898,"Helen Keller’s birthday is June 27 & it’s #Deafblind Awareness Week. Helen knew she benefited from white privilege. A fierce activist, she protested, wrote articles &amp; donated to orgs working to end racism. I'm confident #HelenKeller would emphatically affirm #BlackLivesMatter ",628
14,2020-06-24 20:44:38+00:00,1964,We must seek justice for #ElijahMcClain and his family. We can never accept that we must live in a country where one group of Americans is less safe for no other reason than they are Black. #BlackLivesMatter ,743
15,2020-06-24 20:40:15+00:00,31,"""The ultimate tragedy is not the oppression and cruelty by the bad people but the silence over that by the good people."" - Dr. Martin Luther King Jr. #BlackLivesMatter ",15
16,2020-06-24 20:34:52+00:00,208,"21 year old Destiny Harrison was gun down in her own salon ,and was shot and killed in front of her one year daughter. Say her name ! #BlackLivesMatter ",113
17,2020-06-24 20:29:30+00:00,11,Injustice anywhere is a threat to justice everywhere. #BlackLivesMatter ,2
18,2020-06-24 20:11:48+00:00,4,“Those boys tried to attack me” #missmillie #Karen #blacklivesmatter ,0
19,2020-06-24 23:53:06+00:00,540,Please help us find this cold blooded killer who gunned down 2 kids on Chicago's South Side this weekend. Please RETWEET this even if you're not from Chicago a RETWEET will make this spread far and wide. #BlackLivesMatter #SilenceIsViolence,978
20,2020-06-24 23:52:51+00:00,485,A message from .@StevieWonder Watch the full video here: https://youtu.be/fk5Lhg9DV4M #BlackLivesMatter ,196
21,2020-06-24 23:13:44+00:00,495,"Respectability politics inherently contradict the #BlackLivesMatter movement. If you are quantifying how ""good"" a Black person was as a reason they shouldn't be murdered, you're upholding white supremacy. ",158
22,2020-06-24 22:56:32+00:00,2,This cover art of overseers... ahem... officers appearing so forlorn and pensive over their lost hero is so apropos. #BlackLivesMatter #SurvivingAmericasPolice #EndPoliceBrutality https://www.wsj.com/articles/after-years-of-debate-confederate-symbols-disappear-quickly-11591905565?st=1iax9yr55iq6ja5,2
23,2020-06-24 22:43:49+00:00,28,RUN IT UP EVEN MORE! #wonnationisoverparty #BlackLivesMatter ,22
24,2020-06-24 22:01:26+00:00,9,Drop a for UNITY! #BlackLivesMatter #PaliRoots ⁠,2
25,2020-06-24 21:41:05+00:00,795,"The worst thing the #BlackLivesMatter did to #blackpeople is convince you that you shouldn't discuss Black-on-Black crime. That's how over 100 people can be shot in one weekend in Chicago, and nobody gives a f**k",235
26,2020-06-24 21:28:45+00:00,451,"My friends god brother was murdered by Anaheim police on March 2018. He was unarmed, clearly not resisting. And they still murdered him. Her and her family deserve justice. All details posted and link to petition. #ICantBreathe #BlackLivesMatter ",414
27,2020-06-24 21:25:49+00:00,6,#ApartheidIsrael's puppet Engel losing the election. #StopAnnexation #StopZionism #BlackLivesMatter #PalestinianLivesMatter #Everylifematters #ICC4IsraelNOW #StopAIPAC,7
28,2020-06-24 20:49:14+00:00,194,"So Spokane is not as bad as Yakima, but good lord #MaskUpWA. The last 4 days i worked i counted masks worn, the amount was under 40, i actually worked more hours than masks worn. No one is oppressing you, we are trying to save lives. Oh and #BlackLivesMatter",19
29,2020-06-24 20:41:48+00:00,14,Where is the outcry from all the lefties #Antifas #BlackLivesMatter #WhiteLivesMatter,4
30,2020-06-24 20:35:43+00:00,9,"RETWEET ME PLEASE, NEW ALBUM SATURDAY!!! ALL PROCEEDS ARE GOING TO SUPPORT #BLACKLIVESMATTER ",12
31,2020-06-24 19:42:40+00:00,439,"Black, in a corporate setting, yet feel invisible? Don't want to rock the boat because you're one of few allowed ""in the club?"" Sometimes, I too feel that way. It's been weighing on me a lot during #BlackLivesMatter. I wrote a few words for me, but might mean something to you: ",184
32,2020-06-24 19:13:53+00:00,620,"Philadelphia city officials have announced they intend to remove the statue of Christopher Columbus in Marconi Plaza, which Tuesday night attracted armed men that physically clashed with #BlackLivesMatter protesters. ",191
33,2020-06-24 18:37:12+00:00,33,my c/o ‘19 senior composite #BlackLivesMatter ,5
34,2020-06-24 18:35:24+00:00,146,"On the eve of the one month anniversary of the death of George Floyd, I’d like to share a video I made documenting the events, both violent and unifying, that took place in Washington D.C. #ThisIsAmerica #BlackLivesMatter full video here: https://www.youtube.com/watch?v=WVQGVlWAf2o",84
35,2020-06-24 18:30:10+00:00,16,I saw this protester on a corner today all by himself and it made my day #blacklivesmatter #protests,2
36,2020-06-24 18:03:05+00:00,2,Black lives Matter The result vs. The not so process #BlackLivesMatter #BlackLivesMattters #BlackLivesMattterUK,2
37,2020-06-24 17:47:31+00:00,2205,"This is my cousin who was mysteriously BEHEADED at Waste Management in Tunica, Mississippi on June 9, 2020. Neither the Police Department or Waste Management have been willing to give our family any info regarding his death. #SayHisName #JusticeForJimmy #BlackLivesMatter ",2680
38,2020-06-24 17:23:02+00:00,1599,Join our fight against voter suppression. http://morethanavote.org @morethanavote #BlackLivesMatter ,375
39,2020-06-24 23:51:05+00:00,0,fuck this whiteboard shit #BlackLivesMatter pic.twitter.com/yJj7beEPNx,0
40,2020-06-24 23:16:37+00:00,4,"All Little Girls needs Fathers, and Black Girls need Fathers too. #BlackGirls #BlackCulture #BlackArt #BlackLivesMatter #BlackFathers #BlackGirlMagic #BlackMenRock #StopKillingUs #PoliceReform",7
41,2020-06-24 23:07:04+00:00,3,"""The Times They Are A Changing."" #charleston9 #TakeAKnee #BlackLivesMatter ",1
42,2020-06-24 22:51:59+00:00,752,You know what would be even cooler than Jenny Slate’s decision to leave her role in Big Mouth? Arresting the cops who murdered Elijah McClain and Breonna Taylor. That would be a great way to kick off the summer. #BlackLivesMatter,129
43,2020-06-24 21:30:00+00:00,652,"Today, tomorrow & every single day after that. #blacklivesmatter ",33
44,2020-06-24 21:28:20+00:00,874,Spotted in Midtown...one woman with one message: #blacklivesmatter ,202
45,2020-06-24 21:12:49+00:00,3,SAY HIS NAME 18 years old UNARMED Mouhamed Cisse was SHOT and KILLED BY THE POLICE. He was shot in front of his OWN RESIDENCE. His story has 0 (media) coverage. ANOTHER UNARMED BLACK MAN WAS SHOT AND KILLED BY THE POLICE #JusticeForMouhamedCisse #BlackLivesMatter,3
46,2020-06-24 21:01:57+00:00,205,wouldn’t it just be horrible if we made fake facebook accounts and tricked the conservatives into doing an economic blackout with us.. #blm #BlackLivesMatter #themannywillnotbetelevised,37
47,2020-06-24 20:49:56+00:00,3,Oh my goodness she is super pretty #BlackLivesMatter pic.twitter.com/ZHpAdHmlZq,0
48,2020-06-24 20:27:40+00:00,218,"PROVE #BlackLivesMatter to Hollywood! Grateful to be in partnership with @kendrick38 &amp; @bldpwr, who brought 300+ Black Hollywood leaders to align with @blmlosangeles @blklivesmatter &amp; @Mvmnt4BlkLives. Letter: http://www.BLDPWR.com. #Hollywood4BlackLives #DefundThePolice",79
49,2020-06-24 20:04:47+00:00,11,"My heart hurts for this beautiful soul, who played the violin for orphaned kittens and loved to dance. You deserved so much better. #ElijahMcClainWasMurdered by the Colorado PD #ElijahMclain #JusticeForElijahMclain #endpolicebrutality #BlackLivesMatter #endqualifiedimmunity",6
50,2020-06-24 19:54:08+00:00,236,"As you stand in support of #BlackLivesMatter, will you join the #StopHateForProfit campaign and take July off spending on Facebook as a result of their inaction on hate and disinformation on the platform? Over 60 advertisers have already pledged to do so.",80
51,2020-06-24 18:57:58+00:00,5,White privilege deniers please read. Stay calm. It’s pretty simple #BlackLivesMatter (source: insta @everydayracism_),5
52,2020-06-24 18:18:51+00:00,246,Let’s be clear #BlackLivesMatter kills reparations for #Ados American Descendants of Slavery. - Look at their agenda. Reparations in the form of trillions of dollars to #ados makes us elite not just equal. Their whole all lives platform is not focused on that happening.,133
53,2020-06-24 18:18:15+00:00,15,My new candle #BLACKLIVESMATTER . ,4
54,2020-06-24 18:12:01+00:00,769,Trump's 200th judicial nominee was confirmed. Zero of the 200 have been African American. Retweet if @realDonaldTrump is racist and #BlackLivesMatter.,499
55,2020-06-24 18:03:16+00:00,246,Diversity is a strength not a threat. @Trevornoah #BlackLivesMatter #EndRacism #StandUp4HumanRights,62
56,2020-06-24 17:18:39+00:00,73,Fuck your flag. #ACAB #BlackLivesMatter pic.twitter.com/ocxWYsfO65,20
57,2020-06-24 17:16:11+00:00,10,Demand #JusticeForElijahMcClain #BlackLivesMatter #BLM #elijahmclain,6
58,2020-06-24 17:08:52+00:00,400,It’s time for REAL change! @morethanavote #BlackLivesMatter ,128
59,2020-06-24 23:09:34+00:00,2,This is how much I ended up doing in 24 hours! Thank you everyone you all are noted and I love you #BlackLivesMatter ,1
60,2020-06-24 23:04:51+00:00,299,... a new study found there is no evidence that #blacklivesmatter protests contributed to the increase in #coronavirus cases the nation is now experiencing. https://nbcnews.to/2Zaw48U pic.twitter.com/HR51mD7Qtk,142
61,2020-06-24 22:50:05+00:00,278,"It baffles me that the same folks screaming about #masks like they’re some kind of injustice... ...can’t get themselves to say #BlackLivesMatter to acknowledge the oppression of 400 years of slavery, Jim Crow, police brutality, &amp; structural racism. SMDH.",47
62,2020-06-24 21:54:35+00:00,29,"“I believe the children αre our future, teαch them well αnd let them leαd the wαy.” #BlackLivesMatter ",7
63,2020-06-24 21:44:00+00:00,396,"The #BlackLivesMatter protest has exposed where most people are, they’re not racists and they want fairness and justice for all. Yes the racists are still there but they’re a minority. The future will be different, politicians need to catch up. ",157
64,2020-06-24 21:22:51+00:00,7,"But when will the officers who murdered #ElijahMcClain be held responsible? Your inaction makes you equally guilty, and it’s clear you’re unfit for this job. #BlackLivesMatter",0
65,2020-06-24 20:49:25+00:00,8254,Sadio Mane took a knee after his goal #BlackLivesMatter ,798
66,2020-06-24 20:44:40+00:00,1252,"Tonight, I'll tell you everything you need to know about #BlackLivesMatter. I followed the money trail and let me tell you. It's shocking. Watch tonight only on @BlazeTV at 9pm ET. #FightTheMob",504
67,2020-06-24 20:01:24+00:00,9,My niece isn't even 2 months old yet and I'll bet even she* knows that #blacklivesmatter ,0
68,2020-06-24 19:49:53+00:00,20,Y’all see this bullshit? Cops are making decisions to slam human beings like animals AND THEY WERENT EVEN SURE THAT WAS THE GUY?! Gross. Gross. Gross. #BlackLivesMatter ,11
69,2020-06-24 19:44:11+00:00,11,Also spotted #BlackLivesMatter ,0
70,2020-06-24 19:17:09+00:00,7,@gso do not go to ABM pressure washing!! This is what the owner is posting on her facebook!!! #racist #BlackLivesMatter ,6
71,2020-06-24 18:23:23+00:00,514,At Daley plaza for one of many marches across nation to demand #PoliceFreeSchools.#BlackLivesMatter @CTULocal1,147
72,2020-06-24 17:29:28+00:00,15,Islamic Republic of Terror (in Iran) is going to murder these innocent people (sentenced to death by a fake court). The brutal regime killed 1500 of protesters last year too. Don't you think peopleLivesMatter? #iranianLivesMatter #BlackLivesMatter ,10
73,2020-06-24 17:19:01+00:00,24521,"The generous contribution comes from #Kpop supergroup #BTS and their management company, and follows a $1 million donation to #BlackLivesMatter earlier this month. ",5899
74,2020-06-24 17:15:55+00:00,29,Never forget #BlackLivesMatter #Nickelodeon,14
75,2020-06-24 17:06:05+00:00,1480,Powerful. #BlackLivesMatter ,174
76,2020-06-24 16:51:28+00:00,7,#BLACKLIVESMATTER #juliusjones SIGN AND SHARE! Julius Jones is innocent. Don't let him be executed by the state of Oklahoma. - Sign the Petition! http://chng.it/pLvHsw5M via @Change,5
77,2020-06-24 16:51:21+00:00,317,"Just because it stopped trending, doesn’t make it any less relevant #BlackLivesMatter ",189
78,2020-06-24 16:36:19+00:00,331,In case you didn’t already know... #FireNataliaDomingo #arrestthecopsthatkilledbreonnataylor #blacklivesmatter,117
79,2020-06-24 22:23:29+00:00,0,I couldnt help myself! #BlackLivesMatter #BLMMOVEMENT,0
80,2020-06-24 22:15:28+00:00,84,Talks are underway to review the Governor General’s badge to remove the imagery depicting St Michael standing on the neck of a chained black man #BlackLivesMatter ,55
81,2020-06-24 21:56:43+00:00,1,When #BlackLivesMatter comes to your city pic.twitter.com/BzMdgrzEdZ,1
82,2020-06-24 21:53:15+00:00,7,Chicago is not a city that backs down. #BlackLivesMatter #JusticeForElijah,8
83,2020-06-24 21:38:58+00:00,38,"Video transcript continued: Everyone has the power to do something and help make a difference. If #HelenKeller was alive today, I'm confident she would support #BlackLivesMatter. 4/4",3
84,2020-06-24 21:25:37+00:00,110,Brazilian Boy like a little bird. #blacklivesmatter ,20
85,2020-06-24 21:05:31+00:00,8,Crazy how this still applies for times like now. This is from 1991 and we are in 2020 #BlackLivesMatter #FreshPrince,4
86,2020-06-24 21:00:28+00:00,352,Updated. #BlackLivesMatter #WeWillNotBeErased https://twitter.com/LeeHepner/status/1275592573189406720,158
87,2020-06-24 20:44:22+00:00,92,I'm talking to my GP practice tomorrow about: Why #BlackLivesMatter Societal/health disparities Race Science Empire/Colonisation How to be Anti-Racist - Bias/Prejudices Thinking fast and slow Biases and unlearning our biases - What else would you talk about? ,12
88,2020-06-24 19:16:04+00:00,7,Been trying to educate myself as much as I can over the last few weeks and I can’t believe I’m still seeing people I’ve known years denying rasism in the uk and praising people for protecting a fucking statue ?? It’s embarrassing mate. Just admit you’re racist. #BlackLivesMatter,2
89,2020-06-24 17:38:55+00:00,3,New shirt just arrived #BreonnaTaylor #BlackLivesMatter ,0
90,2020-06-24 16:56:17+00:00,0,This is disgusting! #blacklivesmatter ,0
91,2020-06-24 16:52:49+00:00,288,"Using voter suppression to extend a legacy of systemic racism and corporate greed. Hey @Mike_Pence, #BlackLivesMatter. Say it just once. And then pray on what it means. You may find enlightenment.",40
92,2020-06-24 16:30:53+00:00,179,Please help us find this cold blooded killer who gunned down 2 kids on Chicago's South Side this weekend. Please RETWEET this even if you're not from Chicago a RETWEET will make this spread far and wide. #BlackLivesMatter #SilenceIsViolence,256
93,2020-06-24 16:30:30+00:00,0,All that Glitters #blacklivesmatter https://www.essentialsworldwide.com/product/shimmering-cream-eyeshadow/,1
94,2020-06-24 16:29:31+00:00,74,My TL better wake up Some visuals w/ a twist #BlackLivesMatter ,40
95,2020-06-24 16:09:01+00:00,900,San Francisco's 49ers unveiled a #BlackLivesMatter flag at their stadium. Ex-player Colin Kaepernick was the first NFL player to protest protest racism and police brutality by kneeling during the national anthem. He has been unsigned since that 2016 season. ,351
96,2020-06-24 16:08:13+00:00,9,Let’s not forget. #blacklivesmatter Artist: BlueCollards ,2
97,2020-06-24 16:03:40+00:00,545,I’m encouraging ppl to help me put pressure on Valdosta PD Chief Leslie Manahan by calling 229-242-2606 to demand that Sergeant Billy J. Wheeler & Officer Dominic Henry are fired!! The community will not be safe until they’re gone! #BlackLivesMatter #NoMoreQualifiedImmunity,313
98,2020-06-24 15:45:14+00:00,323,"this is absolutely heartbreaking, please do not stay silent about this!! you can find the gofundme link below! #JusticeForElijah #BlackLivesMatter ",263
99,2020-06-24 20:49:46+00:00,58,"To everyone writing, tagging, and Tweeting about #ElijahMcClain -- please take a moment to read this. #BlackLivesMatter #SAYHISNAME",25
100,2020-06-24 20:15:52+00:00,888,"tyrese west . name not sound familiar ? he was an 18 year old boy shot to death while handcuffed , twice in the head and once in the shoulder by police officer eric giese on june 15, 2019 . the officer was put on administrative leave , that’s all. #BlackLivesMatter #TyreseWest",673
101,2020-06-24 19:49:10+00:00,2186,"I said on @joerogan's program that the #BlackLivesMatter plan was to force a slant into every venue, and every interaction, from here forward. In Lincoln County you can start to see what that looks like. Even when a rule is about life and death, it must be racially slanted. ",572
102,2020-06-24 19:28:58+00:00,1,omg i just found this out- #blacklivesmatter ,1
103,2020-06-24 18:09:42+00:00,115,Solidarity with @PriyamvadaGopal - being targeted with vile sexist and racist abuse for speaking up against white supremacists. We are proud to be your colleagues both on the picket line and off it. #BlackLivesMatter #Solidarity,27
104,2020-06-24 17:41:21+00:00,0,"Saw this on Facebook, did not disappoint #blacklivesmatter ",0
105,2020-06-24 15:48:31+00:00,3,Together We Lift The Sky #blacklivesmatter #nativelivesmatter #feelingfreedomnow,0
106,2020-06-24 15:41:06+00:00,116,"Join us as a part of nationwide protests on July 4th to march for true liberty and justice for all. Volunteers, speakers, and donations needed! #BlackLivesmatter Contact me to volunteer. ",66
107,2020-06-24 15:37:20+00:00,43," #BraveWrite: Prompt Words: June 25 - July 1, 2020 June 25: Plausible June 26: Despot June 27: Conscience June 28: Respect June 29: Shoulder June 30: Phobia July 1: Black We Honor: #BlackLivesMatter ",25
108,2020-06-24 15:32:19+00:00,178,"Together we can learn, lead, and be a part of the solution. #BlackLivesMatter ",72
109,2020-06-24 15:30:57+00:00,891,Jeffree Star. Shane Dawson. Trisha Paytas. It breaks my heart to see young people buying makeup products with these names connected. Please toss them out and remember #BlackLivesMatter ,129
110,2020-06-24 15:30:05+00:00,1166,And also follow me on IG @sagecausie for more of my work and also #BlackLivesMatter ,103
111,2020-06-24 15:25:52+00:00,792,"Please don’t watch this if you’ve already been traumatized by police. But please watch this if you don’t understand why people #TakeAKnee during the anthem, &amp; why people want to #DefundThePolice, &amp; why people are in the streets saying #BlackLivesMatter. ",416
112,2020-06-24 15:24:26+00:00,3323,"Watch out racists, WHO’S NEXT? #BlackLivesMatter ",1293
113,2020-06-24 15:24:06+00:00,242,"There are so many missing children, rapists & child sex traffickers: Not sure what #blacklivesmatter is doing with all the money being donated to them, but I have an Idea, hire detectives &amp; mercenaries to go rescue black children being sold for sex slavery &amp; organ harvesting:",104
114,2020-06-24 15:16:17+00:00,147,Slavery still exists. #blacklivesmatter | @benandjerrys,65
115,2020-06-24 15:11:58+00:00,21,"We are now on Day 10 of our 21-day Challenge, but you can start at any time. We challenge you. Who will you Challenge? #BexleyARP #Blacklivesmatter ",9
116,2020-06-24 15:07:40+00:00,2,I stand with you #blacklivesmatter ,0
117,2020-06-24 14:48:04+00:00,2,This is BACKWARDS. #BlackLivesMatter ,2
118,2020-06-24 14:41:52+00:00,664,NE 36th and Springlake #BlackLivesMatter ,201
119,2020-06-24 14:40:28+00:00,578,The #BlackLivesMatter movement isn’t a sprint. It’s a marathon. Keep going. Protest. Donate. Petition. Spread awareness. Statues are being removed. Police need to be defunded. There are many that still need to be brought to justice. Speak to your local representatives.,423
120,2020-06-24 14:18:38+00:00,17,"share tf outta this, we arent done #BlackLivesMatter #BLM #dcblackout",13
121,2020-06-24 14:00:52+00:00,2723,THREAD: #BlackLivesMatter protests have not led to clear spikes in #COVID19 transmission. What does that mean? 1/ Here are trends in new cases (7 day rolling average) for some counties with large protests https://www.buzzfeednews.com/article/peteraldhous/black-lives-matter-protests-coronavirus-no-surges,1650
122,2020-06-24 13:43:21+00:00,2,Brian Bedee. Make His Hate Known. #BlackLivesMatter ,0
123,2020-06-24 13:42:20+00:00,51,Once more for the soulless cunts who keep complaining about it! #BlackLivesMatter pic.twitter.com/GNb0G0d4as,12
124,2020-06-24 13:23:41+00:00,11,#perspective 5 years later still the same fight... #BlackLivesMatter ,10
125,2020-06-24 13:05:23+00:00,12312,Everything about this is disgraceful. #BlackLivesMatter ,8273
126,2020-06-24 12:47:22+00:00,7092,"Statue of Hans Christian Heg, an anti-slavery activist and American Civil War soldier, was beheaded in Madison, Wis. and thrown in the lake. The Forward statue was also toppled. #BlackLivesMatter ",4765
127,2020-06-24 12:18:49+00:00,202,Please help us find this cold blooded killer who gunned down 2 kids on Chicago's South Side this weekend. Please RETWEET this even if you're not from Chicago a RETWEET will make this spread far and wide. #BlackLivesMatter #SilenceIsViolence https://www.nbcchicago.com/news/local/chicago-police-seek-to-identify-suspect-in-homicide-of-2-teens/2293194/?amp,385
128,2020-06-24 11:58:29+00:00,7,about 250 Ethiopian Israeli activists and community members gathered in Tel Aviv to demand an official commission of inquiry into the death of 18 year old Solomon Teka an unarmed Ethiopian Israeli who was shot and killed by an off duty officer on June 30th. #BlackLivesMatter ,7
129,2020-06-24 11:25:50+00:00,87,Good morning & #BlackLivesMatter ,68
130,2020-06-24 11:23:23+00:00,22,Officers didn't bother to know who or why they were arresting. #PoliceBrutality #PoliceViolence #BlackLivesMatter #BlackLives,34
131,2020-06-24 11:21:21+00:00,17, Grace found me #blacklivesmatter ,0
132,2020-06-24 10:29:32+00:00,192,even dark skin can glow. #BlackLivesMatter ,17
133,2020-06-24 10:29:29+00:00,427,"""Never be ashamed of being African."" ~ Thomas Sankara #BlackLivesMatter",147
134,2020-06-24 10:24:28+00:00,4,"For those who downplay slavery, the justice system, & white privilege. Slavery never ended, it just looks different today. This is worth the read. Read & learn. WARNING for some of the language. #BlackLivesMatter #Slavery #ConfederateMonuments by “Past and Present: Sankofa” pic.twitter.com/nDrgZw76vy",2
135,2020-06-24 10:10:38+00:00,11,"Columbus was not a genocide, Cervantes was not a genocide, the anti-statues movement is extremist and based in ignorance and hate and make harm to the #blacklivesmatter wich deserves all our support #StopHispanophobic #RespectHispanicHeritage",7
136,2020-06-24 10:08:18+00:00,46,"London BLM protest 20/06/2020, long live the resistance. #BlackLivesMatter (1/2) ",20
137,2020-06-24 09:52:15+00:00,958,#Breaking Clashes between protesters and DC police flare up overnight on Black Lives Matter Plaza. At least one person appears to have been taken into custody @wusa9 #GetUpDC #BlackLivesMatter ,683
138,2020-06-24 09:46:15+00:00,1133,Do #BlackLivesMatter in Kentucky? Cutting polling locations in majority Black counties raises the question. ,385
