,Datetime,Favorites,Text,Retweets
546,2020-06-17 12:45:16+00:00,37,"Trump supporters are ATTACKING and KILLING #BlackLivesMatter protesters — and getting away with it Disturbingly, perpetrators have been released or given light charges despite severely wounding and killing protesters. #MOG",49
547,2020-06-17 12:45:05+00:00,458,The ramp at the West Point commencement is not the only ramp Trump has difficulty navigating. https://robrogers.com/2020/06/17/slippery-slope/ #Trump #SystemicRacism #BlackLivesMatter ,178
548,2020-06-17 12:43:10+00:00,546, Our Club Respect #THFC #COYS #BlackLivesMatter ,29
549,2020-06-17 12:38:01+00:00,1514,"Ahead of Friday night’s match against Manchester United, our players will warm-up in t-shirts supporting #BlackLivesMatter. The t-shirts are emblazoned with a clear message – Together We Are Stronger. #THFC #COYS",103
550,2020-06-17 12:34:09+00:00,14034,Together We Are Stronger #BlackLivesMatter ,1850
551,2020-06-17 12:33:30+00:00,133,Brandon Davies' gear ahead of the Spanish League restart #BlackLivesMatter (via @FCBbasket),19
552,2020-06-17 12:32:23+00:00,222,"No wonder, so many Black women became Conservatives. NO ONE PROTECTED THEM FROM BRUTAL VIOLENCE!! NEITHER THE LEFT, NOR #BlackLivesMatter ! Nor @AOC , @Ilhan #BlackWomenMatter @RealCandaceO",324
553,2020-06-17 12:31:53+00:00,102,Arrest warrant issued for alleged assault Sunday on black lives matter protester. 64-yes-old Johnnie Devault wanted for punching in back of head a protester - incident caught on cellphone video & distributed on Facebook. #BlackLivesMatter #AllLivesMatter #BethelOhio,38
554,2020-06-17 12:26:34+00:00,46,Poster for today's #WeAreOne @OneMinuteBriefs in support of #BlackLivesMatter. Featuring a defining moment as I gave @ZedTrafficker his well deserved 'OMBLE of the Year' award. Ze is a true inspiration of mine.,14
555,2020-06-17 12:26:06+00:00,353,"We discuss ‘breaching the gap’ between Africans and African-Americans, #GeorgeFloyd #BlackLivesMatter and other matters arising . Full video https://youtu.be/b-xOrm0vg40",49
556,2020-06-17 12:25:25+00:00,46,"Europe has a problem also. Active anti-racism is the only answer. We say loud and clear: #BlackLivesMatter Today at 15:15h #EPlenary discusses the tragic killing of George Floyd and the need to tackle racism in Europe, the US and around the world: http://socsde.ms/ZJk",23
557,2020-06-17 12:19:05+00:00,96,There is huge public backing to get the statue of Cecil Rhodes taken down. @neilfmendoza please consider this in your meeting today. We hope you and the board make the right decision - Thandie Newton OBE https://ctt.ec/R9H05+ #blacklivesmatter #RhodesMustFall @OrielOxford,15
558,2020-06-17 12:18:29+00:00,261,My home-city had to cancel it’s Juneteenth celebration this year due to COVID-19 so we’re virtually marching together. #DrillLikeMe2020 #DTU #Juneteenth2020 #BlackLivesMatter #Buffalo #Step #Drill,69
559,2020-06-17 12:18:01+00:00,165,"@diversify_ice founder, @joel_savary ‘s student, Kaitlyn, the.skate.kid on @nbcwashington @nbcnews for her amazing tribute performance to @andradaymusic “Rise Up” at @mayor_bowser newly named Black Lives Matter Plaza. #blacklivesmatter #diversifyice #skatepledge @TheEllenShow",64
560,2020-06-17 12:14:29+00:00,22,GOOD MORNING. ALL #BLACKLIVESMATTER. JUSTICE FOR OUR BLACK WOMEN WILL BE SERVED. OUR MISSING BLACK WOMEN WILL BE FOUND. THE CASES RETURNING TO OUR ATTENTION WILL BE REOPENED. THE POLICE WILL BE ABOLISHED. BLACK MEN EVERYWHERE WILL STEP UP. EVERYONE EVERYWHERE WILL STEP UP.,24
561,2020-06-17 12:14:18+00:00,30,"#BSSH is &amp; will always be a beacon for diversity &amp; equality As such, we have released a statement addressing our stance on inequality, prejudice &amp; bias in light of the #BlackLivesMatter movement &amp; report on the impact of #COVID on #BAME communities https://www.bssh.ac.uk/_userfiles/pages/files/BSSH%20Black%20Lives%20Matter%20Statement.pdf",17
562,2020-06-17 12:10:10+00:00,1801,"Aside from endowing performances, #MONSTA_X voiced out their stand for peace and justice - including their support for medical staff during the COVID-19 pandemic as well as the #BlackLivesMatter movement - in the #TIME100Talks event ",913
563,2020-06-17 12:10:02+00:00,52,"#BlackLivesMatter has shown why we must rid the world of racism. That starts with each of us. To help me learn more I’ve asked Kevin, a black colleague, to be my mentor. We spoke to the whole @childrensociety team at our Town Hall. This is what we said ",15
564,2020-06-17 12:09:05+00:00,82,I cannot believe this is the 5th anniversary of the #EmanuelNine . I remember when it happened. It still boggles my mind. They were in church. They were shot and killed in church. Let’s not forget them. #BLACKLIVESMATTER ,43
565,2020-06-17 12:06:14+00:00,65,"And, @realDonaldTrump’s idea of consoling the black community and addressing systemic racism is to attack @BarackObama...again...because, ya know, he’s black... #Trump #Obama #ExecutiveOrder #BlackLivesMatter #GeorgeFloyd",21
566,2020-06-17 12:05:42+00:00,716,#BlackLivesMatter doesn’t care about: Black police officers killed Blacks killed during rioting Blacks killed by gang violence Black babies killed in the womb So...which Black lives ACTUALLY matter to them? ,245
567,2020-06-17 12:04:53+00:00,47,"This company decided to use the #blacklivesmatter movement as a marketing strategy to sell their blackboards. Driving past it, my friend and I were horrified and proceeded to ask them to consider removing it as we strongly felt that it was insensitive and in appropriate... ",25
568,2020-06-17 12:01:30+00:00,85,#Gaza honors #GeorgeFloyd &amp; #BlackLivesMatter thru graffiti art. Artist Ayman Al Hossary ,30
569,2020-06-17 12:00:46+00:00,58,Good Morning. #BlackLivesMatter ,29
570,2020-06-17 12:00:00+00:00,104,"Yes, it's OK to be BLACK! #BlackLivesMatter #WeAreOne",21
571,2020-06-17 12:00:00+00:00,123,"""I've played in South America once and I've had people scream 'monkey' at me. I've had people write things on my social media accounts."" Sachia Vickery has opened up about being racially abused by spectators and on social media... #BlackLivesMatter",26
572,2020-06-17 11:59:21+00:00,1171,That stress. That hopeless frustration... is what black people have been feeling for hundreds of years! This is why we #protest and why we say #BlackLivesMatter. #ENOUGH,76
573,2020-06-17 11:52:53+00:00,63,"Starbucks has now completely changed its previous stance on not allowing employees to wear any sort of T-shirt, pin, or accessory that mentions #BlackLivesMatter. ",17
574,2020-06-17 11:50:27+00:00,651,"This is a well orchestrated plan by the #BlackLivesMatter movement to expose officers that are clearly not fit to be packing heat. Joke of course but if it was, it is clearly a brilliant move. #WhitePeopleProblems",10
575,2020-06-17 11:48:00+00:00,48,#Spiked: ANYONE (apart from Marcus Rashford) who supports #BlackLivesMatter or criticises #Spaffer's Govt is a woke Leftist Libtard Leftard Leftwaffe Snowflake PC-Brigade intolerant-Left Cultural-Marxist Virtue-signalling Metropolitan-Elite Champagne-Socialist who hates Britain.,23
576,2020-06-17 11:43:10+00:00,195,It’s amazing how powerful the black dollar is. Are we going to Goto Starbucks Or nah? #Blacklivesmatter,16
577,2020-06-17 11:30:21+00:00,1485,"Black people are still getting killed in the streets and justice hasn't been served. Just because you don't see it trending doesn't mean it's not happening. Don't accept this as ""regular life"". #BlackLivesMatter",900
578,2020-06-17 11:30:03+00:00,474,Everyone knows #BlackLivesMatter. President Trump is making #BlackLivesBetter.,154
579,2020-06-17 11:26:03+00:00,22,This is what I’m talking about we make up 13% of the U.S population...but make up 37.9% of the prison population... then we are also getting killed at 43%. Those are some major set backs that kill our community. Sooooo until #BlackLivesMatter all lives can not. #NoJusticeNoPeace,11
580,2020-06-17 11:22:33+00:00,416,"Instead of realizing this is the kind of anxiety POC face every day in every interaction, Officer Karen breaks after 10 minutes in a drive thru. Yeah, people don't say thank you enough. But no one is killing you in your bed, or while jogging, or lynching you. #BlackLivesMatter ",45
581,2020-06-17 11:21:20+00:00,61,"""As UN ambassadors for sustainable goal 16, we stand for peace and justice. As such, we have supported Black Lives Matter activism, and we believe that it's time to acknowledge the issue and fix it."" @OfficialMonstaX #BlackLivesMatter ",26
582,2020-06-17 11:18:25+00:00,61,“The most disrespected person in America is the black woman. The most unprotected person in America is the black woman. The most neglected person in America is the black woman.” Malcolm knew. #BlackLivesMatter,26
583,2020-06-17 11:18:00+00:00,2705,People from ethnic minorities have a higher chance of being targeted for their participation in #BlackLivesMatter protests. Read more about this selective targeting and what can be done to reduce its recurrence: https://privacyinternational.org/news-analysis/3926/ethnic-minorities-greater-risk-oversurveillance-after-protests,280
584,2020-06-17 11:17:56+00:00,63,Glasgow and its historic ties with the transatlantic slave trade have come under scrutiny amid the global #BlackLivesMatter protests. This teenager started a petition to change the city's street named after slave owners and has collected thousands of signatures ,18
585,2020-06-17 11:17:06+00:00,609,"‘Please don’t be too nice.’"" — @realDonaldTrump (the POLICE BRUTALITY endorser in chief), July 28, 2017 #RacistTrump #BlackLivesMatter #VoteBlueToSaveAmerica http://nestorgomezstoryteller.com/immigration-stories.html",130
586,2020-06-17 11:14:58+00:00,33,I look forward to the important George Floyd debate in @Europarl_EN this afternoon at 3pm CET. I thank Parliament for the initiative. We must turn the anger into social reform. Follow here: https://www.europarl.europa.eu/plenary/en/home.html #blacklivesmatter,11
587,2020-06-17 11:10:00+00:00,22,"#BRAZIL: #COVID19 Those who live in poorer n/hoods (informal settlements) are 10 x more likely to die than those in wealthy areas, + black Sao Paolo residents are 62% more likely to die from CV19 than white residents. #right2housing #BlackLivesMatter ",20
588,2020-06-17 11:06:09+00:00,314,They claimed her name is Stacey but I am sure her real name is KAREN #BlackLivesMatter #BlackLivesMatter http://www.nestorgomezstoryteller.com/immigration-stories.html,7
589,2020-06-17 11:05:55+00:00,37,"There is an ongoing pattern I am observing among fellow Europeans looking at #BlackLivesMatter who imply ""no, we do not have this problems in Europe"". Well, bad news, probably you have a bubble to burst and you need to look harder. A thread of things I've experienced/witnessed...",10
590,2020-06-17 11:04:18+00:00,573,"We live in a society where you can say “Fuck the Police”, and it’s considered essential free speech. However, if you say “I don’t support the #BlackLivesMatter movement”, you’re considered a racist and will face retribution. We can’t stay the “silent majority” forever.",219
591,2020-06-17 11:04:10+00:00,128,"“I’m really not a racist, but...” #BlackLivesMatter ",61
592,2020-06-17 11:03:09+00:00,36,"Why does it take 10 or more officers to arrest one unarmed man complying with orders? Is it because the police are over zealous, or is it because of racism? I think it's both. #DefundThePolice #DemilitarizeThePolice #BlackLivesMatter #AllBlackLivesMatter",22
593,2020-06-17 11:02:45+00:00,18,This is important. This community is one of the most supportive and inclusive I've ever seen. I hope we can extend that further into the world at large. @OneMinuteBriefs @D4nielleCl4rke @ZedTrafficker #WeAreOne #BlackLivesMatter ,13
594,2020-06-17 11:02:44+00:00,32,"Dear advertising, why? #WeAreOne as a community, in support of #BlackLivesMatter. A true festival of creativity. @D4nielleCl4rke @ZedTrafficker @OneMinuteBriefs",19
595,2020-06-17 10:56:57+00:00,117,"Dear Fellow (white) Writers: Even as we are in the midst of a global conversation about #BlackLivesMatter, remember that every physical description can carry a hint of white-centrism. Assuming that ""most writers have blue eyes"" by default overlooks nearly every writer of color.",9
596,2020-06-17 10:41:57+00:00,301,There are still names to say. There are still petitions to sign. There are still funds to raise. There is still history to learn. There are still lies to expose. There are still truths to spread. There is still action to take and STILL CHANGE TO MAKE! #BLACKLIVESMATTER ,260
597,2020-06-17 10:35:37+00:00,104,"Remember that #StarTrekUnitedGives because #BlackLivesMatter. We can’t achieve #IDIC without our sisters and brothers of color. We can’t #LLAP until WE CAN ALL live long and prosper . Prejudice is illogical. Hate is an irrational human emotion, Captain.",31
598,2020-06-17 10:34:46+00:00,62,"Support the cause, follow and repost. @/blacklivesmatter.om on insta link >>>>> http://instagram.com/blacklivesmatt… Show my guys some support as a big proportion of their profits will be going to the Black Lives Matter movement. #BLM #BlackLivesMatter ",29
599,2020-06-17 10:33:09+00:00,63,@rcpsych letter on the impact of racism on mental health from @DrAdrianJames and I in The Times today. #BlackLivesMatter ,31
600,2020-06-17 10:32:31+00:00,46,I couldn't be prouder of @hoban @HobanAlumni @TDickerson25_! He is so gifted on and off of the football field! Keep being great Tyris! Please give this a watch!!! @HobanAthletics @HobanFootball #ThisEndsNow #BeTheChange #BlackLivesMatter ,10
601,2020-06-17 10:31:51+00:00,73,"We need change. We need justice. How can #GOPCowards stay silent as the ""Grim Reaper"" #MoscowMitch refuses to lift a finger even after the fatal shooting of #BreonnaTaylor in his own state? #BlackLivesMatter #JusticeInPolicing",37
602,2020-06-17 10:29:56+00:00,153,"The toothless executive order was careful not to alarm or offend police officers and members of other branches of law enforcement. Trump even continuously praised ""talented officers."" #BlackLivesMatter ",81
603,2020-06-17 10:29:14+00:00,83,"The emphasis on being a 'sea-faring' and 'free-trading' nation leaves aside those aspects of Britain's history which the #BlackLivesMatter movement &amp; the debate about #statues &amp; memorials highlighted in recent weeks, such as the #slavetrade &amp; the darker sides of imperialism. 9/",15
604,2020-06-17 10:27:31+00:00,188,"Trump said he met with families of people who have been killed by police officers, including Antwon Rose, but Rose's mother said she did not meet with him. #BlackLivesMatter #DonTheCon",144
605,2020-06-17 10:26:09+00:00,542,"Daniel M. Kaufman, 52 Justin William Bowen, 25 They've been been released. #PortlandRiots #PortlandMugshots #antifa #BlackLivesMatter http://archive.vn/i5U68 http://archive.vn/0LdMD",377
606,2020-06-17 10:26:00+00:00,115,"Let’s just cut to the chase, shall we ? @AyoCaesar should be judge, jury and executioner? #notBameEnough #AllLivesMatter #BlackLivesMatter ",31
607,2020-06-17 10:25:01+00:00,673,"Brandon Shane Paape, 30 David Michael Roos, 27 Emily Beth Jacob, 30 They've all been released. #PortlandRiots #PortlandMugshots #antifa #BlackLivesMatter http://archive.vn/Xrd0J#selection-133.7-133.20 http://archive.vn/mdT9d http://archive.vn/xyHtd",433
608,2020-06-17 10:20:20+00:00,93,"My Irish born daughter at #BlackLivesMatter Peaceful protest in Glasgow She is not an ""Idiot for protesting"" &amp; she will not ""Go back to where she came from"" because she's standing up for others!..some ppls comments on here are disgusting! Please think before you speak! xx ",12
609,2020-06-17 10:20:01+00:00,79,Keep pushing #WhitePeople I just BURNED my #BlackLivesMatter Card!!! ,111
610,2020-06-17 10:18:21+00:00,52," Coventry residents This Friday evening, join me, @TaiwoOwatemi, @HackneyAbbott (!), @Blkconsciouscov &amp; @caragcoventry for an online #BlackLivesMatter rally! Sign-up here http://tiny.cc/CovRally4BlackLives",27
611,2020-06-17 10:17:56+00:00,133,I’m so glad Keisha from the Sugababes has spoken up about her own experiences of racism in the music industry. She was clearly emotional. It was hard to watch. #racism #sugababes #Keisha #musicvideo #music #singer #ThisMorning #BlackLivesMatter #uk,23
612,2020-06-17 10:14:06+00:00,44,An open letter from the Black and Minority Ethnic (BME) staff network at Oxford University to the VC. We stand in solidarity with #BlackLivesMatter and #RhodesMustFall. 11 concrete demands are listed with a request for a considered response by end June.,15
613,2020-06-17 10:10:56+00:00,119,"Michael Collins dismissing the #BlackLivesMatter as dangerous. Throwing out ""political correctness"" gone mad Pulling white savourism out of the bag wholesale here. Arent we great because we gave to trocaire boxes. The poor church never gets thanked for it #racism This is wild",7
614,2020-06-17 10:08:32+00:00,418,"If you want to help with the #BlackLivesMatter movement, pay attention to what’s happening. STOP posting about other things. This is happening NOW. Watch the videos posted by protestors and victims. Follow someone like @greg_doucette and retweet posts from this thread EVERY DAY.",281
615,2020-06-17 10:06:50+00:00,450,"Fact check on Hamilton's Instagram post: there does not seem to be any RTL interview where Marko says he is ""distracted"" by #blacklivesmatter. The English translated story with those quotes links only to the RTL website where there's no story saying that.",66
616,2020-06-17 10:00:39+00:00,79,Spotted in Bristol. #ACAB #wecopwatch #BlackLivesMatter ,44
617,2020-06-17 10:00:05+00:00,94,"#BlackLivesMatter is not controversial. If this doesn't get the message home, I'm honestly not sure what will. ",72
618,2020-06-17 09:56:18+00:00,53,"Thread. Another #blacklivesmatter &amp; #blackmusicmonth intersection. A story of Black Wall Street, as it was known in early 1900s, in Tulsa, OK whr Gap Band’s Wilson bros. (Charlie, Ronnie &amp; Robert) grew up. ⁣And a story of 1 of the worst events of racial violence in US history.⁣",30
619,2020-06-17 09:53:50+00:00,40,We are very much looking forward to Thursday’s online conversation about #RethinkingHumanitarianism in the midst of #BlackLivesMatter &amp; #COVID19. Be sure to register at the link below. We have a stellar lineup of speakers for you. Find out more in this thread &gt;&gt;&gt;,33
620,2020-06-17 09:52:53+00:00,30,His voice counts - @Gidochi_ #Africa #NescafeOneSong #BlacklivesMatter Check out the full video via his Instagram page https://www.instagram.com/p/CBf2lOglC8w/?igshid=1dviabr4vpei ,19
621,2020-06-17 09:50:41+00:00,74,#BlackLivesMatter is suing Kellogg's for having 3 angry white guys on the box of Rice krispies. One day I'm probably gonna hear chanting kill all the white people from that group. What's next Japanese babies gonna apologize for pearl harbor.,21
622,2020-06-17 09:47:04+00:00,158,We won't give up on Palestine On n'abandonnera pas la Palestine #Palestine #Palestinians #PalestinianLivesMatter #PalestineTooCantBreathe #BlackLivesMatter ,65
623,2020-06-17 09:37:27+00:00,145,New Work with Ronaldthe7th x Lauretta #Melanin #melaninpoppin #BlackLivesMatter ,23
624,2020-06-17 09:36:51+00:00,29,"If skin colour doesn't define creativity, it shouldn't limit it. @OneMinuteBriefs @D4nielleCl4rke @ZedTrafficker #WeAreOne #BlackLivesMatter ",23
625,2020-06-17 09:35:47+00:00,201,- In case you forgot #BlackLivesMatter,57
626,2020-06-17 09:35:17+00:00,32,Premier League players' names will be replaced on the back of their shirts with #BlackLivesMatter for the first 12 matches of the restarted football season. The League will also support any player who chooses to 'take a knee' before or during matches. ,9
627,2020-06-17 09:34:53+00:00,351,"Dem protestors are full of hate, drugs, alcohol and evil, she is one of them. It seems like #CHAZ needs more mental institution . #BlackLivesMatter #SeattleAutonomousZone",439
628,2020-06-17 09:32:09+00:00,37,Everyone who suspects they are neurodivergent should be able to get support. Tyla has started a fund for Black people who need that support. It’s so needed and so valuable. Please support by donating and sharing if you can! #AllAutistics #NeurodiverseSquad #BlackLivesMatter ,17
629,2020-06-17 09:32:03+00:00,105,#ManCity have released a video standing in solidarity with the #BlackLivesMatter campaign. [via @ManCity],12
630,2020-06-17 09:30:56+00:00,134,When the Movement Becomes Global Syrian Artist Aziz Asmar Calls On Awareness Of George Floyd R.E.S.P.E.C.T #BlackLivesMatter Izzeddin Idilbi/ Anadolu Agency Via Getty Images ,71
631,2020-06-17 09:22:27+00:00,278,"""Causing people to suffer because you hate them is terrible... but causing people to suffer because you've forgotten how to care, that's really hard to understand."" - Bashir to Sisko, #DS9 : Past Tense pt1 #StarTrekUnitedGives #BlackLivesMatter",48
632,2020-06-17 09:16:25+00:00,37,The UN Human Rights Council holds today an urgent debate (15hCEST) on systemic racism & police brutality. A resolution asking the Council to appoint an independent commission of inquiry to investigate systemic racism in the US and the world will be discussed #BlackLivesMatter,33
633,2020-06-17 09:16:06+00:00,492,"These “protests” are a front for a wider hard left political agenda. The stated aim of #BlackLivesMatter is to bring down capitalism. There’s no evidence that #GeorgeFloyd’s killing was racist or that a white suspect would have been treated differently. If there is, let’s see it.",189
634,2020-06-17 09:08:26+00:00,36,"We need to keep promoting and keep striving for equality, diversity, and inclusivity for all POC in post. Reading this was just super depressing. Hope we veer off this negative path and move in the right direction! #BlackLivesMatter #postproduction",8
635,2020-06-17 09:00:47+00:00,63,"When I see and hear things that are clearly wrong, I feel a responsibility to challenge them. That’s why I’ve suggested to the chief exec of @CheltenhamBC that all councillors should be given training in issues of race, equality and diversity - without delay. #BlackLivesMatter ",17
636,2020-06-17 08:58:59+00:00,72,It's great to see @CWUnews launch the #ShowRacismtheRedCard football shirt! #BlackLivesMatter ,27
637,2020-06-17 08:52:52+00:00,31,"Priti Patel linked with monument protection campaign organiser. Lower than vermin... Join #TakeTheKnee protests from 6pm tonight, on your doorstep or at @antiracismday events. #BlackLivesMatter ",23
638,2020-06-17 08:45:17+00:00,138,Use the hashtag #StarTrekUnitedGives and CBS donates $1 to a #BlackLivesMatter charity!! MAKE IT SO. ,43
639,2020-06-17 08:44:51+00:00,369,"The Netherlands, where a bunch of white soccer analysts call a Zwarte Piet counter-protester showing up at a #BlackLivesMatter protest a ""hero"" on live TV and television channels @VeronicaTV and @TalpaNetwork issue no warning &amp; take no disciplinary action.",108
640,2020-06-17 08:43:16+00:00,132,"My latest op-ed for ⁦⁦@5050oD⁩ “If people working in the Italian media perceive American #racism as quite distant from Italian society, it is because journalism in Italy is an almost-white industry.” #BlackLivesMatter ",61
641,2020-06-17 08:41:26+00:00,703,"noname has beeen inspiring people to learn about their injustices from the beginning of #blacklivesmatter and that's amazing for her. but we're not ALL on this Earth to do the same thing. as Black people, we're here for the same fight — yes.",185
642,2020-06-17 08:38:29+00:00,124,SAY THEIR NAMES. REMEMBER THEIR NAMES. #BLM #BlackLivesMatter ,104
643,2020-06-17 08:36:29+00:00,537,''Black is beautiful. Black is excellent. Black is love. Black is elegant.'' This 7-year-old girl reads her poem ‘Black’ inspired by @Santandave1 at a #BlackLivesMatter rally. ,156
644,2020-06-17 08:36:14+00:00,59,"One Minute Brief of the Day: Create posters to show how #WeAreOne as a community, industry and human race in support of #BlackLivesMatter Full brief created in collaboration with @D4nielleCl4rke, @ZedTrafficker &amp; the OMBLES here: https://www.bankofcreativity.co.uk/blog/omb-weareone RT",43
645,2020-06-17 08:27:11+00:00,292,"Almost everything you buy in America was made in China - by Chinese child slaves, #BlackLivesMatter #Antifa. Why aren't you burning Chinese factories down in China? Y'all mad about slavery you never went through, but child slavery is cool with you? You aren't oppressed.",166
646,2020-06-17 08:15:03+00:00,4426,"U.S. murder statistics: Blacks kill blacks 60%, blacks kill whites 8%, whites kill whites 8%, whites kill blacks 1%. Please note #BlackLivesMatter pretends it is 100% whites kill blacks. The movement is built on a blatant lie, addressing none of the black community's real issues. ",1031
647,2020-06-17 08:13:32+00:00,35,Tonight. From 6pm. Please join #Taketheknee protests. On your doorstep or at @antiracismday socially distanced events. #Blacklivesmatter @HackneyAbbott @BellRibeiroAddy @ClaudiaWebbe @M_Star_Online @RiccardoLaT0rre @jane_loftus,20
648,2020-06-17 08:12:49+00:00,171,LZ GRANDERSON #PRIDE2020 #BLACKLIVESMATTER ,28
649,2020-06-17 08:11:22+00:00,118,"Those who hate #BlackLivesMatter defend US police brutality by saying they are restoring law and order against “rioters.” Hong Kongers, please don’t fall for these lies. We’ve seen them before, when #CCP supporters defend the thuggish Hong Kong police.",27
650,2020-06-17 08:10:57+00:00,70,Just remembering how beautiful it was to hear Assata Shakur’s words chanted en masse in the early days of #blacklivesmatter . . “It is our duty to fight for our freedom. It is our duty to win. We must love each other and support each other. We have nothing to lose but our chains”,19
