,Datetime,Favorites,Text,Retweets
223,2020-06-22 17:53:26+00:00,123,"Hi @CapitalXTRA, the best way you can demonstrate a commitment to #BlackLivesMatter is by investigating the conduct of your DJ @TimWestwood - a white man in his sixties who has been accused of grooming, sexual assault, and rape by multiple Black girls. Their lives matter too.",40
224,2020-06-22 17:53:13+00:00,92,Do. Not. Think. This. Shit. Is. Temporary. The movement will continue until the statement can hold truth to it #BlackLivesMatter ,47
225,2020-06-22 17:52:25+00:00,203,Racist police officers take away this poor man's edged diversity tool. How is he supposed to earn a living now? Systematic racism is real. We need to see justice. #blacklivesmatter ,82
226,2020-06-22 17:46:36+00:00,119,I was going to get on here and say #BlackLivesMatter But imma talk about you Connie. ,43
227,2020-06-22 17:44:55+00:00,166,Man who tried to drive through #BlackLivesMatter protesters in Des Moines this weekend fired from his job ,38
228,2020-06-22 17:43:29+00:00,122,"Alexander Kueng, charged with aiding & abetting murder and aiding & abetting manslaughter in the #GeorgeFloydMurder, is out of jail on $750,000 bail. He was confronted by a customer at a store where they were both shopping. #BlackLivesMatter ",103
229,2020-06-22 17:41:16+00:00,735,".@AbbottNews, @comcast, and @walmart say they are committed to racial justice and #BlackLivesMatter But they all pay @mschlapp 6-figures to represent them on Capitol Hill Schlapp has spent weeks smearing &amp; insulting Black Lives Matter What gives?",403
230,2020-06-22 17:39:42+00:00,99,"#BlackLivesMatter , and UndocuBlack declares that reform of systems that criminalize Black communities is not the end! We have power will continue to push against the added enforcement &amp; criminalization of our communities which includes defunding ALL policing, ICE, and CBP.",39
231,2020-06-22 17:38:19+00:00,136,A coward put a noose in @BubbaWallace 's garage at Talladega and good Lord I hope they identify him. Last week he drove a #BlackLivesMatter car and helped get the confederate flag banned from track properties. All the support in the world to Bubba who is such a fun guy https://twitter.com/BubbaWallace/status/1274898390288121861,5
232,2020-06-22 17:37:53+00:00,520,"So, just how willing are these #BLM protestors and frauds to practice what they preach? This exchange is both hilarious and very telling... #BlackLivesMatter #BrownLivesMatter #ReparationsNow #Reparations2020 #LatinosForTrump",413
233,2020-06-22 17:35:37+00:00,420,The whole of the Premier League taking a knee for the #BlackLivesMatter movement. Sadio Mane: ,49
234,2020-06-22 17:32:45+00:00,279,Is #BlackLivesMatter a terrorist organization?,402
235,2020-06-22 17:30:06+00:00,1322,"BTS, ARMY And Black Lives Matter: The Value Of Fandom Meshing With Activism | I spoke to several #BTS fans, including the young Black woman behind the #MatchAMillion campaign, @naija0329, about BTS' major donation to #BlackLivesMatter: https://bit.ly/3dqmnse",605
236,2020-06-22 17:26:51+00:00,250,"I'm sure you know John C. Calhoun, founder of @Yale was a white supremacist, a proponent of slavery and a Democrat. But did you know the faculty at Yale were referred to as ""𝑴𝒂𝒔𝒕𝒆𝒓𝒔"" up until 2016 #TheMoreYouKnow #BlackLivesMatter every4yrs https://www.nbcnews.com/news/nbcblk/yale-keeps-school-named-slave-owner-pulls-master-faculty-title-n564036",244
237,2020-06-22 17:26:26+00:00,409,"So the founder of #BlackLivesMatter just admitted she is a ""trained Marxist"" and ""our goal is to get trump out."" It's NOT about racism.",257
238,2020-06-22 17:26:11+00:00,397,"Do #BlackLivesMatter in Chicago? At least 100 people were shot, 14 fatally, in Mayor Lori Lightfoot’s (D) Chicago over Father’s Day Weekend 2020.",227
239,2020-06-22 17:24:16+00:00,457,"Sorry, we're closing because #BlackLivesMatter!! .....just kidding! C'mon in. ",134
240,2020-06-22 17:24:15+00:00,41,1.3 Million and counting... WOW! #bakeragainstracism @bakersforBLM #BlackLivesMatter ,12
241,2020-06-22 17:23:57+00:00,252,Hey #BlackLivesMatter SAY THEIR NAMES #MehkiJames was just 3 yrs old! #AmariaJones was just 13 yrs old! We will no longer stay silent on #BlackOnBlackCrimes MARXISTS are burning down communities for CRIMINALS &amp; demanding we #DefundThePolice #WorkWithTheBlue to find Justice!,157
242,2020-06-22 17:22:28+00:00,151,IT’S A COMMUNIST ASSAULT: #BlackLivesMatter Leaders R Trained #Marxists–Supporters of #Socialist Maduro Regime–Behind Removal of #Statues Across US #Communist Movement To Topple America #Media Won’t Tell U This QAnon #QAnon2018 #QAnon2020 #DemocratsHateAmerica #MSMHatesAmerica,313
243,2020-06-22 17:22:18+00:00,57,Today we recognise and celebrate the contribution of the Windrush generation. We also acknowledge that so much remains to be done to eliminate racism & discrimination & we will redouble our efforts @NHSBartsHealth to take decisive action #WeCare #BlackLivesMatter ,19
244,2020-06-22 17:18:25+00:00,879,"YOU CAN VOTE IF YOU'RE IN LINE before midnight they have to let you vote camp out, feed each other, this one is for the history books #AllEyesOnKentucky #BlackLivesMatter",421
245,2020-06-22 17:16:37+00:00,113,"Pardon, Chad? I have more than enough love in my heart. Do you?#BlackLivesMatter ",3
246,2020-06-22 17:15:26+00:00,1192,"2. Never bend the knee by @nedryun https://amgreatness.com/2020/06/18/never-bend-the-knee/ @realDonaldTrump @seanhannity @JennaEllisEsq @SteveForbesCEO @LouDobbs @GenFlynn @JosephJFlynn1 #BlackLivesMatter is not about black lives. It is about Marxism, domination, and control.",738
247,2020-06-22 17:13:12+00:00,131,"@VP, I applaud ur encompassing all of humanity by saying All Lives Matter. Cuz, in addition 2, obvi, #BlackLivesMatter u admit: - LIVES MATTER -Kids in cages LIVES MATTER -122K+ who’ve died of #COVID19 LIVES MATTER Thanks 4 standing up 4 every1 &amp; being strong Cuz if ur weak...",100
248,2020-06-22 17:12:15+00:00,108,"Tune in TODAY at 5pm ET for a conversation between our President and CEO @DerrickNAACP and DC Mayor @mayor_bowser on the #2020Election, DC Statehood and the current state of #BlackAmerica! #VoteOurLivesDependOnIt #BlackLivesMatter ",56
249,2020-06-22 17:11:58+00:00,53, #Ohio's Constitution still contains language allowing slavery. @CecilThomasOH is introducing a resolution to remove this language. Call your senator. (Type your address here to find yours: https://tinyurl.com/y6qwxq7x) SAY: Cosponsor the anti-slavery resolution #BlackLivesMatter ,31
250,2020-06-22 17:10:13+00:00,49,Let’s normalize a man crying... or atleast in private cause we’ve normalized drinking your problems away as a man and where has that gotten us? #JobSeekersSA #BlackLivesMatter ,22
251,2020-06-22 17:05:51+00:00,31,"Please RT: Bought 11,000 more masks. If you are doing homeless/disabled/elder outreach in the Bay Area and need masks, gloves, or sanitizer, DM us. We also have continuing capacity to supply attendees of #BlackLivesMatter events in the Bay. #WearAMask Donate link in bio",46
252,2020-06-22 17:04:12+00:00,457,#WWDC20 starts by addressing #BlackLivesMatter ,63
253,2020-06-22 17:03:14+00:00,99,"How many White Liberals will jump on him to call him ""rAciSt?"" Either we're Equal or we're not. #AntifaTerrorists tried to call ME a ""wHitE sUpRemAciSt"" for saying ""It's okay to be White"" #Whitelivesmattertoo #Blacklivesmatter #AllLivesMatterPeriod #BlueLivesMatter #BlueFlu",20
254,2020-06-22 17:02:54+00:00,229,@gop has no time to hear bout #BlackLivesMatter but hella worried bout a statue of a man who preached his followers should speak up &amp; protect others. ,43
255,2020-06-22 16:58:18+00:00,89,"Had a chance to speak one-on-one with President Trump. He shared his thoughts on bringing the #economy back, the fight against the #coronavirus, and the #blacklivesmatter movement. Our coverage will continue throughout the day on your local @SpectrumNewsDC affiliate. @NY1",68
256,2020-06-22 16:57:34+00:00,337,"Even if you’re ignorant enough to compare Dylan Roof being “taken alive,” to Eric Garner, et al, you shouldn’t be so stupid as to miss the irony of this baby being murdered & no one caring enough to burn down a Wendy’s Mekhi James #SayHisName #BlackLivesMatter #Hypocrites ",125
257,2020-06-22 16:53:55+00:00,74,"This cover from @RollingStone magazine is supposed to be so woke, yet, they’ve unwittingly revealed the main problem in the black community. Where is this boy’s father? Do black fathers matter? Or is this another “that ain’t our problem” moment? #BlackLivesMatter ",24
258,2020-06-22 16:51:54+00:00,211,This is what happens when we take collective action to #PunishRacists. @wyckoffs educate all of your staff and make sure they know #BlackLivesMatter ,51
259,2020-06-22 16:51:12+00:00,21,Things that companies can do in solidarity w/ #BlackLivesMatter: Assess parity with working conditions Keep Black people safe on tech platforms Look for racial divides btw contract vs FT employees Be a fair player in communities you're located Invest $in organizing,10
260,2020-06-22 16:48:52+00:00,45,"An exciting panel on sex work, #BlackLivesMatter and uprisings to #DefundThePolice! Featuring @ButterflyCSW, @RedCanarySong, @byp100, @TheBlackSWC and Midnight Blue. Tuesday, June 23rd - 8pm ET Register at http://bit.ly/swbeyondborders pic.twitter.com/cqEmysCbx7",31
261,2020-06-22 16:48:24+00:00,106,THIS abomination is sitting in front of the courthouse in Columbia North Carolina. #BlackLivesMatter #tearthemdown please retweet this and let Americans know this has got to go!!! #CivilRights ,106
262,2020-06-22 16:45:35+00:00,153,"Today, on Windrush Day, I asked the Education Minister for an update on my cross-party letter calling for a review of the National Curriculum in light of the #BlackLivesMatter movement. See my question below ",55
263,2020-06-22 16:43:51+00:00,208,Esther is a Goddess @esther_biade #ZenMagazine #bbnaija #BlackLivesMatter ,27
264,2020-06-22 16:42:56+00:00,22,"“I always thought it was weird when many years ago I was the only black reporter on the news desk in Birmingham, the second most diverse city outside of London.” - #bjtcalumni @TVMarv shares her thoughts on #BlackLivesMatter here: ",14
265,2020-06-22 16:42:41+00:00,566,I go in-depth on how white colonialization has manifested in diff forms of racism among Filipinos despite our being people of color and why we must also fight for Black Liberation in this article: #BlackLivesMatter #FilipinosForBlackPower,91
266,2020-06-22 16:42:40+00:00,94,"Wyckoff (@wyckoffs) works fast! Jeff Boucher running his truck through a crowd of protesters has lost him his job! But it's not over... Make sure EVERYONE KNOWS this man is violent and dangerous! Stay safe, keep your people safe, and keep fighting #BlackLivesMatter https://twitter.com/XeenaPhobia/status/1274833439288700929",40
267,2020-06-22 16:39:12+00:00,129,"#MedinaMondayMessage; #Latin/#LatinX #duallanguage educators, to oppose the #BlackLivesMatter movement is to reject our shared histories. Read my brief article on @DualLangSchools to continue the reflection process regarding #BLM in DL and WL programs. https://duallanguageschools.org/columns/dual-language-in-support-of-black-lives/",36
268,2020-06-22 16:38:38+00:00,59,“Racism isn’t only what’s said to you it’s how people make you feel ” @Dej_TBG speaking on @SkySports for @Podcast_TBG speaking about experiences being a black fan. #TBGPOD #BlackLivesMatter #BLM #SSN,42
269,2020-06-22 16:33:38+00:00,129,Sharing my original number breakdown bc some of y’all STILL don’t get it. Quit making excuse and SEE the problem - then let’s talk about solutions. I’m ready for your “what abouts” #BlackLivesMatter #NoJusticeNoPeace #MathDontLie #ReadtheNumbers,66
270,2020-06-22 16:32:18+00:00,18,"I just want y'all to remember that if it weren't for the #BlackLivesMatter &amp; #MeToo movements (started by BW) many of y'all wouldn't have taken to the streets &amp; fought back! BW taught y'all! ""Nobody's free until everybody is free!"" -Fannie Lou Hamer, Domestic Violence Survivor",5
271,2020-06-22 16:31:33+00:00,46,"Hey #BlackLivesMatter AKA @HouseDemocrats @SenateDems Does the precious little 3 year old baby in Chicago who was murdered get a televised Memorial service? Or does his life not matter because it's not politically convenient? Put up or shut up, you hypocritical political Pricks",22
272,2020-06-22 16:30:33+00:00,28,The Big East will have #BlackLivesMatter patches on all men’s basketball uniforms this season thanks to a new organization called @coaches4action that was started by 21 minority assistants in the league.,9
273,2020-06-22 16:30:00+00:00,42, FULL VIDEO https://youtu.be/Q9aL88eanVI Can you seperate the art from the artist if the art itself is inherently political? @MMATAband offer their thoughts. FULL VIDEO BELOW https://youtu.be/Q9aL88eanVI #blackvoices #blacklivesmatter #blm,9
274,2020-06-22 16:29:16+00:00,81,"In case anyone was worried the whole #BlackLivesMatter dialogue of late is a trend that inevitably will lose steam, here's @GlobalHealthOrg's commitment to keeping it going. This shit is personal. https://globalhealth.org/ghls/",19
275,2020-06-22 16:25:01+00:00,143,"VIDEO: A 19-year-old black man fainted after being immobilized by a cop in Carapicuíba, Greater São Paulo. The violence resembles the law enforcement approach that killed George Floyd in Minneapolis, sparking #BlackLivesMatter protests worldwide ",60
276,2020-06-22 16:20:46+00:00,27,"It’s. About. To. Go. Down. Topics on deck: #BlackintheIvory Muslim #misogynoir why y’all afraid of Black Feminists / Black Muslims, #BlackLivesMatter and solidarity across difference Join @SapeloSquare with @TinyMuslimah on IG Live!",11
277,2020-06-22 16:19:55+00:00,443, How many have lost their patience w/ this stuff?? I thought equality was the goal here?? Isn’t SEGREGATION what we stepped out of in 1964 w/ the Civil Rights Act?? WHY is #BlackLivesMatter trying to take us all backward?? This is plain IGNORANCE! ,390
278,2020-06-22 16:18:52+00:00,118,Interrogating racism in our lives means we must interrogate racism and the experiences of BIPOC on #Survivor. Join @JtiaPhd @wendellholland @BriceIzyah on FRIDAY for this important panel. #TribesandTribulations #SoulSurvivors #TNT #BlackLivesMatter ,13
279,2020-06-22 16:16:53+00:00,52,No support for 45 in Tulsa. Protesters in #SanDiego show what motivated support against fascism looks like. You have a choice in Nov. Vote out the Fascist Party formerly known as republicans or #VoteBlueToEndThisNightmare #BlackLivesMatter ,33
280,2020-06-22 16:15:38+00:00,1206,"#RACISM NEVER RESTS, IT NEVER TAKES A BREAK.... NEITHER CAN WE IN DEFEATING IT!! bubbawallace WE GOT YOUR BACK STAND TALL YOUNG MAN!! #TeamDL #blacklivesmatter #BubbaWallace #NASCAR #BLM #endracism #talladega… https://www.instagram.com/p/CBvmRLgHlLs/?igshid=x8le0cypocmo",230
281,2020-06-22 16:14:33+00:00,53,“CPDA believes that Mr. Khan should not be “reported” for encouraging peaceful protests and expressing anger at the DA’s office in his community. He should be commended for speaking the truth.” #publicdefenders #blacklivesmatter http://claraweb.us/archives/34048,13
282,2020-06-22 16:12:57+00:00,93,We will march EVERY SUNDAY until our demands are met. We cannot be silenced. #BlackLivesMatter #ABLUK #LDNBLM,48
283,2020-06-22 16:11:50+00:00,80,"Our first keynote of the day is kicking off with @aliciagarza, Principal @blackfutureslab and Co-founder #BlackLivesMatter, and @lafawn, VP of D&amp;I @indeed Tune in here: http://bit.ly/PRIDESUMMIT2020 And follow along below ",29
284,2020-06-22 16:07:09+00:00,285,I will say this for the rest of my time here on this earth. I am a white person who will stand proudly with my black brothers and sisters. #BlackLivesMatter which when interpreted means: Black Lives Matter. Who's with me?,83
285,2020-06-22 16:05:12+00:00,3511,"Internationalism matters. We must stand up to Bolsonaro, Trump and co. on the key questions of our time - putting public health first, tackling Climate Change and making #BlackLivesMatter a reality. Read and share my @theipaper piece #ForaBolsonaro",1379
286,2020-06-22 16:05:11+00:00,176,He won't say #BlackLivesMatter because white supremacists don't believe that #BlackLivesMatter ,24
287,2020-06-22 16:05:04+00:00,78,Arrested the police that killed Breonna Taylor #BlackLivesMatter #BreonnaTaylor,25
288,2020-06-22 16:00:32+00:00,187,Please HELP #Blackfathersmatter #Blacklivesmatter once more people share I will share the FULL STORY! I was too afraid when it happened of being judged but I am stronger than ever and I will get justice for my pops!,83
289,2020-06-22 16:00:24+00:00,315,Why don't you say #blacklivesmatter? That can be the start of racial justice.,14
290,2020-06-22 16:00:01+00:00,840,We can’t let up now. Breonna Taylor DESERVES justice. Take action at http://bit.ly/demandjusticeforbre to demand the arrest of the murderers who killed Breonna Taylor. #BlackLivesMatter | : @stattheartist on IG ,348
291,2020-06-22 15:59:07+00:00,134,BLACK LIVES MATTER AGENDA: Lives that matter: -Blacks killed by whites Lives that don’t matter: -Blacks killed by blacks -Black babies aborted Frauds #BlackLivesMatter ,72
292,2020-06-22 15:58:41+00:00,79,"The BBC stirring the racist pot They are a #woke propaganda outlet, paid for with our money. Their support of racist Marxist #BlackLivesMatter movement helping to spread racial division in one of most tolerant and racially inclusive countries in the world. ",46
293,2020-06-22 15:56:40+00:00,61,Want to take the time to tweet this since it's still important to me - Always push for peace. Always push for the right school of thought. Always push for the next generations to come. #BlackLivesMatter,13
294,2020-06-22 15:56:17+00:00,1604,Imagine saying BLACK LIVES MATTER. But being mad at a BLACK TRANS WOMAN For WINNING !!! For beating the odds!!!!!! For making a way out of no way!! FOR WANTING A BETTER LIFE! Imagine being that person mad that a black trans woman is winning while still shouting #BlackLivesMatter,87
295,2020-06-22 15:52:13+00:00,117,"NASCAR, you have your issues and that goes without saying, but a noose in a black driver’s garage? I don’t understand the hate that makes someone do something like this. #ONEV1 #Fam #wtpTEAM #BlackLivesMatter ",78
296,2020-06-22 15:48:17+00:00,38,"in a month where we have seen movements towards #BlackLivesMatter and #JusticeForSikhs, it’s integral to understand the depth of how trauma and oppression can impact an individual as well as their familial lines. thank you to @brownpsych for looking over these images! ",32
297,2020-06-22 15:47:52+00:00,39,"The football world, united against racism. #BlackLivesMatter ",11
298,2020-06-22 15:44:02+00:00,118,"“We stand here united. As two teams, but one family” Taking a collective action towards change alongside the @WashWizards. #TogetherWeStand #BlackLivesMatter ",29
299,2020-06-22 15:43:59+00:00,38,"Director @AmmaAsante shares her response to recent events surrounding the #BlackLivesMatter movement in our latest #GirlsOnFilm on @BFI YouTube. Tune in at 6:30pm TOMORROW 23 June to hear more from her + @MPeakeOfficial, @NicholaABurley &amp; Rosamund Pike: https://bit.ly/GirlsOnFilm2306",16
300,2020-06-22 15:43:58+00:00,61,"""It's a very complex web, just like systemic racism,"" says Eric Collins, CEO of VC firm @impactxcapital who says venture capitalists are taking an ""entrenched approach"" &amp; that means little investing in biz led by women or people of color. #BlackLivesMatter ",22
301,2020-06-22 15:43:33+00:00,259,"As Pride week begins remember we have our rights because of black & latinx drag artist and transgender people. We must fight for them today, tomorrow, and the day after that. Keep marching, keep being loud, keep demanding justice #BlackLivesMatter &amp; #BlackTransLivesMatter",67
302,2020-06-22 15:41:28+00:00,705,WE THE CHANGE #BlackLivesMatter ,71
303,2020-06-22 15:39:41+00:00,207,For those who believe racism doesn’t exist and that ethnic minorities are treated as equals. #BlackLivesMatter #BLM #WindrushDay,109
304,2020-06-22 15:34:29+00:00,28,"NYC Protests & Vigils for Monday 6/22 As always, please reach out to us if you know of more/future protests and their organizers. #Blacklivesmatter ",27
305,2020-06-22 15:32:01+00:00,70,Teachers of all races must address the proverbial elephant in the breakroom. Here are 5 anti-racism videos for school teachers and staff. #blacklivesmatter #educolor,27
306,2020-06-22 15:31:44+00:00,308,"Threatening to jail the #BlackLivesMatter protesters who toppled the statue of slave trader Edward Colston has echoes of Rosa Parks being jailed for refusing to give up her but seat to a white man in Montgomery, Alabama in 1955. Have we learned nothing in the last 65 years?",113
307,2020-06-22 15:30:21+00:00,33,.@McDonalds posted ​that they support #BlackLivesMatter then went and gave $1 billion to shareholders while workers r​eport poverty wages and lack of ​adequate protection on the job. That's not solidarity. That's hypocrisy. #FightFor15 https://bit.ly/3ehvyfD,13
308,2020-06-22 15:30:10+00:00,125,"notice that not a single writer for @dcexaminer , @realDailyWire , @DailyCaller or @FDRLST is asking CNN's sponsors how they reconcile their support for #BlackLivesMatter with a network that frequently features racists and has neoconfederates like @therickwilson on as pundits",19
309,2020-06-22 15:30:08+00:00,112,The Black Power movements of the 1960s and 1970s can show the way for the #BlackLivesMatter movement https://aje.io/7z7cd — #AJOpinion by @m_elnaiem &amp; Mehmet Dosemeci,53
310,2020-06-22 15:25:40+00:00,177,"COLUMN: Twenty-one minority assistants in the Big East formed @Coaches4Action this month. Among other things, they’ve already got the Big East to agree to become the first conference to have #BlackLivesMatter patches on basketball uniforms this season. ",49
311,2020-06-22 15:25:11+00:00,43,Restorative Justice focuses on healing the harm of crime on victims and communities and engaging them in the justice process. We need: More black jurors More black task force members More black prosecutors WE NEED A RACIAL BIAS AUDIT #MajorReformNOW #BlackLivesMatter ,36
312,2020-06-22 15:25:01+00:00,806,"“All lives matter. Everyone’s life matters. God loves everyone—he never singled anyone out.” #MuhammadAli Jr., the son of the late boxer, said that his father would have been against the ‘#BlackLivesMatter’ movement, in an @NYPost interview.",434
313,2020-06-22 15:23:05+00:00,81,"Slavery wasn't just a North and South American phenomenon. Check out the short film @1745Movie, focusing on slavery in 18th century Scotland. #BlackLivesMatter https://bit.ly/3dqkGuT pic.twitter.com/laHrikmrql",38
314,2020-06-22 15:22:59+00:00,42,"For #MuralMonday, I want to share #BlackLivesMatter art around Atlanta. #StreetArt #StreetArtChat #UrbanArt #PublicArt #BLM #ATL #WeLoveATL #MyAtlanta #MyATL",10
315,2020-06-22 15:20:33+00:00,713,Mercy is glowing in this shot @real_mercyeke #ZenMagazine #BlackLivesMatter #BBNaija #MercyEke,121
316,2020-06-22 15:18:14+00:00,51,"The #BlackLivesMatter mural outside of @CityOfCincy City Hall is beautiful. Went to see it yesterday. #Cincinnati should let the mural stand. It's such a small stretch of road. Let it be used as a statement, and a reminder to those in City Hall that action and change must happen.",10
317,2020-06-22 15:16:10+00:00,46,"Every minority assistant in the Big East has teamed up to form @coaches4action. And now, the league's on the precipice of making it official: it will be the first American sports league to have #BlackLivesMatter uniform patches. News via @GaryParrishCBS",15
318,2020-06-22 15:15:52+00:00,109,"Everybody use #BlackLivesMatter hashtag let’s see how many people will use this, #MuslimLivesMatter",9
319,2020-06-22 15:15:34+00:00,557,“The time is now.” #BlackLivesMatter ,103
320,2020-06-22 15:12:55+00:00,60,The lovely and beautiful @AarikaSamone is launching her official campaign for Congress. Please show her some love and make sure you donate towards her campaign. #YangGangForCongress #YangGang #BlackLivesMatter #BlackTwitter #MCOY https://secure.actblue.com/donate/aarika-for-congress,23
321,2020-06-22 15:10:39+00:00,74,"Half Kentucky’s Black voters live in one county. It will have one polling place... for 616,000 registered voters. SO we need to push like hell and make #CallsForBooker. @Booker4KY VOTERS, are all fighting together. Even if you’re not in KY. DONATE. CALL. #BlackLivesMatter ",59
322,2020-06-22 15:10:34+00:00,45,My Dad and Mother (Nurse )was part of the Windrush generation that was treated atrociously. Never forget never forgive !I’m not in favour of the British Empire Hiding the truth of black people’s contribution is denying that #BlackLivesMatter #StandUpToRacism #Uaf,16
323,2020-06-22 15:08:47+00:00,62,"The BDS movement is showing support for #BlackLivesMatter, calling the resilience of African Americans ""a source of inspiration"" to the struggle of Palestinians against occupation. @themuslimvibe #PalestineTooCantBreathe ",40
324,2020-06-22 15:08:40+00:00,124,https://www.youtube.com/watch?v=-ISrXeztkGE Glasgow says #BlackLivesMatter,11
325,2020-06-22 15:07:40+00:00,6087,"Change is coming and together, we have work to do. Watch and share @BlkLivesMatter newest video #BlackLivesMatter https://youtu.be/Mv3XmmQOOao",2467
326,2020-06-22 15:06:32+00:00,287,"Each day people true colors begin to show. It’s sad, but no matter how much they hate. You can’t stop gods plan #BlackLivesMatter ",61
