,Datetime,Favorites,Text,Retweets
754,2020-06-15 08:20:58+00:00,132,"In the wake of the events of the past few weeks right up to this weekend, I thought you might find my story interesting to read https://bit.ly/2MVdXxY. It’s my attempt to shine a light, increase awareness and call to action in some small way. #BlackLivesMatter",30
755,2020-06-15 08:20:18+00:00,368,#BlackLivesMatter protests: Latest updates The Atlanta police shooting of Rayshard Brooks has been ruled as a homicide. Follow our LIVE blog for the latest: http://aje.io/f59l3,144
756,2020-06-15 08:16:43+00:00,75,"Despite the protests, another Black has been killed by the fascist police, despite the protests in #Balochistan, another Maliknaz (kulsoom) has been Killed by Death Squads .importance of humanity has probably been limited to books. #BlackLivesMatter #BalochLivesMatter",53
757,2020-06-15 08:15:25+00:00,437,"She was 19 , her name is Oluwatoyin “Toyin” Salau was missing since June 6, after her tweets about how she was molested sexually. it has been reported that her body has been found dead. #JusticeforToyin #BlackLivesMatter ",255
758,2020-06-15 08:11:39+00:00,39,"This white guy fights with the Cop, runs away, gets tased by the Cop, runs away, jumps in the Police Car, gets out, gets back in his car, takes off, comes back again. This time the Cop has a Gun on him but doesn’t shoot. If he were a Black Man WE KNOW #BlackLivesMatter #BLM",14
759,2020-06-15 08:11:31+00:00,46,The @GuardianAus article blocked by Facebook is a story about how Facebook admitted it incorrectly blocked an image of Aboriginal men in chains. #slaveryinAustralia #BlackLivesMatter #blacklivesmatteraustralia #IndigenousLivesMatter #AboriginalLivesMatter,22
760,2020-06-15 08:04:12+00:00,220,There has been lots of talk about educating ourselves on #BlackLivesMatter issues and I’m just not convinced that just looking at sickening violent and angry tweets is enough to truly grasp the situation and the weight of history which has lead us here,15
761,2020-06-15 08:03:18+00:00,9651,"What never ceases to amaze me is peoples’ capacity to exploit Black lives to make money. I mean, white Brit Demetriou Georgios trying to trademark #BlackLivesMatter so he can make Black people pay him royalties for demanding equality is peak exploitation. We can oppose the claim. pic.twitter.com/lHdYkJqpWt",7488
762,2020-06-15 08:02:22+00:00,96,Oluwatoyin Salau was murdered after speaking out on sexual assault on Twitter and fighting openly for black lives. Who will protect black woken when will this end #BlackLivesMatter,43
763,2020-06-15 08:00:44+00:00,225,"I’m assuming that the United Kingdom is the only country to have had standalone counter protests against #BlackLivesMatter? If that’s the case, it really does fatally undermine our racist Prime Minister’s claim that the U.K. is not a racist nation.",67
764,2020-06-15 08:00:38+00:00,36,"@ProjectRS is a proud ally of the #blacklivesmatter movement and the fight against systemic racism. Along with today’s Discourse episode, we are sharing past episodes that highlight the ways the academic study of religion and its scholars are working to end racial injustice.",16
765,2020-06-15 07:58:15+00:00,136,"""The empty dress""...symbolising non-representation in art galleries and museums. #BlackLivesMatter #MuseumActivism #ArtActivism https://twitter.com/BarbieReports/status/1086739880141561856",30
766,2020-06-15 07:58:13+00:00,181,"For people NEW to #Brooklyn, fireworks &amp; loud music is a cultural norm from Memorial Day to Labor Day. To whoever called the police tonight in #Flatbush about the fireworks, pls know that you may cause someone to be murdered by the NYPD #BlackLivesMatter ",90
767,2020-06-15 07:55:03+00:00,96,Please read. #BlackLivesMatter #BLM #Casting #RepresentationMatters #Actors #CastingDirectors,25
768,2020-06-15 07:54:05+00:00,34,These are #Telegram channels. We need to support #BlackLivesMatter to get this platform to tackle racism and remove hate groups. They are radicalising young minds to an agenda of racism. ,19
769,2020-06-15 07:53:23+00:00,31,"Listen to her words, listen to how she fought for black people and trans inclusivity. She deserves to be here and she deserves to be fought for #RipToyin #BlackLivesMatter ",17
770,2020-06-15 07:50:57+00:00,28,"Day 2. Black artists. Dr Shirley Thompson is an English composer, conductor and violinist of Jamaican descent. She became the first woman in Europe to have composed and conducted a symphony in the past 40 years. #blackartists #BlackLivesMatter #uaeperformingarts @shirleyjtmusic",14
771,2020-06-15 07:49:17+00:00,42,‘The two defining events of 2020 - #coronavirusuk and #BlackLivesMatter - offer #Glasgow the best opportunity in a generation to finally transform #GeorgeSquare into the vibrant civic centre Glaswegians deserve.’ My column in today’s @heraldscotland.,11
772,2020-06-15 07:43:59+00:00,45,Any commission run by this government will be a coverup of the reality of racism in Britain #BorisJohnson talks of ending the ‘sense of victimisation’ - he has learnt nothing from #BlackLivesMatter protests #WeDemandChange,26
773,2020-06-15 07:41:08+00:00,242,"The FULL & UNCENSORED episode of ROSE/ICKE IV is now available to watch EXCLUSIVELY on the DIGITAL FREEDOM PLATFORM, watch David talk about the #blacklivesmatter movement, George Soros &amp; how we can unite as a society right here: http://freedomplatform.tv/icke #LondonRealArmy #RI4",117
774,2020-06-15 07:40:52+00:00,113,"""I breathe and lo! the chattel becomes a man"". Frederick Douglass tribute, Cork City centre, the abolitionist and activist who travelled to Ireland after escaping slavery in 1845. #BlackLivesMatter #EndDirectProvision #streetart #corkcity",40
775,2020-06-15 07:40:04+00:00,422,No to racism in the Sudanese Way #BlackLivesMatter Watch link: https://youtu.be/jR7-U2egmuY,83
776,2020-06-15 07:36:51+00:00,99,There’s literally no shame in the colony. #BlackLivesMatter ,16
777,2020-06-15 07:36:46+00:00,1160,"On #r4today @DavidLammy hitting the nail on the head again and again. “The time for review is over and the time for action is now”. We don't need another review written on the back of a fag packet, more dithering and delay. #BlackLivesMatter",270
778,2020-06-15 07:35:32+00:00,289,Systemic racism runs through the global fast food corporations making millions in profit by paying us poverty wages. #BlackLivesMatter - and black quality of life matters. Help us send a message to our CEOs by signing this petition now. ,219
779,2020-06-15 07:31:58+00:00,97,"Good Morning everyone. As you start your Monday, I wish you a week filled with positive news and more reasons to smile. How is the weather at yours this Monday morning?? #ZenMagazine #BlackLivesMatter",25
780,2020-06-15 07:30:24+00:00,48,"We can't keep screaming #BlackLivesMatter when the lives of Black - women, disabled people, queer people and trans people don't matter to y'all. It's not only about Black men. It's about all Black people.",30
781,2020-06-15 07:30:07+00:00,116,“The enemies of a people are those who keep them in ignorance.” ~ Thomas Sankara #BlackLivesMatter,46
782,2020-06-15 07:29:32+00:00,666,"As of 3pm kst, Jimin's articles occupy 16/30 spots of Naver's most liked articles section. The articles are about his ending ment & performance during #BangBangConTheLive, his fans donating to #BlackLivesMatter, FESTA birthday video, and his media photos. ",276
783,2020-06-15 07:28:13+00:00,133,"""We suffer political oppression, economic exploitation and social degradation. All of them from the same enemy.” ~ Malcolm X #BlackLivesMatter",54
784,2020-06-15 07:27:58+00:00,917,"That interview with @DavidLammy @BBCr4today was on fire. From Macpherson to Windrush to his own Lammy review, the recommendations stack up on how to tackle racism, discrimination and disadvantage. “The time for review is over and the time for action is now”. #BlackLivesMatter",208
785,2020-06-15 07:27:18+00:00,119,"On @EmmanuelMacron's response to #BlackLivesMatter that France will erase no name from its history or tear down any statue, it's worth noting that the Republic has done both in the recent past. Pétain statues taken down; Pétain streets renamed.",44
786,2020-06-15 07:24:29+00:00,72,"""The function of education is to teach one to think intensively and to think critically."" ~ Dr Martin Luther King Jr. #BlackLivesMatter",32
787,2020-06-15 07:23:03+00:00,188,"“The worst enemy to creativity is self-doubt so if you weren't an optimist, it would be impossible to be an architect."" Proposed and Approved 12 bedrooms villa Design..#architecture #3Dprinting #3dsMax #NorthernLivesMatter #BlackLivesMatter #thamesandhudson #dontleavemechallenge.",62
788,2020-06-15 07:23:01+00:00,112,FIND HER KILLER. there’s absolutely no coverage in our city for her & it happened 12 hours ago as of now. her name is na’kia crawford. #justicefornakia #BlackLivesMatter #BLM,109
789,2020-06-15 07:21:30+00:00,74,".@DavidLammy totally nails it on #Today programme just now. We’ve had review after review, with clear findings and recommendations. Now is the time for action. Action on criminal justice system, action on windrush compensation, action on race discrimination #BlackLivesMatter",28
790,2020-06-15 07:17:06+00:00,1583,.@DavidLammy absolutely outstanding on @BBCr4today. An excoriating run through of reviews and recommendations that already exist and need to be implemented. “The time for review is over and the time for action is now”. #BlackLivesMatter,393
791,2020-06-15 07:11:39+00:00,297,"Which is, in summary, everything wrong with #blacklivesmatter. It is a movement based on profound ignorance. ",74
792,2020-06-15 07:02:57+00:00,53,"3 AM. Was told that another round of tear gas was let off while I was gone. This is what it looks like out here rn. Maybe a few less than 100 people out here still standing off w/ police. My people and I are heading out. Will continue to boost. Richmond, VA. #BlackLivesMatter ",15
793,2020-06-15 07:00:54+00:00,124,BEHAVIOURAL CHANGE IS NOT ENOUGH | If your wife asks do you love her it's not the right time to say I love everybody. #BlackLivesMatter #MOATS FOCUS ON WHAT MATTERS: https://buff.ly/2BZHjJo @georgegalloway | @moatstv | @RT_com | @SputnikInt,57
794,2020-06-15 06:55:36+00:00,257,Reading about the sudden death of Oluwatoyin Salau saddens my heart. She deserved to be protected but that didn’t happen. Rest in heaven Toyin #BlackLivesMatter,29
795,2020-06-15 06:53:07+00:00,44,They’re hanging us from trees and ruling it suicide at the scene. Black people don’t hang themselves from trees. Klansmen do. And it’s called lynching. #BlackLivesMatter ,35
796,2020-06-15 06:52:26+00:00,18,Seattle! Help my friend: Trader Joes on Cap Hill is closing in retaliation for workers organizing/protesting for #BlackLivesMatter. Stranger Article: https://www.thestranger.com/slog/2020/06/14/43907515/capitol-hill-trader-joes-crew-members-speak-out-after-corporate-closes-store-indefinitely Primary source &amp; petition: https://savetjs130.com,20
797,2020-06-15 06:52:14+00:00,108,"“The ultimate measure of a man is not where he stands in moments of comfort and convenience, but where he stands at times of challenge and controversy. The true neighbor will risk his position, his prestige & even his life for the welfare of others..” MLK, 1963 #BlackLivesMatter ",18
798,2020-06-15 06:48:00+00:00,110,"Thousands of people formed a socially distanced human chain through Berlin on in support of the #BlackLivesMatter movement, protesting against racism, discrimination, and social inequality. ",52
799,2020-06-15 06:47:23+00:00,118,Our Queen in her 90s has been a fantastic Ambassador for our Country and by most of us is loved and cherished. Look at the box guarding the Statue #BlackLivesMatter attitude spray painted on there F**K the Queen. What happens to these people surely there's CCTV to catch them. ,82
800,2020-06-15 06:45:00+00:00,13797,Gross hypocrisy by Boris Johnson to talk about need for “a cross-governmental commission to look at all aspects of inequality” Black people don’t need another commission. They need action on existing reports and reviews #BlackLivesMatter,3620
801,2020-06-15 06:41:42+00:00,91,The lack of leadership from the British Government is now glaring as @EmmanuelMacron says what millions of us want @BorisJohnson to say. Come on @Conservatives But the #BlackLivesMatter political cult back in its box! ,42
802,2020-06-15 06:41:37+00:00,253,"As that old, cherished saying goes; ""Facts don't care about your feelings."" @BrandonStraka #WalkAway #GeorgeFloyd #GeorgeFloydProtests #BlackLivesMatter #BLM",65
803,2020-06-15 06:37:40+00:00,173,"I just wanted to stay, despite all that is happening - I love you all very much, and I hope that you find time to celebrate your voice, your unique experience and your right to live! #PRIDE2020 #blacklivesmatter #blacktranslivesmatters pic.twitter.com/Je8VIohk2T",28
804,2020-06-15 06:37:16+00:00,240,Dallas PD is the same police department that murdered #BothamJean and #JoshuaBrown. Lying in both cases. #BlackLivesMatter,83
805,2020-06-15 06:34:31+00:00,132,The eradication of Bristols past continues. #BlackLivesMatter #Hitler used a similar tactic when burning books didn’t he?,50
806,2020-06-15 06:33:20+00:00,75,Megan @TheeStallion attends the #BlackLivesMatter protest in Los Angeles today ,13
807,2020-06-15 06:30:48+00:00,128,"Brooklyn, New York. #BlackLivesMatter ",79
808,2020-06-15 06:28:28+00:00,345,Hellboy: 1 Ted Cruz & Gym Jordan: 0 #BlackLivesMatter #coronavirus #Biden2020 #MSNBC @tedcruz @Jim_Jordan,9
809,2020-06-15 06:27:59+00:00,100," Say her name. OLUWATOYIN ""TOYIN"" SALAU #JusticeForToyin #BlackWomenMatter #BlackLivesMatter ",36
810,2020-06-15 06:27:02+00:00,54,Just ystday @RunnymedeTrust had a letter published in @thesundaytimes calling on the govt for MORE ACTION and *less rhetoric* on racial inequalities. How tone deaf do you have to be to ignore the evidence produced by your OWN government on racial inequalities? #BlackLivesMatter ,20
811,2020-06-15 06:24:55+00:00,123,How many politicians supported the crime bill? How many were once against gay marriage? How many of them are STILL against universal healthcare? The Green Party has been fighting for 99% all along. Even when it wasn’t popular. #LGBTQ #BlackLivesMatter #TransRightsAreHumanRights,40
812,2020-06-15 06:23:12+00:00,633,"Right now on #goodmorningbritain discussing #BlackLivesMatter. 4 white men &amp; 1 black woman squashed into the worst spot - bottom right hand corner, as always. Do better @ITV.",108
813,2020-06-15 06:22:09+00:00,256,"This is so interesting and so upsetting. Defunding the police isn’t abolishing emergency services — it is dismantling a broken system and strategically building a new, transparent, & more efficient one. People shouldn’t profit from ruining other people’s lives. #BlackLivesMatter ",75
814,2020-06-15 06:19:28+00:00,13350,this is so devastating. 19... RIP Toyin. #BlackLivesMatter. yes they fckin do. https://twitter.com/shariauna_/status/1272379024732499969,5923
815,2020-06-15 06:17:58+00:00,633,I really need to connect with more like minded people. People who think #BlackLivesMatter. Who fight for #WomensRights. Who embrace the #LGBTQ community. Who love #nature and fight #ClimateChange and #plasticpollution. Who can’t stand Trump. Are you folks out there? I hope so!,72
816,2020-06-15 06:17:22+00:00,557,"Wow the #BlackLivesMatter protest in Providence, Rhode Island today was massive. ",253
817,2020-06-15 06:16:40+00:00,100,WHERE ARE THE PROTESTS FOR KAYDENCE MILLS??? HER LIFE MATTERED #BlackLivesMatter #ChildrensLivesMatter,58
818,2020-06-15 06:11:58+00:00,221,"Please keep signing, donating and make our voices heard. We are not going to stop now showing love from the hard dance community #BLACKLIVESMATTER ",39
819,2020-06-15 06:09:35+00:00,154,"What’s everyone dashing out to buy in England today? #shopsreopening Thought I’d pop down to the High Street to bag myself some racial equality #BlackLivesMatter, a new set of honest cabinet ministers @Keir_Starmer, and a fully funded #NHS",23
820,2020-06-15 06:09:25+00:00,82,"Ngl I’m worried a lot of y’all have stopped caring about #BlackLivesMatter bc it’s not constantly being tweeted about, reported on, etc etc. Please consider being a consistent ally. This is a movement not a moment. There are literal lives at stake.",25
821,2020-06-15 06:08:24+00:00,106,"Dont wish for change, be the change. #BlackLivesMatter ",49
822,2020-06-15 06:05:03+00:00,558,"Except we know the cops would roll in hot, shoot him and ask her questions later..... it’s why they act this way - the system has given them every reason to believe it’s the right way #BlackLivesMatter",24
823,2020-06-15 06:04:55+00:00,66,"19 year old #BlackLivesMatter activist Oluwatoyin Salau #JusticeforToyin went missing on June 6, and her body has reportedly been found. She was last seen on June 6th. She tweeted about her sexual assault before she went missing for several days and her body was recently found.",46
824,2020-06-15 06:03:25+00:00,5275,"2 AM TEAR GAS. I’m off the scene driving in car. Entire parking lot is cleared. Several tear gas bombs let off. It’s in my nose. Burning. I’m safe. Crowd dispersing. RICHMOND, VA. Police headquarters. Jefferson st. #BLACKLIVESMATTER ",1237
825,2020-06-15 06:02:20+00:00,86,No one is you and that is your power #BlackLivesMatter ,64
826,2020-06-15 06:01:19+00:00,122,RACE WAR? | Race is an entirely manufactured concept. Because the DNA of a black man and a white man is identical. #BlackLivesMatter #MOATS SO WHAT'S THE PROBLEM?: https://buff.ly/3hmVo41 @georgegalloway | @moatstv | @RT_com | @SputnikInt,48
827,2020-06-15 05:58:08+00:00,68,Well its Day 20 of the #BlackLivesMatter crowd protests. And we ain't seeing a mass covid wave? Bashawe! ,23
828,2020-06-15 05:56:39+00:00,51,I hope to God now he has time on his hands that my hero @Nigel_Farage will make a comeback in Politics. Start the Brexit Party moving again and get involved in this #BlackLivesMatter situation because listening to him on @LBC he wasent having any of it. He could see both sides.,20
829,2020-06-15 05:55:19+00:00,160,She was a leading #BlackLivesMatter activist. She got sexually assaulted by a BLACK MAN and was found dead after reporting the assault. I am so angry. Men do not deserve our anger or our voices. Let them fight their own battles. Rest in Peace Oluwatoyin ,93
830,2020-06-15 05:55:19+00:00,303,History on the frontlines. Photo collection of the Bay Bridge Shutdown - 6.14.2020 - by : me - #BlackLivesMatter ,124
831,2020-06-15 05:54:33+00:00,117,RIP Oluwatoyin Salau Black women do not deserve this. Imagine being 19 protesting for the lives of black men only to be assaulted and killed. Toyin was literally betrayed by those who were supposed to protect her. Shit is devastating. #JusticeForToyin #BlackLivesMatter pic.twitter.com/6FgwsdjeKF,76
832,2020-06-15 05:53:56+00:00,55,"#BlackLivesMatter You’re a fraud &amp; your #BLM is a fraud what you are #BlackLiesMatter while you protest,scream ,Lie #DefundThePolice &amp; tearing statues Here’s Your own PC @JoeBiden⁩ bragging about his law when he started putting you away in 1994 for Money,You hear me for Money",64
833,2020-06-15 05:43:03+00:00,182,Dear @conservatives You will excuse me but hearing @BorisJohnson saying he's gonna create a racism inquiry feels as genuine as if Hitler had decided to create an inquiry on anti-Semitism. #BlackLivesMatter ,88
834,2020-06-15 05:41:58+00:00,80,"If you’re tired of reading about racism, talking about racism, and watching ppl dying due to racism, then think of how tired we are of experiencing the shit. #BlackLivesMatter",12
835,2020-06-15 05:41:03+00:00,79,Over the weekend AFL recommenced after a #Covid_19 halt. I was so proud to see all players and umpires kneeling before each game played in support of #BlackLivesMatter #ONEV1 AFL players take a knee in support of Black Lives Matter movement https://www.sbs.com.au/news/afl-players-take-a-knee-in-support-of-black-lives-matter-movement?cid=newsapp:socialshare:twitter @SBSNews,37
836,2020-06-15 05:38:14+00:00,182,I have had enough of watching the mainstream media parading around all these #BlackLivesMatter people as if they are some kind of Heroes. Where as we've seen over the weekend they are everything but. They are a bunch of thugs using a cause for mayhem and violence disgusts me.,81
837,2020-06-15 05:37:41+00:00,78,"My latest: @Qz's #UntoldAfrica. Fascist Italy's invasion of Ethiopia in 1935 saw African American protesters, journalists &amp; war volunteers step up for Ethiopia. ns ought to reciprocate as movements catch fire in . #BlackLivesMatter #GeorgeFloydProtests https://qz.com/africa/1868699/from-african-american-freedom-to-ethiopias-war-against-fascism/",12
838,2020-06-15 05:36:58+00:00,408,Oluwatoyin Salau made this incredibly powerful video that perfectly summarised all of the protests Today she was murdered #SayHerName #BlackLivesMatter #RestInPower,332
839,2020-06-15 05:36:44+00:00,143,This a MOVEMENT not a Moment!! Even if it’s not trending anymore don’t forget what’s really going on out there #BlackLivesMatter ,62
840,2020-06-15 05:33:22+00:00,61,"Even as the Marxist group #BlackLivesMatter villifies police and tries to instigate looting and rioting in our cities, the data show there ISN’T a significant problem with our police. #BackTheBlue #NYPD #KAG #TWGRP",89
841,2020-06-15 05:30:56+00:00,25,"Her story really saddens me, my heart feels heavy and I just feel sick inside. She deserved so much more than this, she deserved to be heard. Rest In Peace Sweet Angel you will live forever in our hearts #SayHerName #JusticeForToyin #OluwatoyinSalau #BlackLivesMatter ",16
842,2020-06-15 05:30:42+00:00,155,"admit it. seeing footage of violent police is sickening. disgusting. why don’t mayors, governors search worldwide for best community policing models and adopt their top points. #IndigenousLivesMatter #BlackLivesMatter",32
843,2020-06-15 05:30:00+00:00,62,"Tshegofatso Pule, who was eight months pregnant, went missing on June 4 in Johannesburg, South Africa. Four days later, she was found stabbed and hanging from a tree. No one has been arrested for the murder of Pule and her unborn child. #BlackLivesMatter #JusticeForTshegoPule",44
844,2020-06-15 05:27:09+00:00,124,"Unfollow him if you want to, but if you really want to make a difference and protect the disenfranchised, donate to bail funds and support #BlackLivesMatter ",24
845,2020-06-15 05:24:34+00:00,96,Change is happening and we will not allow it to be stopped. Add your voice to that which is right and just. #BlackLivesMatter #ObamaDayJune14th,61
846,2020-06-15 05:24:13+00:00,43,"Wait? There’s been not one, but two hangings around this area and they’re wanting to call them suicides? That’s not acceptable. Investigate and find their killers. #BlackLivesMatter Police investigate hanging death of black man; 2nd in 2 weeks ",39
847,2020-06-15 05:22:17+00:00,29,"Please read this, pleaseeee! #BlackLivesMatter #PoliceBrutality",20
848,2020-06-15 05:21:32+00:00,437,"This is a statue of La Mulâtresse Solitude who in 1802 helped lead a slave revolt in Guadeloupe whilst 8 months pregnant, her last words before she was hanged: ‘Live free, or die’ #BLM #BlackLivesMatter ",153
849,2020-06-15 05:17:24+00:00,2557,The crowd gathered outside the Seattle West Precinct after claiming the East Precinct a week ago. The speakers said they are not there to be peaceful and promised to return when there were more of them. #BlackLivesMatter ,1452
850,2020-06-15 05:16:40+00:00,255,Patrick Hutchinson and his posse are this weeks coolest humans. #BlackLivesMatter,16
851,2020-06-15 05:14:08+00:00,68,#BlackLivesMatter protest that began at Molasky Park earlier tonight has now made its way to the strip @KTNV,21
852,2020-06-15 05:12:05+00:00,157,"I appreciate your celebration. You're of my favourite rival players. The world appreciates you Marcelo, for taking the stand. #BlackLivesMatter ",22
853,2020-06-15 05:05:36+00:00,626,"Actually 2 Bethel , Ohio cops saw the biker punch the #BlackLivesMatter protester in the back of the head and made no arrests. WTF ",148
854,2020-06-15 05:03:18+00:00,787,My heart is in my stomach and I can’t stop fucking crying. Oluwatoyin deserved so much fucking better. Protect Black women. Care for Black women. Fight for Black women. #OluwatoyinSalau #SayHerName #BlackLivesMatter,264
855,2020-06-15 05:00:12+00:00,122,"AERIAL LOOK: Hundreds marched in the streets of Los Angeles, California in solidarity with #BlackLivesMatter and to celebrate #PrideMonth",40
856,2020-06-15 04:59:12+00:00,70,"I am trying to write but it is difficult when 1. Black men and Black women are being lynched and murdered by police 2. Black migrants are being denied asylum, forced to wait, or deported, and 3. Black students and Black faculty are not supported in academia. #BlackLivesMatter",12
857,2020-06-15 04:57:02+00:00,307,Everyone vs Racism #blm #BlackLivesMatter ,37
858,2020-06-15 04:57:02+00:00,74,#boystown stand tf up and come correct! @SheaCoulee #BlackExcellence #BlackLivesMatter #BlackTransLives We took an oath today,26
859,2020-06-15 04:56:37+00:00,338,Late night crew - can you do me a solid? I have a responsibility to hand the microphone to peers when I see they need a boost. Please follow Maine Congressional candidate for #ME01 @AaronAmede. #BlackLivesMatter; his candidacy matters.,123
860,2020-06-15 04:54:05+00:00,75,"raised & donated $3700 from donations to my personal venmo, paypal, and cashapp yesterday for the #BLACKLIVESMATTER beneficiaries of @WynwoodPride at MISS TOTO'S [DIGITAL] FUN HOUSE!!!",7
