,Datetime,Favorites,Text,Retweets
607,2020-06-14 15:17:50+00:00,73,"Less than 2 weeks away guys! Please come join us for silly antics, hot sauce challenges, mystery jellybeans, suits, stories, and laughs all in the name of charity as we collect donations for the #BlackLivesMatter movement and Native Movements! Thursday 6/25 at 6PM CST! ",26
608,2020-06-14 15:17:45+00:00,162,Are we sleepwalking into a plan to DIVIDE AND RULE US? Are we in the middle of a manufactured race war? Brian Rose & David Icke will reveal the TRUTH behind the #BLACKLIVESMATTER movement at 5PM UK/12PM NOON EST today. Watch THE LIVESTREAM here: http://freedomplatform.tv/icke #RI4,94
609,2020-06-14 15:17:35+00:00,50,"Tomorrow (Monday, June 15 at 7pm Eastern) important #CreakyChats on #disability+#blacklivesmatter. Hosted by @Imani_Barbarin @Tinu @DawnMGibson. (Image: photos of Tinu, Dawn &amp; Imani) #BlackDisabledLivesMatter #DisabledBlackLivesMatter #racialjustice",34
610,2020-06-14 15:16:58+00:00,36,#BlackLivesMatter is NOT only about the police! It’s about the racist system these police are here to defend.,13
611,2020-06-14 15:16:39+00:00,60,My church said “and that’s on periodt!” #BlackLivesMatter ,30
612,2020-06-14 15:16:31+00:00,18743,and Breonna has yet to get her justice. why????? #BlackLivesMatter,6559
613,2020-06-14 15:15:37+00:00,28,Playing 4 Pride Update We didn’t have the data set up for week one so I’ll be doubling my week two total as my donation! To be entered to win a signed jersey send me a screen shot of your donations! @AthleteAlly @playingforpride #playingforpride #BlackLivesMatter ,8
614,2020-06-14 15:15:11+00:00,72,On 8th June the Prime Minister said #BlackLivesMatter But now we know that since the end of May the Government has had recommendations to address the disproportionate impact of #covid19 on BAME communities - and has deliberately held them back.,43
615,2020-06-14 15:14:49+00:00,209,#BlackLivesMatter everyday and at all times!! #JusticeforModouLaminSise,39
616,2020-06-14 15:14:28+00:00,49,4 BLACK PEOPLE HANGING FROM TREES & A BLACKTRANS WOMAN FOUND DISMEMBERED IN A SUITCASE THIS WEEK & THE MEDIA HAS THE AUDACITY TO SAY IT’S A ”SUICIDE”??? THE FIGHT IS FAR FROM OVER! #BlackLivesMatter #BlackTransLivesMatter,28
617,2020-06-14 15:13:23+00:00,57,hi friends - DO NOT support this brand. i met the owner today; he gifted me his product then projected his unbelievably racist views on to me. suffice to say i gave the toothpaste right back and told him i wouldn’t be supporting a company run by a racist. #blacklivesmatter ,12
618,2020-06-14 15:12:45+00:00,137,Today is the most perfect day since yesterday to arrest Breonna Taylor’s murderers. #BlackLivesMatter,41
619,2020-06-14 15:11:42+00:00,70,Lots of support from across Southwark for today's #BlackLivesMatter protest in Burgess Park along with great speakers. ,24
620,2020-06-14 15:10:52+00:00,194,Only a few months till @JoeBiden kicks @realDonaldTrump out of the @WhiteHouse #RacistTrump #BlackLivesMatter #VoteBlueToSaveAmerica http://nestorgomezstoryteller.com/immigration-stories.html,28
621,2020-06-14 15:09:34+00:00,21552,#AllBirthdaysMatter lowkey shits on #BlackLivesMatter... like the police haven't even stopped killing black people in the U.S.,1832
622,2020-06-14 15:09:10+00:00,38,"Actress Maryam Abu Khaled describes the casual racism black Palestinians endure every day. I have spoken to numerous Afro-Palestinians in Jerusalem and Jericho. Sadly, they had similar stories to tell. #racism #BlackLivesMatter ",27
623,2020-06-14 15:07:23+00:00,31,"if you post on the lgbt tag today pls put blm petitions to sign under it , DONT LET IT DIE OUT. #BlackLivesMatter",20
624,2020-06-14 15:06:58+00:00,224,"I don't know who need to hear this but resisting arrest is NOT a capital crime. Also, feeling threatened is not the same as being in imminent danger. Your irrational and racist fear of black people does not change this. #BlackLivesMatter",99
625,2020-06-14 15:05:59+00:00,14229,Virginia: 5 white supremacist terrorists attacked a Black pastor w/racist remarks & violent threats at his home The victim—Pastor Leon McCray—dialed 911 The police arrived—& arrested him instead of his attackers This is America #BlackLivesMatter ,11941
626,2020-06-14 15:05:38+00:00,101,I stopped by yesterday's peaceful #blacklivesmatter unity rally in Lakewood Park. ,15
627,2020-06-14 15:03:26+00:00,105,Video: Massive socially distanced #TakeTheKnee in #Totteham North London today #BlackLivesMatter #JusticeForGeorgeFloyd,52
628,2020-06-14 15:01:44+00:00,60,This was powerful. This conversation must continue! #BlackLivesMatter ,22
629,2020-06-14 15:00:58+00:00,77,"On the third anniversary of #Grenfell, surely one of the most moving &amp; meaningful occasions ever witnessed on #TootingCommon Thanks to organisers &amp; all who spoke from the heart &amp; with such dignity #BlackLivesMatter #BLMLondon",26
630,2020-06-14 15:00:31+00:00,119,There’s a brand new stunning mural in honour of #BlackLivesMatter and #GeorgeFloyd at the Rouen legal graffiti wall in Hochelaga-Maisonneuve. Created by Christopher Powell and Caroline Thibault. Image: Christopher Powell #Montreal #Quebec #ICantBreathe,35
631,2020-06-14 15:00:00+00:00,121,"If you’re tempted to think protests are only happening in big cities like New York & Philly, don't be deceived. Folks from smaller cities in the Deep South, to the hollers of Kentucky, to tiny coastal Carolina towns won't be ignored. #BlackLivesMatter ",50
632,2020-06-14 14:59:23+00:00,188,"I still don’t get it. Black lives matter. It’s simple. So why do I keep seeing debates and people trying to justify an opposing opinion. There is no discussion, there can’t be! Black lives matter. There is no debate. #blacklivesmatter",10
633,2020-06-14 14:59:22+00:00,102,Please sign/share petitions and donate if you can #BlackLivesMatter ,41
634,2020-06-14 14:55:36+00:00,133,"What does a Marxist-Leninist “Strategy for a Black Agenda” look like? Read up on the late Communist Party USA chairman, Henry Winston, to find out! #BlackLivesMatter #AbolishThePolice",56
635,2020-06-14 14:54:55+00:00,47,"All lives CAN’T matter until BLACK LIVES MATTER. This is not over, we’re not done. #Cookie #Cookies #SugarCookies #DecoratedCookies #Baker #NolaBaker #NolaEats #Nola #NewOrleans #Louisiana #IcedCookies #BLM #BlackLivesMatter #SayTheirNames #BLMCookies",35
636,2020-06-14 14:53:16+00:00,129,George Floyd should be alive. Breonna Taylor should be alive. Ahmaud Arbery should be alive. Sean Reed should be alive. Tony McDade should be alive. Rayshard Brooks should be alive. Our nation’s leaders must act now before another Black life is needlessly lost. #BlackLivesMatter,57
637,2020-06-14 14:52:44+00:00,1244,"Just had a little cry at this story. In a world of Donald Trumps, be a Peter Norman. Listen, respect and learn. #BlackLivesMatter ",170
638,2020-06-14 14:49:19+00:00,57,These people won't stop unless they are made to stop. Left loonies are the same everywhere #BlackLivesMatter ,20
639,2020-06-14 14:46:30+00:00,72,CHARITY ART STREAM TODAY! Raising funds to help fight injustice in America! 100% of proceeds will be going to help Black Lives Matter. Please stop by or donate if you can. #BlackLivesMatter Link to Stream: https://picarto.tv/KitsuneKit Link to Fundraiser: https://paypal.me/pools/c/8pXhugVZ17,46
640,2020-06-14 14:46:21+00:00,223,"This is the best thing I've seen all week #BlackLivesMatter #KarensGoneWild #karen ""I'd like to speak to the manager-OF JUSTICE!""",44
641,2020-06-14 14:46:04+00:00,110,Anybody screaming #BlackLivesMatter for #RayshardBrooks can kiss my entire black ass. Black Lives Matter shouldn't mean you're above the law. Reform the Criminals and stop making excuses for criminals. #TalkingAboutRace #ThatsWhyImBoycotting pic.twitter.com/bOrIPB1o7F,35
642,2020-06-14 14:45:46+00:00,337,"There are millions of black people who wake up every day and do the right thing. We do not riot. We do not loot. We do not do drugs. We do not disrespect law enforcement. And yet, COPS STILL KILL US... #PoliceBrutalityPandemic #BlackLivesMatter #ObamaDayJune14th",25
643,2020-06-14 14:45:37+00:00,5095,Since the timeline’s pretty much back to normal thought i’d let you know this happened today in Tokyo. #BlackLivesMatter #BLMTokyoMarch,2783
644,2020-06-14 14:45:03+00:00,314,"'""This is not the time to take it away from #BlackLivesMatter, this is a time to recognize how our own histories intersect,"" says Jade Byard-Peek, a black and Mi'kmaw, two-spirit trans woman in Ottawa. https://bit.ly/3fh5Nwk",97
645,2020-06-14 14:44:05+00:00,371,Anyone else remember this? #BlackLivesMatter #DropOutBiden,93
646,2020-06-14 14:39:29+00:00,26,"Hey so... while we are focused on this moment, we need to center antiracism in schools. It's not just about the ""culturally relevant"" curriculum. We MUST acknowledge that schools uphold outdated racist practices. #BlackLivesMatter #Letsk12Better READ THIS TWEET. ",10
647,2020-06-14 14:39:20+00:00,83,Image of the attacker that seriously assaulted a man in London yesterday at the violent #blacklivesmatter protests. ,130
648,2020-06-14 14:39:20+00:00,149,Thank you to @tvgurl @CityNews for featuring me in your series for Indigenous history month. I appreciate how you reflected my work &amp; lift voices during this important time of #Indigenous #resistance &amp; #resurgence #blacklivesmatter #MMIWG #endpoliceracism,47
649,2020-06-14 14:37:54+00:00,43,International Criminal Court oversight chief ‘deeply regrets’ US decision to target officials investigating Afghanistan war crimes https://shar.es/aHLz6o #Ultimately Trump speading white supremacy &amp; privilege to international law. #BlackLivesMatter #ONEV1 #OVHumanRights,36
650,2020-06-14 14:36:57+00:00,23,"Facts: If you go to the #BlackLivesMatter website to donate, all money goes to #ActBlue for political support of WHITE Liberal Democrats &amp; says your donation money can be “redistributed”. #BLM? More like “Money for White Liberals”... enslaving the mind... (see where $$$below)",20
651,2020-06-14 14:35:00+00:00,117,"Opinion by @DiDimond If you don’t agree that #BlackLivesMatter, you should stop reading now. If you believe blacks are victims of a conspiracy of #SystemicRacism from the #Police, you may want to look away. The facts simply do not bear out that claim.",46
652,2020-06-14 14:34:57+00:00,51,"We march today to demand that our institutions ACT on their statement that #BlackLivesMatter. Join us in person @RIH at noon, and/or virtually by signing and sharing this pledge. #codeblackRI #healthworkersagainstracism #medtwitter http://www.tinyurl.com/hwsagainstracism",23
653,2020-06-14 14:34:03+00:00,63,"If you missed any of the #BlackLivesMatter Moments during the event so far, you need to stop, watch and listen to these powerful words from our Black Speedrunners... @StudentsoGaming's #BLM Moment",28
654,2020-06-14 14:34:03+00:00,204,"So can we finally talk about how our cities are still segregated? And that using exclusionary zoning to ban affordable housing is redlining? #BlackLivesMatter can’t end where our neighborhoods begin. Luckily, I already have a bill in mind. ",68
655,2020-06-14 14:31:18+00:00,831,ALERT!!! Just discovered the fire set last night to @wendys was NOT a #blacklivesmatter demonstrator but a outside white agitator! We want justice and change not chaos and confusion! I’m posting this because I want… https://www.instagram.com/p/CBaz-OLlsGl/?igshid=1jlgqkhkjjq1z,304
656,2020-06-14 14:30:13+00:00,64,"I'm pretty disappointed that my feed has changed from #BlackLivesMatter back to ""the norm"" ...... THAT BEING SAID, DROP ANY RESOURCE, INFO, PETITION, GOFUNDME, BLACK BIZ WHATEVER UNDER THIS TWEET ! I WILL RT IT ALL !! this fight is far from over! WE NEED TO BE FUCKIN LOUD!",54
657,2020-06-14 14:30:04+00:00,131,"The body cam video is disturbing. Rayshard was compliant before they tried to handcuff him. He resisted arrest, fought the cops & took the taser (a non-deadly weapon) but that shouldn’t be a death sentence. He should be in jail ALIVE waiting to see a judge. #BlackLivesMatter ",51
658,2020-06-14 14:26:09+00:00,86,"For a group of people who’ve supposedly committed to listening, learning and reflecting around #BlackLivesMatter there are a hell of a lot of “allies” doing a LOT of “explaining” and demanding on here. Funny that we don’t make progress towards equality.",10
659,2020-06-14 14:25:59+00:00,111,my friends in Tokyo protesting for #BlackLivesMatter DAILY is so beautiful g. Wow,4
660,2020-06-14 14:25:56+00:00,86,BLM leader here in Utah said the crowds always go away. They fight for a season and disappear. I hope our people will stay fighting with them even after things die down. I’m in this for life #BLACKLIVESMATTER ,38
661,2020-06-14 14:25:23+00:00,37,"We’ve watched African Americans get murdered by police on video many times in the past few weeks. So why are people surprised that when the police attempt to “arrest” a black man he resists like his life depends on it? Because obviously, too often it does. #BlackLivesMatter",27
662,2020-06-14 14:19:58+00:00,69,"“You had a man who was asleep, or passed out in a car, and the response was armed, and now he’s dead. He was the father of three little girls. This should not have been a death sentence.” @DrPhilGoff #RayshardBrooks #BlackLivesMatter #AtlantaShooting",40
663,2020-06-14 14:19:07+00:00,128,Solidarity from Hamburg squat @florableibt to #Minneapolis! #blacklivesmatter #migrantifa #nonazishh,38
664,2020-06-14 14:18:30+00:00,35,"No Prime Minister. Yesterday's riot was not a well-intentioned protest merely ""subverted by violence."" It was a white supremacist mob, with no legitimate aim, formed deliberately to cause violence. Offensive to imply moral equivalence with #BlackLivesMatter protests. #Johnson",16
665,2020-06-14 14:17:39+00:00,2362,This is a sight you don’t see every day. The pedaling protesters have made their way to Oakland. Rolling down Forbes now. What a cool way to spread the message of #BlackLivesMatter. @KDKA,818
666,2020-06-14 14:16:18+00:00,500,This is so cool Tokyo marched for #BlackLivesMatter today. : @PeachGirlFranki,229
667,2020-06-14 14:16:00+00:00,39,"JK3’s new #BlackLivesMatter ad is good if he actually believed any of it. A friendly reminder he opposed marijuana legalization because cops couldn’t test for it, endorsed the most conservative DA candidate Henning. #bospoli #mapoli",18
668,2020-06-14 14:15:59+00:00,58,Another great cover of The New Yorker! #BlackLivesMatter ,16
669,2020-06-14 14:15:33+00:00,37,"""If you can spend that much money on the police department … you can spend that much money on me."" -Eshawney Gaston, essential healthcare worker, Durham, NC. #ProtectAllWorkers #BlackLivesMatter ",14
670,2020-06-14 14:14:57+00:00,54,this what the media isn’t showing #BlackLivesMatter @/breenalip on tiktok she has been filming the New York protests go watch them ,39
671,2020-06-14 14:13:58+00:00,57,How the fuck are police still killing black people... like right now as a cop you have to know the whole world is watching and you STILL do the wrong thing like son what the actual fuck #BlackLivesMatter #RayshardBrooks,16
672,2020-06-14 14:12:45+00:00,27,How can this country boast about being “the land of the free and home of the brave” when my people are killed and their killers walk away freely? NO JUSTICE NO PEACE #BlackLivesMatter #TheGodfath3r,12
673,2020-06-14 14:11:54+00:00,941,"The world seems to think his life did not matter. Sadly no protests followed, because the world thinks only #BlackLivesMatter ... ",519
674,2020-06-14 14:11:40+00:00,90,#blacklivesmatter George Floyd was murdered by a policeman in cold blood but two things not talked about. He had fentanyl is his system and he was Covid positive. He had a knee on his neck but we also know the virus leads to ARDS Acute Respiratory Distress Syndrome.,54
675,2020-06-14 14:11:36+00:00,154,On 5200 block of Pine Street yesterday. #BlackLivesMatter #westphilly,36
676,2020-06-14 14:09:13+00:00,49,"“Each generation must, out of relative obscurity, discover its mission, fulfill it, or betray it."" -Franz Fanon #communitycontrol over police #BlackPower #BlackLivesMatter #justice4georgefloyd #justice4RayshardBrooks",26
677,2020-06-14 14:08:44+00:00,270,Makes sense to me #BlackLivesMatter ,53
678,2020-06-14 14:08:10+00:00,41,"#BlackLivesMatter is more than a clarion call to end the racism that results in brutal acts of violence against people of color. In this pandemic, it is also addressing why Black Americans are dying from C19 at 2X the rate of other groups. #ONEV1",34
679,2020-06-14 14:07:46+00:00,24,Just 18 days ago a black man was killed when police pinned him to the ground. Rayshard knew this. It's not surprising that he fought for his life and ran when he was pinned down like George. Say his name. #RayshardBrooks #BlackLivesMatter #ONEV1,21
680,2020-06-14 14:07:41+00:00,117,"And the decisions the people in power make have a direct impact on our democracy. When #MAGA and Black tradgegy porn spiked their ratings, it created a pathway for a mad man to walk straight down #BlackLivesMatter plaza and to burn the nation. I wrote a whole ass book about it. https://twitter.com/TiffanyDCross/status/1272167926964109312 pic.twitter.com/SwVNnySkBp",38
681,2020-06-14 14:06:17+00:00,95,"Body cam footage before the murder of #RayshardBrooks was released and .... he was extremely calm, cooperative, he was parked because he was drinking and even offered to leave his car and walk to his sister house. He did NOT deserve to die. #BlackLivesMatter",71
682,2020-06-14 14:06:16+00:00,35,"Black man would have been dead within seconds just for being black. But a white can wrestle cops, can beat both cops with their own baton, steals the police car But yet nothing happens to that white man Isn't that some crazy shi##BlackLivesMatter ",34
683,2020-06-14 14:04:13+00:00,1071,"Last weekend across Scotland #BlackLivesMatter black &amp; white, young &amp; old peacefully protested against racial violence, today in Glasgow #StatueDefenders “run about” for dead white men responsible for the murder &amp; kidnapping of millions of black people",448
684,2020-06-14 14:02:08+00:00,147,"Incredible photo: a #BlackLivesMatter protestor carries an injured far-right counter-protestor to safety in London. Amid all the ugliness, a beautiful moment of humanity. by Dylan Martinez ⁦@Reuters⁩",20
685,2020-06-14 14:00:01+00:00,205,"Protesters were seen arrested at a '#BlackLivesMatter' demonstration in #Stockholm, as people broke the #COVID19 restrictions on gatherings of more than 50 people.",131
686,2020-06-14 14:00:01+00:00,55,"“Although we recognize that our police officers are often asked to make split-second decisions, we expect them to do so with respect for the dignity and worth of black lives.” #CriminalJusticeReform #BlackLIvesMatter #OrganizeToWin",34
687,2020-06-14 14:00:00+00:00,435,"“My mother was seven months pregnant, when the police burst in, put a shotgun to her pregnant belly, and said ‘You are under arrest’” Tupac speaks on police brutality and why we must keep laying down the tracks for change in this rare interview from 1992. #BlackLivesMatter ",200
688,2020-06-14 13:58:27+00:00,559,"Three years ago, when attacks on African students were being reported across North India, I hosted A group of black students in my coffee shop & also visited the Gurudwara with them. Assured them that Punjabis & Sikhs at large stand for their safety! #BlackLivesMatter ",84
689,2020-06-14 13:58:27+00:00,134,"OHUB x ThePlug @theohubs x @tpinsights present Juneteenth 4.0 Celebration Friday, June 19th, 2020 1-4P ET It’s Freedom Time. Pull up: http://juneteenth.ohub.at/ #juneteenth #ohub #racialequity #blacklivesmatter #blacktechtwitter",60
690,2020-06-14 13:55:42+00:00,90,“Matter is the Minimum” #BlackLivesMatter #ClemsonFamily,19
691,2020-06-14 13:55:12+00:00,43,"I wrote this poem three years ago, before the Grenfell Tower in London had even stopped smouldering. Three years on, with overt racism on our streets and no sign of justice, our anger at all these wrongs smoulders still. #JusticeForGrenfell #NoJusticeNoPeace #BlackLivesMatter ",33
692,2020-06-14 13:53:42+00:00,70,"He wanted to WALK HOME. Out of his own mouth he told the cop, he didn’t want to be in violation of anybody. Now, he is DEAD, 3 daughters & 1 stepson don’t have a dad & a wife doesn’t have her husband. But people mad behind Wendy’s on fire. I’m so damn tired. #BlackLivesMatter ",85
693,2020-06-14 13:53:16+00:00,202,Some plead for their friends life. Some putting their bodies in between Jesus and those taking him in custody. That’s all resisting arrest. #blacklivesmatter,21
694,2020-06-14 13:52:53+00:00,238,"This is Rachel Ruit. She lives in Asheville, NC and works at @ExtendedStay is this this type of people you want representing your company? #BlackLivesMatter #KarensGoneWild",151
695,2020-06-14 13:51:19+00:00,781,"Just a reminder that there is no place for sexism, homophobia, transphobia, ableism, fatphobia or slut-shaming at protests or in this movement. We are here to end ALL harm against ALL Black people. Get on board or go home. #AllBlackLivesMatter #BlackLivesMatter #DefendBlackLife",172
696,2020-06-14 13:49:15+00:00,4177,Remember when we had a President and Vice President who understood that #BlackLivesMatter and brought people together? #ObamaDayUSA,1222
697,2020-06-14 13:48:17+00:00,178,Yup. He was guilty of Breathing While Black. A White person would have been asked to call a relative to take him home. The officers would not have arrested a White person. #BlackLivesMatter,16
698,2020-06-14 13:48:12+00:00,114,"Why is the @CityofMiami @MiamiPD, under the leadership of Police Chief @Jcolina67, a national model for how to handle and respect the peaceful protesters calling for justice for #GeorgeFloyd + #BlackLivesMatter? THIS. IS. WHY. ",44
699,2020-06-14 13:48:08+00:00,182,A question I have not seen asked- how much is our “Gun Culture” tied to our police culture and the often lethal use of submission at all costs etc... with racism on steroids thrown in ? #BLACK_LIVES_MATTER #BlackLivesMatter,29
700,2020-06-14 13:47:50+00:00,107,"Today’s #HymnOnSunday “Jesus Loves Me” takes me way back - it’s the 1st hymn I ever learned. In today’s America, dealing with the ongoing pandemics of #COVID19 and systemic racism, it’s comforting to know how much we’re loved. #BlackLivesMatter @MackAvenueMusic @VandorenUSA",14
701,2020-06-14 13:47:36+00:00,379,A Black Lives Matter protestor carrying an injured counter protestor to safety near Waterloo Station today. One World One Human Race #BlackLivesMatter #MyfellowSouthafricans #phume22,67
702,2020-06-14 13:47:30+00:00,127,"A week ago, Bristol was at the forefront of the global #BlackLivesMatter movement when the statue of #Colston was toppled. ""The task now is to translate this despair and rage into commitment to work together towards racial equality,"" writes @OlivetteOtele",44
703,2020-06-14 13:43:56+00:00,129,"EXCLUSIVE: Andy Cole tells @Podcast_TBG that he was disrespected throughout his playing career due to being black. “Whatever angle they wanna try talk about me as if like I wasn’t amongst those elite yeah, my numbers stack up ” Full pod out tomorrow #BlackLivesMatter #BLM",76
704,2020-06-14 13:42:05+00:00,125,"We are just HOURS away from ROSE/ICKE IV, watch as David Icke & Brian Rose expose the VACCINE AGENDA & talk about who really BENEFITS from the #BlackLivesMatter movement. Who do you think the protesting serves most? Watch here: http://freedomplatform.tv/icke #LondonRealArmy #RI4",70
705,2020-06-14 13:38:54+00:00,410,"""I have felt a positivity that the conversation is taking place on a much broader scale now, we are hearing a lot more voices."" Leyton Orient captain @jobimcanuff7 tells SSN that he has been encouraged to see more people speaking up about #BlackLivesMatter ",35
706,2020-06-14 13:38:44+00:00,163, Why doesn’t the the MSM state the facts? Truth Bomb Black live DON’T matter to #BlackLivesMatter ,198
707,2020-06-14 13:35:00+00:00,210,Southern Charm Star Craig Conover Organizes Charity Bowling Tournament To Support Black Lives Matter What do you think about Craig's event concept? Would you attend if you were in Charleston? #SouthernCharm #BlackLivesMatter ,7
708,2020-06-14 13:34:58+00:00,84,"Going to put these in thread in hopes gymnastics & Sooner fans who have missed, can find time to view these powerful testimonies from our National Championship alumni about what it means to be Black in America. #BlackLivesMatter Hope just beginning of larger, needed changed ",20
709,2020-06-14 13:34:44+00:00,77,"In the wake of the killing of #GeorgeFloyd, @Wikipedia contributors have made a crowd-sourced map of protests happening in the U.S. and beyond in support of #BlackLivesMatter and racial justice. https://w.wiki/TvC",45
710,2020-06-14 13:34:35+00:00,134,"Margaret Ogunbanwo, who had her house defaced by a swastika, is planning a community effort to create a mural on her house to replace the swastika with a symbol of unity and love. @MaajidNawaz | #BlackLivesMatter ",26
711,2020-06-14 13:33:15+00:00,58,Becoming Anti-Racist #BlackLivesMatter ,29
712,2020-06-14 13:32:45+00:00,174,Photos from the 17th day of #BlackLivesMatter protests in NYC on Saturday: https://gothamist.com/news/live-protest-updates-june-13-2020 https://gothamist.com/news/photos/photos-scenes-protests-june-13-2020-manhattan-and-brooklyn?image=2,64
713,2020-06-14 13:31:36+00:00,49,Here are the stages of becoming an Anti-Racist. This is a process and it won't always be linear so be kind and patient with yourself. Just keep doing your work. Be willing to have the difficult conversations with yourself and with others. #BlackLivesMatter ,27
