,Datetime,Favorites,Text,Retweets
936,2020-06-14 06:49:59+00:00,468,"Indeed! But every one of them supports #Brexit and most, probably all, of them will have voted Tory in 2019. People like you and your husband are wholly responsible for the rise of the far right in the UK. Own it Sarah! #TheTruthMatters #BlackLivesMatter ",157
937,2020-06-14 06:47:25+00:00,240,"It means, in short, that if the American Negro, the American black man, is going to become a free person in this country, the people of this country have to give up something. If they don't give it up, it will be taken from them. https://www.esquire.com/news-politics/a23960/james-baldwin-cool-it/ #BlackLivesMatter",73
938,2020-06-14 06:47:22+00:00,124,"But we can't move into the next year without change happening. Support the #BlackLivesMatter movement because, honestly? The virus was bad enough, but brutalizing innocent lives on the streets is NEVER a good thing. ",17
939,2020-06-14 06:46:56+00:00,45,Support #BlackLivesMatter by actively being Anti-Racist,12
940,2020-06-14 06:44:55+00:00,78,"Within 2 weeks, TWO weeks!! Two different Black Men have been found hanging from trees WITHIN AN HOUR DRIVE FROM ONE ANOTHER and BOTH have been ruled non suspicious/suicide. I AM LIVID #MalcomHarsh #RobertFuller #SayTheirNames #BlackLivesMatter",40
941,2020-06-14 06:44:31+00:00,97,"Hey @IngrahamAngle, this is why we have the #BlackLivesMatter protest during a pandemic because if no one speaks out for them, they will continue to get murdered by cops. #RayshardBrooks",23
942,2020-06-14 06:42:59+00:00,63,"It was a momentous day for equality & justice in Aotearoa NZ as we marched in solidarity, giving a unified voice to the oppressed. Thanks to everyone that came out, your energy was humbling & inspiring. Let’s keep this momentum; we’re just getting started. #BlackLivesMatter ",16
943,2020-06-14 06:42:40+00:00,105,"How is getting ""Fired"" the appropriate punishment for MURDER?!?! #BlackLivesMatter ",46
944,2020-06-14 06:41:05+00:00,81,#BlackLivesMatter | ‘What she did is polite racism’: San Francisco man says white couple called police for stenciling ‘Black Lives Matter’ on his own property. Full Story: https://abc7ne.ws/2UIjKLH @abc7newsbayarea,50
945,2020-06-14 06:39:40+00:00,83,The oppressed are constantly being asked to extend humanity to the oppressor even when that acknowledgment of humanity is not returned. Kudos to this man for being better than the one he is helping. That should not have to be the standard or requirement. #BlackLivesMatter ,18
946,2020-06-14 06:39:31+00:00,112,"#Atlanta cops #GarrettRolfe &amp; Devin Bronsan gave #RayshardBrooks no immediate aid as he lay dying—he was still alive—in a Wendy’s parking lot after being shot 3 times in the back by Rolfe. Instead, they cleaned up the murder scene: #BlackLivesMatter ",109
947,2020-06-14 06:38:48+00:00,153,Racism a crime against humanity |My Company L&M takes a stand against it! #BlackLivesMatter ,37
948,2020-06-14 06:37:07+00:00,220,This whole #BlackLivesMatter movement got kicked off when brave young people in Ferguson burned &amp; broke shit. The recent uprisings started when Minneapolis burned a precinct down. Don't listen to liberals like these who just want you to vote for Joe Biden &amp; not fight back. ,83
949,2020-06-14 06:33:22+00:00,72,"Went up to Capitol Hill to see all the crazy mayhem and anarchy for myself. It's a street fair. They were giving out homemade cornbread, decorating candles, doing amazing art. #BlackLivesMatter #TruthMatters #seattleprotests",14
950,2020-06-14 06:33:03+00:00,114,A 27 year-old unarmed black man has been shot dead by the police in Atlanta after he fell asleep in his car at Wendy's and police was called on him. His killing has sparked a second wave of #BlackLivesMatter protest &amp; the Wendy's being burned down ,84
951,2020-06-14 06:28:23+00:00,27,"Question for @lvmpd - how on earth do y'all arrest LEGAL OBSERVERS? Question for @Sheriff_LVMPD - can you get your officers under control? Finally, @GovSisolak - are you just going to let this happen in Nevada? #BlackLivesMatter ",16
952,2020-06-14 06:28:11+00:00,379,i want my kids to study THIS picture in their history gcse. wow. #BlackLivesMatter #BLMLondon #LondonRiots2020 #farright,63
953,2020-06-14 06:27:05+00:00,69,If you're comparing direct action due to racial inequality in the world to white men attacking the police and saluting like Nazis to protect a statue of a racist then you really are part of the problem. #BlackLivesMatter #Antifa,18
954,2020-06-14 06:25:02+00:00,39,"""Antines Davis teaching a group of Milwaukee protesters how to sign “#blacklivesmatter” in #ASL""—originally posted by @RoryLinnane",19
955,2020-06-14 06:23:54+00:00,137,A #blacklivesmatter protestor carrying a far-right protestor to safety in London today. This is one for the history books. ,20
956,2020-06-14 06:19:51+00:00,238,Good morning to everyone who supports #BlackLivesMatter,6
957,2020-06-14 06:18:30+00:00,92,Black Lives Matter Inc has been a profitable vehicle for political entrepreneurs & neoliberal politicians Mitt Romney & the State Department officially back #BlackLivesMatter so we know the establishment views it as controlled opposition to be tamed So yes time for Black Power ,53
958,2020-06-14 06:17:44+00:00,112,"I keep hearing the question, ""when will the race war begin?"" Are you fucking kidding me? The race war has been waged against African Americans since the first slave arrived on these shores. #BlackLivesMatter",27
959,2020-06-14 06:17:20+00:00,60,Get COMFY - Final Fantasy VII Remake starts NOW on STOP and CEASE! - http://twitch.tv/BigJon #BlackLivesMatter - We are over 21K and this is becoming just unbelievable!,26
960,2020-06-14 06:13:20+00:00,124,mm altho i used the #js smth dont sit right with me at the fact that this is TOP 23 on trending yet #BlackLivesMatter isnt anymore? ,11
961,2020-06-14 06:13:18+00:00,113,"Systemic racism & police violence are a global pandemic. This is France. The peaceful protester being brutally arrested had just prevented a crowd (mainly white) from breaking into a shop. Now, he's paying the price. #justicepourAdama #BlackLivesMatter ",113
962,2020-06-14 06:10:55+00:00,439,#BlackLivesMatter is not a white ppls book club moment.,69
963,2020-06-14 06:10:26+00:00,43,This is my gofundme I now have it all figured out. Please help me hey the word out. I’m really in need right now and much appreciate any help #BLM #BlackLivesMatter #cashapp cashapp $reptileempress Thank you for reading my post. https://www.gofundme.com/f/21dq19fqc0?utm_medium=social&amp;utm_source=twitter&amp;utm_campaign=p_na+share-sheet&amp;rcid=098d9e99e2f240c6b467d84e01573f8e @gofundme,54
964,2020-06-14 06:08:56+00:00,89,Abuse has lasting ripple effects on victims and their families. The #abuse of one person ultimately creates many victims. Stand up to abuse. #NarcissisticAbuse #domesticabuse #BlackLivesMatter #femalelivesmatter,30
965,2020-06-14 06:07:04+00:00,64,"TONIGHT at a PEACEFUL PROTEST in #Vegas, @JohnPiroNV &amp; all other LEGAL OBSERVERS were arrested by @LVMPD. A few protests ago it was journalists. So which is it @GovSisolak -- do you support legal observers or are we just going to continue to keep arresting them? #BlackLivesMatter ",42
966,2020-06-14 06:06:51+00:00,27,EVERYONE SHARE THIS!! #BLM #BLMprotest #BLMprotests #BlackLivesMatter ,29
967,2020-06-14 06:03:15+00:00,1218,"This is america, land of freedom and democracy. #BlackLivesMatter ",285
968,2020-06-14 06:02:58+00:00,154,Thousands of ppl have gathered at Yoyogi Plaza for the #blacklivesmatter Protest in #Tokyo which is starting in this minutes. Crazy turnout.,79
969,2020-06-14 06:00:38+00:00,54,"If the police didn't need to shoot and kill this white man, they certainly didn't need to shoot and kill #RayshardBrooks The police were terrified &amp; certainly in danger, yet managed to not kill him Had this been a black man, he'd be dead. We all know this. #BlackLivesMatter ",11
970,2020-06-14 05:58:41+00:00,97,#BlackLivesMatter march starting in Tokyo now. ,28
971,2020-06-14 05:58:19+00:00,4726,"This is Wellington, New Zeland right now. Love this country. #BlackLivesMatter ",1779
972,2020-06-14 05:55:59+00:00,87,today we marched with and for our BIPOC whānau in wellington. the haka before the march had me in tears. thank you to everyone who showed up. kia kaha #BlackLivesMatter ,10
973,2020-06-14 05:52:36+00:00,86,Black men hanging from trees does not sound like suicide. May they each Rest In Peace. May justice prevail. #BlackLivesMatter,9
974,2020-06-14 05:51:52+00:00,83,Link to full documentary- @BillMoyers Journal: “Rosedale: The Way It Is” #BlackLivesMatter ,48
975,2020-06-14 05:47:22+00:00,26,"'All lives matter' has never been in contention.But at this moment,can we focus on that group that was enslaved for generations,denied a legacy,die because of their skin colour,still have limited opportunities,navigate a system that isn't meant for them.Can we? #BlackLivesMatter ",13
976,2020-06-14 05:46:53+00:00,841,"I was expecting this to be on our Headlines today, Lol #LondonRiots2020 #BlackLivesMatter #farright #BLMLondon",196
977,2020-06-14 05:46:12+00:00,489,Hawaii coming together for #BlackLivesMatter ,167
978,2020-06-14 05:45:48+00:00,81,Our existence is resistance. #BlackLivesMatter ,16
979,2020-06-14 05:45:06+00:00,43,"SE 14th & Division, 10:30 PM. #portlandprotest #BlackLivesMatter ",15
980,2020-06-14 05:43:54+00:00,2584, We stood with them with #BlackLivesMatter they heard our cries and they standing with us on #StopGBV hit like for appreciation stop these foolish hashtags #PhumeMustFall the world is watching,759
981,2020-06-14 05:42:03+00:00,116,The time is now to examine the ways the #BlackLivesMatter movement and environmentalism are linked. ,26
982,2020-06-14 05:41:35+00:00,62,"We're not even a month out from George Floyd and we've had multiple police murderers of black people, most recently Rayshard Brooks and literal lynchings. Protesting isn't a week long fad black people are fighting for our lives #BlackLivesMatter",39
983,2020-06-14 05:38:53+00:00,386,"""Seeing the world through a telescope instead of a magnifying glass, many Indians, [who happily refer to] people with darker complexions as ‘Madrasi’ [when they tire of] calling them ‘Kalu’, started tweeting #BlackLivesMatter."" Bravo, @mrsfunnybones! ",33
984,2020-06-14 05:36:35+00:00,397,The Bombers and Swans unite to show support for the #BlackLivesMatter movement. ,41
985,2020-06-14 05:36:06+00:00,97,"After discussing it with My Family, while this was a very Hard Decision to make, I have Decided it is Best that I part ways with St. Charles HS Basketball Program. So Long Spartan Nation, I’m gonna miss all my Babies, It’s been Real ... #CoachZeekOut #BlackLivesMatter ",4
986,2020-06-14 05:33:08+00:00,59,If this guy was African American he would have been dead within 10 seconds. #BlackLivesMatter #AbolishThePolice,31
987,2020-06-14 05:32:26+00:00,148,It is a privilege if someone doesn’t have to make ending racism one of their life goals. The amount of time and energy spent on the burden of something so predatory is unfathomable. #BlackLivesMatter,19
988,2020-06-14 05:32:00+00:00,283,"Man, Over $20k.... i don't even know what to say right now.... #BlackLivesMatter - Just Amazing.. double my 10k goal.. with 24+ hours left... ",44
989,2020-06-14 05:30:20+00:00,86,“All Black Lives Matter” has been painted on Hollywood Blvd ahead of the solidarity march tomorrow in Los Angeles California #LA #LGBTQ #BLM #Pride #BlackLivesMatter ,28
990,2020-06-14 05:30:10+00:00,87,What is Filipino culture in the era of ##BlackLivesMatter? More here: https://www.facebook.com/FilAmArtsLA/,25
991,2020-06-14 05:28:36+00:00,82,"That’s what I thought. As this #HongKong police officer mocking #BlackLivesMatter protest, police respond casually “We’ve given instruction to that officer alrdy.” That’s it, no discipline, no validity, no justness no nothing, which exactly like @hkpoliceforce. Pic @rthk_news https://twitter.com/nikki_miumiu/status/1271494107458748416",62
992,2020-06-14 05:28:34+00:00,47,"What the hell. Amidst all these great protests, the senseless fatal shootings are STILL HAPPENING. Police departments cannot be reformed. Defund, divest, abolish! #BlackLivesMatter ",24
993,2020-06-14 05:25:25+00:00,506,"Even in Tokyo, Isabelle knows what the fuck is up!!! #ACNH #BlackLivesMatter pic.twitter.com/oJQG73Ug5f",146
994,2020-06-14 05:24:46+00:00,314,Everyone except these dudes was committed to ending racist police violence today at the #BlackLivesMatter rally in Auckland. ,25
995,2020-06-14 05:24:43+00:00,135,They are focusing on the fact that I am not wearing an Aggie ring as a senior but Let’s focus on the fact that I AM A 19 year old SENIORR! Many people will be trying to discredit Diana and I but their attempts will be Futile. #ByeByeSullyRoss #BlackLivesMatter ,15
996,2020-06-14 05:20:29+00:00,244,"“A riot, is the language of the unheard.” Martin Luther King, Jr. #BlackLivesMatter",41
997,2020-06-14 05:18:20+00:00,1045,"#BlackLivesMatter today, and tomorrow, and the day after that. We are human and we count.",177
998,2020-06-14 05:17:03+00:00,986,"Bernie Sanders has received over $183,000,000 from @actblue. That's where the money goes when you donate to #BlackLivesMatter."" ",619
999,2020-06-14 05:16:11+00:00,1358,Sometimes things can be as simple as Black and white. Show this to anyone who dares claim the cops had to kill #RayshardBrooks. They didn’t. Just watch this. Jaw dropping. #BlackLivesMatter ,848
1000,2020-06-14 05:16:03+00:00,49,“Most Indians are not worked up about #BlackLivesMatter because they cannot get worked up about #DalitLivesMatter” https://timesofindia.indiatimes.com/blogs/Swaminomics/dalitlivesmatter-why-we-dont-care-about-this-hashtag/,16
1001,2020-06-14 05:14:46+00:00,234,"If #BlackLivesMatter was an organization that actually helps blacks, they would donate to help re-build these black businesses",52
1002,2020-06-14 05:11:56+00:00,886,"I'm tweeting live from Tokyo today, where the #Blacklivesmatter March is taking place. Unfortunately, in Shibuya fascist groups also organized a rally. Of course with Trump-flags. Japanese anti-fascists are protesting them very loudly right now. #0614渋谷カウンター",574
1003,2020-06-14 05:11:07+00:00,3722,How many corporations are going to try to capitalize on the #BlackLivesMatter message?,237
1004,2020-06-14 05:10:38+00:00,540,Paris: Up to 20k people participate in #BLM protest today. #BlackLivesMatter #AtlantaShooting #ParisProtest #KarensGoneWild #AtlantaRiot #blmseattle #blmatlanta #TrumpIsNotWell #DefundPolice,156
1005,2020-06-14 05:10:18+00:00,1169,"Part two of Ngā Hine Pūkōrero's performance at #BlackLivesMatter in Auckland today. Cannot overstate how powerful and affecting this piece about colonial brutality was, delivered to a crowd of several thousand in Aotea Square. Aotearoa, we got a ways to go. 2/2 ",409
1006,2020-06-14 05:10:17+00:00,2503,This is Ngā Hine Pūkōrero who performed at the #BlackLivesMatter rally in Auckland today. I am shook. #blacklivesmatternz 1/2,974
1007,2020-06-14 05:09:46+00:00,233,#BlackLivesMatter protest in Paris. You can always rely on the French when it comes to doing a protest properly! ,66
1008,2020-06-14 05:09:21+00:00,87,https://www.gofundme.com/f/23cdd3-going-back-to-my-roots?utm_source=customer&amp;utm_campaign=p_cp+share-sheet&amp;utm_medium=copy_link-tip Please share and donate if you can!!! Help her dream come true!! #BlackLivesMatter #Gofundme,114
1009,2020-06-14 05:07:27+00:00,109,"As we continue to protest, the police have killed another black man #Rayshardbrooks -Stop killing black people -Defund the police We want justice &amp; if we don’t get it...shut it down #BlackLivesMatter",38
1010,2020-06-14 05:05:31+00:00,75,Peter Norman is the ally we should all aspire to be. Supported #BlackLivesMatter knowing probable backlash and didn't make it about him. Sadly too many Australians know nothing about this man. THIS is the sort of history white Australians should look up to. #BeMorePeterNorman,24
1011,2020-06-14 05:04:32+00:00,4196,Another angle of when the American flag was stolen from a woman by a masked female inside the Seattle “autonomous zone.” #antifa #BlackLivesMatter ,2081
1012,2020-06-14 05:04:14+00:00,66,ATLANTA: Know your rights and resources while protesting! Read this thread for tools to use to keep you safe! #BlackLivesMatter #AtlantaProtest #AtlantaShooting,44
1013,2020-06-14 05:02:29+00:00,122,Fucking good. Now arrest and convict Garrett Rolfe for murdering Rayshard Brooks. #BlackLivesMatter #RayshardBrooks,44
1014,2020-06-14 05:00:54+00:00,372,"For anyone questioning an ENTIRE ASS movement because some FOOLISH PAWN went online to discredit #BlackLivesMatter, here are the facts: https://apnews.com/afs:Content:9043930562 https://www.mediamatters.org/fake-news/debunked-conspiracy-theory-about-black-lives-matter-actblue-and-democrats-can-be-traced https://www.factcheck.org/2020/06/donations-to-black-lives-matter-group-dont-go-to-dnc/ https://www.politifact.com/factchecks/2020/jun/12/ryan-fournier/conservative-pundits-share-false-claim-about-black/ https://factcheck.thedispatch.com/p/is-black-lives-matter-a-shell-company pic.twitter.com/Ohxn1CGaqo",207
1015,2020-06-14 04:57:53+00:00,104,I am putting together my own Black Lives Matter Protest. We will be meeting at abortion clinics. #BLM #BlackLivesMatter,45
1016,2020-06-14 04:56:28+00:00,342,Have you ever seen White privilege with the police? THIS is it! This is why people all over the world are fed up &amp; protesting the killings of African-Americans by cops! #BlackLivesMatter #RayshardBrooks #AtlantaProtest #JusticeForRayshardBrooks,214
1017,2020-06-14 04:54:34+00:00,1428,"i'm speechless, i can't even process this at all. We raised $12,384.69 (after paypal fees) from our 12 hour #blacklivesmatter stream. I cried so very hard, thank you so much to everyone who took part and to everyone who donated and watched the stream, this changed my life pic.twitter.com/015w5iozpU",245
1018,2020-06-14 04:54:19+00:00,223,"I went to the gun range yesterday, and shot an AR-15, 12-Gauge shotgun, and a 22. We Patriots are preparing to protect ourselves and our nation. #Antifa, #BlackLivesMatter, and thugs had better understand that we mean business.",47
1019,2020-06-14 04:51:38+00:00,67,5 facts/5 tags: 1. #BreonnaTaylor's murderers should b in jail. 2. #RayshardBrooks didnt deserve 2 b killed. 3. #RobertFuller and #malcomharsch were lynched. 4. #StephonClark did not have a gun 5. #BlackLivesMatter @petro21805 @Bearded_Misfit @megalorain @Hi_ItsMeMel,25
1020,2020-06-14 04:50:23+00:00,1301,"I want to point out AGAIN that just 9 days ago, @RandPaul opposed an anti-lynching bill on the Senate Floor. The SAME bill unanimously passed initially. The House named it after Emmett Till and sent back. NOW Rand says the language is too broad. #BlackLivesMatter ",582
1021,2020-06-14 04:48:21+00:00,44,"For the lynching of Robert Fuller in Palmdale, CA #blacklivesmatter ",29
1022,2020-06-14 04:48:05+00:00,145,"Two Black men, #RobertFuller and #MalcolmHarsch, were found dead, hanging from trees, apparently lynched, in two different towns in California? Why is no one talking about this?? #BlackLivesMatter",116
1023,2020-06-14 04:47:22+00:00,514,Such idiocy! #BlackLivesMatter is a joke of a group. They divide the people and destroy cities and never take any blame or ownership for anything.,54
1024,2020-06-14 04:46:55+00:00,284,"1. The latest in pro-#China tankies’ smear campaign is to spread disinformation about Hong Kongers supposedly “bullying” the organizers of a #BlackLivesMatter rally into canceling it. This can’t be further from the truth, as @hillary_leung’s great reporting for @CoconutsHK shows.",161
1025,2020-06-14 04:45:38+00:00,155,Brazilian protester accidentally knocks a policeman's cap off and he tries to blow his head off #blm #BlackLivesMatter #AtlantaProtest #AtlantaPolice #AtlantaRiot #AtlantaShooting #GeorgeFloyd,118
1026,2020-06-14 04:45:23+00:00,67,"So true. Racism, tyranny, oppression and injustice should always and everywhere be opposed and to do otherwise is hypocritical. #BlackLivesMatter #Chinanazi",35
1027,2020-06-14 04:44:13+00:00,30,The view of #tāmakimaurau's #BLM #blacklivesmatter march from the top of the soundsystem truck parked outside the US Consulate. #auckland,16
1028,2020-06-14 04:44:06+00:00,351,"I encourage anyone with Amazon Prime to watch the James Baldwin documentary ""I Am Not Your Negro."" It should be a historical documentary, but it is a very topic documentary. And that is what makes it both engrossing and disturbing. #BlackLivesMatter ",69
1029,2020-06-14 04:42:10+00:00,235,"There are videos of people who are white with knives, machetes and physically fighting cops and the cops still don’t shoot them in the back. #RayshardBrooks #BlackLivesMatter",20
1030,2020-06-14 04:41:37+00:00,41,Do yol think we can get this video to 1K RT Let’s please try #dontleavemechallenge #BlackLivesMatter ,39
1031,2020-06-14 04:40:52+00:00,287,"Holy crap, it’s past midnight! It’s the perfect time to arrest Breonna Taylor’s murderers. #BlackLivesMatter ",88
1032,2020-06-14 04:39:48+00:00,150,"UPDATE: Protestors chanting, “Arrest the cops!” near the Wendy’s where Rayshard Brooks was murdered. #AtlantaShooting This has to be done. #BlackLivesMatter #JusticeForRayshardBrooks",61
1033,2020-06-14 04:39:32+00:00,33,"Las Vegas SWAT fired rubber bullets into protestors, including families/children. Arrested journalists/legal observers. Article 77(1)- Geneva Convention:#BlackLivesMatter #GeorgeFloydprotest #protest #lasvegasprotests",23
1034,2020-06-14 04:36:47+00:00,24,"Our right wing press laughably now asking “where did it all go wrong”. Well, Tories moved thier politics to the far-right to occupy UKIP's anti-EU, anti-immigration stance, it won them #GE2019 Our government hosts the racist in chief. He calls it ""Eugenics""! #BlackLivesMatter ",20
1035,2020-06-14 04:34:56+00:00,255, Here’s what the mob thinks of your #BlackLivesMatter pledge! ,35
1036,2020-06-14 04:33:36+00:00,48,"Chief Rick Bessinger, HOW DO YOU PLAN TO HANDLE THIS?? THE COMMUNITY WANTS & DESERVES TO KNOW!!! @PalmdaleSheriff @donlemon. This has HATE CRIME written all over it. WE WILL NOT BE SILENCED BY HATRED, COVERUPS, OR STRUCTURAL LACK OF ACCOUNTABILITY. #Victorville #BlackLivesMatter ",28
1037,2020-06-14 04:33:16+00:00,62,I know most of you won’t read this because it’s too long for you. But I felt like should share my experiences just to shed light and spread awareness about the issues going on in today’s society even in places that you wouldn’t expect. #BlackLivesMatter ,9
1038,2020-06-14 04:30:46+00:00,78,I love how they used the audio of a South African protest iToyitoyi yasemzantsi iyashunqa baba #BlackLivesMatter #BlackLivesMatterSA,29
1039,2020-06-14 04:30:03+00:00,4194,Let’s talk racism? Image from the Great Bengal Famine. Millions died due to the policies of #Churchill diverting food to the British Military. ‘They breed like Rabbits anyway.. ‘was Churchill’s retorts. More than #BlackLivesMatter ,1285
1040,2020-06-14 04:29:41+00:00,290,"#BlackLivesMatter ——————————————— “Every natural resources that are found in every country in the world are from Africa ! Africa DOESN’T need to be saved , Africa is DOING the saving !” - @Akon ——— Video by @AJEnglish",45
1041,2020-06-14 04:26:48+00:00,76,"#BlackLivesMatter Rioters: if you are thinking about hurting someone or otherwise putting innocent lives at risk tonight I invite you to watch this cozy sea turtle and then go home to your family, hug them, and sleep peacefully w/o a guilty conscience ",14
1042,2020-06-14 04:26:44+00:00,127,#BREAKING: Huge fire now in #Atlanta after the killing of Rayshard Brooks! #BlackLivesMatter #blacklifematters #londonprotests #RayshardBrooks #BLACK_LIVES_MATTER #BLM #AtlantaShooting #AtlantaRiot #AtlantaProtest #AtlantaProtests #USAonFire pic.twitter.com/fYH63ol3Lg,52
1043,2020-06-14 04:24:34+00:00,1259,When karen meets keisha got dammit!!! We need more KEISHA!!!! #blacklivesmatter ,291
1044,2020-06-14 04:23:42+00:00,108,if act twt has enough time to make bullshit drama then you all have enough to sign these petitions #BlackLivesMatter #signthepetition,90
1045,2020-06-14 04:23:19+00:00,1797,Invoke the 25th Amendment. It's time. Do it. #AtlantaProtest #AtlantaRiot #TrumpIsNotWell #TRUMPstroke #BlackLivesMatter #AtlantaShooting #AtlantaPolice #CHOP #RampGate #VA05 #TrumpWearsAdultDiapers University Ave Walter Reed Newt Momentum Parkinson Edgewood Ramps Steep,635
1046,2020-06-14 04:22:57+00:00,2014,“Destruction is necessary. F— peace.” Flyer given out at the Seattle “autonomous zone” encourages violent behavior. #antifa #BlackLivesMatter ,1477
1047,2020-06-14 04:22:31+00:00,376,"Two women defaced Captain Cook's statue in Hyde Park yesterday. What would happen to someone who spray painted Uluru? We went to see the entire book and the kitchen sink thrown at these two, @ScottMorrisonMP &amp; @GladysB. #auspol #blacklivesmatter-are-#antifa #bastards #breaking",90
1048,2020-06-14 04:22:20+00:00,287,"Why is it that Jerry can resist arrest, show his ass, assault the cops with their own club, steal their car, and still not get shot & killed? What is so special about Jerry? #BlackLivesMatter #RayshardBrooks #AtlantaShooting Via @shaunking pic.twitter.com/8I0B6cdWbC",274
1049,2020-06-14 04:20:29+00:00,106,"#BorisJohnson hasn't condemned #Blacklivesmatter violent protest, mob lynching of whites, lootings &amp; attacking police department. But condemned yesterday's right-wing protest against BLM rioters. BORIS YOU DON'T DESERVE TO BE BRITISH PM.",18
