,Datetime,Favorites,Text,Retweets
242,2020-06-14 20:23:05+00:00,1829,"Reminder that the Stonewall riots were -- um -- not long ago. 1969. Our entire modern movement is younger than Molly Ringwald. #BlackLivesMatter, #BlackTransLivesMatter, Happy Pride, LA.",217
243,2020-06-14 20:22:32+00:00,223,"3y ago I was on duty in A&E, treating survivors of the #GrenfellTowerFire. I’ll never forget it Structural racism was a factor why 72 perished, &amp; why f*ck all has changed Structural racism is a key factor why so many #BAME people dying of #COVID19 This is why #BlackLivesMatter",74
244,2020-06-14 20:22:31+00:00,89,"This white woman would like all the uncomfortable white people, to shut up, Listen, learn, read. This is not about YOU or your feelings. It's about Black Lives. And until we get justice? There will be no peace. I promise you that. Rest in power, George. #BlackLivesMatter ",43
245,2020-06-14 20:22:18+00:00,853,"#UPDATE: Lisa Alexander, the woman who called police on a San Francisco man stenciling #BlackLivesMatter on his property has issued an apology. ""I should have minded my own business,"" she said. Full story: https://abc7ne.ws/37uF3pe",334
246,2020-06-14 20:19:49+00:00,107,"Do at least one thing a day to help put a end systematic racism & police brutality.. Whether it’s donating, signing petitions, protesting, or just simply educating yourself more. We must understand it is not a sprint, it is a marathon #BlackLivesMatter",21
247,2020-06-14 20:19:46+00:00,1800,Supporting the LGBTQ+ community is very important to me and we need to show support in any way we can. On my Instagram highlights I’ve added some organisations that support the LGBTQ+ community. We can make a difference! #blacktranslivesmatter #blacklivesmatter ,245
248,2020-06-14 20:19:30+00:00,462,Endless stream of protesters. Not a cop in sight #westhollywood #hollywood #losangelesprotests #weho #BlackLivesMatter ,131
249,2020-06-14 20:19:20+00:00,180,"A #BlackLivesMatter protest is underway in Lebanon, Oregon. ",48
250,2020-06-14 20:18:31+00:00,255,Marcelo takes a knee after his goal for #RealMadrid today... #BlackLivesMatter #BLM,28
251,2020-06-14 20:18:12+00:00,112,"As I marched through Elmwood yesterday for #BlackLivesMatter, I couldn't help but think about how Elmwood was first zoned single-family for the express purpose of keeping out a ""negro dance hall,"" and how to this day, exclusionary zoning continues in Elmwood and North Berkeley.",18
252,2020-06-14 20:17:29+00:00,242,"#GayPride #BlackLivesMatter #TransLivesMatter #COVID19 *Fight the fight. Your voice is needed. *STAY SAFE. *VOTE in Nov to make the CHANGE you want. *CHANGE doesnt stop bc it was ""trending"". It's an EVERYDAY fight for those fighting for EQUALITY. *Be kind &amp; one another",52
253,2020-06-14 20:14:10+00:00,106,We're stronger together #BlackLivesMatter ,18
254,2020-06-14 20:13:54+00:00,335,Don’t just talk about it be about it! Catch me at the Pride March today in Hollywood as well! #blacklivesmatter #blm,45
255,2020-06-14 20:13:18+00:00,2497,Marching for justice. Marching for change. #BlackLivesMatter ,302
256,2020-06-14 20:13:09+00:00,17201,What kind of birthday card do you send to #BunkerTrump? This one. #BlackLivesMatter ,2200
257,2020-06-14 20:13:04+00:00,140,#Photo of the autistic martyr Iyad Al-Hallaq painted on the apartheid wall in Bethlehem. #PalestinianLivesMatter #BlackLivesMatter #NoToAnnexWestBank,86
258,2020-06-14 20:11:11+00:00,86,"An early look at next week’s cover, ""Say Their Names,"" by @KadirNelson: http://nyer.cm/aDxGTud #BlackLivesMatter ",33
259,2020-06-14 20:07:49+00:00,151,Sunday love $DGB #DGB #Digibyte family #BlackLivesMatter #Equality #LoveIsLove @coinkit_ give 10 10 $dgb,266
260,2020-06-14 20:06:28+00:00,42,What we really want to know is how much money is the #DNC getting from #BlackLivesMatter . @POTUS @realDonaldTrump @GOPChairwoman @GOPLeader @RepMattGaetz @MarshaBlackburn @marklevinshow @rentonMagaUK @SenateGOP @Jim_Jordan @DonaldJTrumpJr @EricTrump @mitchellvii @RyanAFournier,57
261,2020-06-14 20:06:27+00:00,6742,“...and a little child shall lead them.” #BlackLivesMatter ,1417
262,2020-06-14 20:05:00+00:00,559,#BlackLivesMatter | Lisa Alexander says she wants to apologize directly to Mr. Juanillo: “The last 48 hours have taught me that my actions were those of someone who is not aware of the damage caused by being ignorant” Story: http://abc7ne.ws/2UIjKLH @abc7newsbayarea,205
263,2020-06-14 20:04:45+00:00,59,"It’s not a moment, it’s a movement. @21charmin and Cal WBB alumnae @ESOTERICTalia, and @nograyareas21 continuing to represent at an All #BlackLivesMatter protest in Hollywood. ",12
264,2020-06-14 20:04:38+00:00,72,"If you go to Central London, remember to take your rubbish home with you. #KeepBritainTidy #BlackLivesMatter ",14
265,2020-06-14 20:02:42+00:00,1118,The time is now. #BlackLivesMatter ,104
266,2020-06-14 20:02:40+00:00,423,Here’s another Sunday poem for you - A Litany for Survival by the late great #audrelorde #BlackLivesMatter @lemnsissay @juliehes @BernardineEvari @Minniehart26 @mattkaymk @MajorJacksons @valmcdermid @PoetrySociety @whjm @DeanAtta @IMcMillan @Makar2Makar,189
267,2020-06-14 20:02:24+00:00,160,"Nobody gets to pretend that calling the cops on a black person doesn't risk that black person's life. After everything that's happened, you no longer get to pretend like you don't know that. #BlackLivesMatter",69
268,2020-06-14 20:02:19+00:00,91,Imagine being a wean of one of these folk. What did you do during lockdown and #BlackLivesMatter Da? I got pished and ran about George Square like an arsehole my daughter/son. Stood up for ma right to be a prick. ,17
269,2020-06-14 20:02:02+00:00,147,Rodney King protests— #GeorgeFloyd murder—we’re at 20 days Do NOT let this be lost in the news chaos cycle—Do NOT let this become normalized #BlackLivesMatter ,89
270,2020-06-14 20:01:25+00:00,69,#BlackLivesMatter peaceful protest outside Dallas City Hall ,16
271,2020-06-14 20:00:55+00:00,79,We can all use our voice to fight for change @naomiosaka #BlackLivesMatter #MoreThanAnAthlete,16
272,2020-06-14 19:58:22+00:00,80,#voguechallange x #BlackLivesMatter family edition ,19
273,2020-06-14 19:57:15+00:00,183,"This; one of my favourite podcasts #Fortunately. This week ⁦@janegarvey1⁩ and ⁦@fifiglover⁩ have ⁦@afuahirsch⁩ as their guest. If you listen to one thing this week, make it this #BlackLivesMatter ",18
274,2020-06-14 19:55:44+00:00,267,"Fuck #BlackLivesMatter ! And fuck anyone, who supports it!",64
275,2020-06-14 19:55:25+00:00,81,I love my city so much #blacklivesmatter ,12
276,2020-06-14 19:55:08+00:00,110,Use your voice on behalf of those who have been silenced by racial injustice! @gudneighbors902 #BlackLivesMatter ,60
277,2020-06-14 19:52:42+00:00,91,"Anyone see the difference? #BlackLivesMatter Man arrested after shooting at deputies outside Spalding Country Georgia home, cops say https://www.ajc.com/news/crime--law/man-arrested-after-shooting-deputies-outside-spalding-county-home-cops-say/9ntT3ybM6SvGYyxnXIEF8J/",84
278,2020-06-14 19:52:38+00:00,87,"In their statement, workers say corporate informed management on June 12th the Trader Joe's store in Capitol Hill would be closed indefinitely after a large number of employees said they would be participating in the #BlackLivesMatter protests that day.",18
279,2020-06-14 19:52:09+00:00,9576,don’t stop the conversation keep talking keep amplifying keep listening keep learning #BlackLivesMatter,2885
280,2020-06-14 19:51:29+00:00,216,Thousands and thousands in Brooklyn. #BlackTransLivesMatter #BlackLivesMatter ,29
281,2020-06-14 19:51:14+00:00,201,iamhalsey: ig story #BlackLivesMatter ,24
282,2020-06-14 19:51:01+00:00,104,Its time for everyone in LA to speak up. #BlackLivesMatter ,16
283,2020-06-14 19:50:15+00:00,38," #USA nurses and other health workers, along with other attendees, demonstrated outside the Bakar Cancer Hospital at the University of #California, #SanFrancisco on Saturday, laying down in silence against systemic racism. #Anonymous #BlackLivesMatter ",34
284,2020-06-14 19:49:35+00:00,40,"""They keep trying to divde us. Black brown. Only thing that divides us is the colonizers language!- Our ancestors built the industrial revolution. Their free labor built capitalism! I think it is time for us to demand reparations!"" #puertoricandayparade #BlackLivesMatter #NYC",23
285,2020-06-14 19:47:57+00:00,599,pride #blacklivesmatter protest underway in hollywood. ,145
286,2020-06-14 19:46:49+00:00,91,It meant the world to walk with the Tigers as we showed our support for unity and that we are against racism and social injustice. #GoTigersGo #BlackLivesMatter ,15
287,2020-06-14 19:46:36+00:00,344,It’s on ALL of us! Team Above Self! #MakeThatChange #BlackLivesMatter #Vote,33
288,2020-06-14 19:45:06+00:00,292,"Stay tuned America...more corporate, judicial, and #police corruption is about to be exposed to the world. Resign now, @SWFLCourts Judge Archie B. Hayward Jr. @nytimes @washingtonpost @ap @flcourts #BlackLivesMatter #BlackLivesMatterATL #BlackLivesMatternyc #PoliceReformNow",168
289,2020-06-14 19:44:51+00:00,95,"So, wdid you know that donations to #BlackLivesMatter are channeled to #ActBlue a fund raising organization for Democratic candidates? No monies are going directly to programs targeted to improve Black Lives. #FollowTheMoney",155
290,2020-06-14 19:43:24+00:00,39,LPL has been hard at work to support activists in Chicago. Our latest newsletter details some of our work supporting #BlackLivesMatter. You can read it here: https://mailchi.mp/cb12991235c0/hope-is-a-discipline,25
291,2020-06-14 19:42:56+00:00,110,Robert Fuller GoFundMe (READ HIS STORY): https://www.gofundme.com/f/community-support-for-robert-fuller?utm_source=customer&amp;utm_campaign=p_cp+share-sheet&amp;utm_medium=copy_link-tip Petitions that still need signing: https://signatures.carrd.co #BlackLivesMatter Master Doc / Ally Resources: https://docs.google.com/document/d/e/2PACX-1vSrT26HMWX-_hlLfiyy9s95erjkOZVJdroXYkU-miaHRk58duAnJIUWKxImRkTITsYhwaFkghS8sfIF/pub,50
292,2020-06-14 19:40:21+00:00,85,I joined #blacklivesmatter protestors in Sunnyside. The 14th district is one of the most diverse communities in the country and we will not stand for police brutality. Injustice cannot be tolerated. #badrunkhanforcongress,23
293,2020-06-14 19:39:54+00:00,121,This is exactly right - and why systematic reform must come from this painful moment. #BlackLivesMatter ,35
294,2020-06-14 19:39:41+00:00,54,Look at these #BlackLivesMatter counter protestors. I don’t even have to write a joke here. ,11
295,2020-06-14 19:37:57+00:00,82,the movement never stops. ALL black lives matter. #LGBTQIA #BlackLivesMatter ,18
296,2020-06-14 19:37:51+00:00,66,"Parkville, MO and the Northland are coming together in the name of equality and unity. Today we march because #BlackLivesMatter ",7
297,2020-06-14 19:37:45+00:00,190,Thousands of people marching down Hollywood Boulevard for the All Black Lives Matter march amplifying Black LGBTQ voices. #BlackLivesMatter ,69
298,2020-06-14 19:37:17+00:00,48,#BlackLivesMatter protests are still happening around the country and world — this is not a flash-in-the-pan moment. It's a movement. ,4
299,2020-06-14 19:36:46+00:00,121,"No justice, no peace. Say their names. Take a knee. Make a change. Vote those who don’t invite change out. #GeorgeFloyd #BlackLivesMatter ",65
300,2020-06-14 19:33:08+00:00,373,"It’s not black versus white, it is everyone versus the racists - Patrick Hutchinson #PatrickHutchinson #BlackLivesMatter ",101
301,2020-06-14 19:32:30+00:00,57,"""Look around you! This is Fred Hampton's dream!"" - @DGalaSanta ""We know who we are! ¡Viva la Revolución! - @ImmortalTechNYC #puertoricandayparade #BlackLivesMatter #NYC",23
302,2020-06-14 19:32:00+00:00,103,"The establishment will try to slowly suffocate the movement with long duration studies and commissions, powerless task forces, and minor, incremental reforms that will create little true change. Keep fighting for major systemic change! #NoJusticeNoPeace #BlackLivesMatter ",42
303,2020-06-14 19:31:48+00:00,234,Old song. Same issues. Be safe in the Revolution #BlackLivesMatter #AllBirthdaysMatter #HandsUpDontShoot,100
304,2020-06-14 19:31:02+00:00,123,"""As nurses we are allies for all patients, but attention must be paid to those that are suffering the most at this time. '#ICantBreathe warrants immediate intervention!"" CPMC Van Ness nurses in San Francisco, CA march to City Hall by the hundreds to say: #BlackLivesMatter. ",53
305,2020-06-14 19:30:06+00:00,1285,Who said the protests were dying down? #westhollywood #losangelesprotests #Hollywood #BlackLivesMatter ,487
306,2020-06-14 19:29:49+00:00,351,.@Beyonce has written a letter to Attorney General Cameron demanding justice for #BreonnaTaylor. She reminds him that it’s been three months with no arrests and seeks a commitment to a transparent investigation. #BlackLivesMatter “Demonstrate the value of a Black woman’s life.” ,116
307,2020-06-14 19:28:26+00:00,186,"re•sil•ient: the power or ability to return to the original form, position, etc. after being bent, compressed, or stretched. #BlackLivesMatter |#MatteristheMinimum | @CLTgov",41
308,2020-06-14 19:27:52+00:00,1180,"Shukri Ali Said was murdered by Atlanta police in 2018, after getting shot five times when her family called the police for help when she was having a mental episode. When we talk about defund police + put more into community outreach, this is why. #SayHerName #BlackLivesMatter ",881
309,2020-06-14 19:27:42+00:00,434,"When will the white racists/liberals, wake up and realise that They should be fighting with us? This is all of our fight? And if they thought for themselves, Learnt Real history - Not written by white men history - They would. #BlackLivesMatter #NoJusticeNoPeace ",175
310,2020-06-14 19:27:38+00:00,252,"LA is turning it out today, too. #BlackLivesMatter https://ktla.com/news/local-news/all-black-lives-matter-protest-set-to-begin-in-hollywood-sunday-morning/",95
311,2020-06-14 19:25:32+00:00,131,"Just because the media is keeping quiet doesn't mean the protesters are. Keep spreading the good word, #BlackLivesMatter ",30
312,2020-06-14 19:25:29+00:00,1625,Hollywood & Highland. Outside the theater where the Oscars are held. #BlackLivesMatter ,506
313,2020-06-14 19:25:16+00:00,109,"This is Ms.Kathryn. I saw her standing on her walkway with her fist raised high, tears streaming down her face. She says she knows she couldn’t march but wanted to show her solidarity, with her town and with #BlackLivesMatter Listen to watch she had to say. ",27
314,2020-06-14 19:24:57+00:00,77,Hollywood Blvd. #BlackLivesMatter #TransLivesMatters #LAPride,27
315,2020-06-14 19:24:45+00:00,436,Say his name: ROBERT FULLER ! #RobertFuller #BlackLivesMatter ,195
316,2020-06-14 19:23:00+00:00,157,"Brooklyn, NY George Floyd’s death a medical issue? Breonna Taylor didn’t get injured per the police report? Ahmaud Arbery was a “citizens arrest” gone wrong? Tell that to the THOUSANDS of people who showed up today #BlackLivesMatter #ObamaDay #GoJoe2020",101
317,2020-06-14 19:22:43+00:00,265,my graduation cap just wanted to tell you #BLACKLIVESMATTER and never forget that!! ,27
318,2020-06-14 19:20:00+00:00,577,#BlackLivesMatter demonstrators gathered in London and Leeds for peaceful protests ,184
319,2020-06-14 19:17:30+00:00,533,Hollywood protest going awf THOUSANDS heading toward Weho #BlackLivesMatter #westhollywood #losangelesprotests,163
320,2020-06-14 19:15:22+00:00,285,"Let’s return to being a respected leader in the world. We truly are in a battle for our soul as Americans. Stand up and VOTE, America needs you! Vote @JoeBiden for President. #ONEV1 #BlackLivesMatter #GOTV2020 #VoteBiden2020 #HonorObamaDay",178
321,2020-06-14 19:14:18+00:00,49,"I haven’t seen #BlackLivesMatter in a while... are we still signing petitions and giving donations? If so, there’s a few in the comments to donate/sign!And while I’m at it, let me take the time out to say #BlackTransLivesMatter too ! I love all of my black people no matter what",38
322,2020-06-14 19:14:08+00:00,374,Just out here living our religion #BlackLivesMatter #PrideMonth,24
323,2020-06-14 19:13:44+00:00,903,Marcelo becomes the first LaLiga player to take the knee #BlackLivesMatter #beINLiga #RealMadridEibar,195
324,2020-06-14 19:11:32+00:00,127,"I saw this in Woodbine, MD (deep in Trump country) #BlackLivesMatter Liberty &amp; Justice for ALL ",48
325,2020-06-14 19:11:20+00:00,51,Right now on Vanderbilt and Atlantic Ave — huge #BlackLivesMatter #TransLivesMatter protest,27
326,2020-06-14 19:10:20+00:00,496,I will be going to my first protest march today in honor of #BlackLivesMatter. It is a drag march so I’m throwing on a wig and bringing my support,10
327,2020-06-14 19:10:03+00:00,74,"Somebody sent us a pic of a #BlackLivesMatter counterprotest happening now in Ashland City, about half an hour north of Nashville. FYI. ",64
328,2020-06-14 19:10:00+00:00,329,It’s enough. #BlackLivesMatter ,36
329,2020-06-14 19:09:55+00:00,4587,New Yorkers turn up at @brooklynmuseum to stand up for #BlackTransLives! #BlackTransLivesMatter #BlackLivesMatter ,1474
330,2020-06-14 19:09:11+00:00,849,"#LGBT + #BlackLivesMatter = #AllBlackLivesMatter at #LAPride, flooding Hollywood Blvd in the many, many thousands right now.",344
331,2020-06-14 19:07:47+00:00,56,#BlackLivesMatter solidarity with the Palestinian Struggle! Much love and respect! Free Palestine! ,33
332,2020-06-14 19:03:54+00:00,139,Nearing the Apollo in Harlem #NYC #puertoricandayparade #BlackLivesMatter ,67
333,2020-06-14 19:03:29+00:00,631,Anyone know Wanda's number? I need a favor... #BlackLivesMatter ,198
334,2020-06-14 19:03:20+00:00,491,"Yes #BlackLivesMatter BUT not anymore or less than Latino, Asian, White, or any other group in the . We should never forget ALL Lives are precious &amp; should be protected. This is especially true of Unborn Lives who are under constant siege. I follow back all Patriots",341
335,2020-06-14 19:02:04+00:00,271,#BlackLivesMatter #DefundThePolice #KarensGoneWild These power driven cops claim to be scared for their lives because an employee is wearing a black lives matter facemask.ive never seen karen cops before ,103
336,2020-06-14 18:59:51+00:00,249,The man who saved a protestor at yesterday’s far right demo tells me if the cops watching their colleague kneel on George Floyd’s neck had intervened like he and his friends had - Floyd might still be alive. Our report for @Channel4News https://www.channel4.com/news/man-who-saved-protestor-at-london-rally-speaks-as-police-reveal-100-were-arrested #blacklivesmatter,73
337,2020-06-14 18:58:39+00:00,106,"I attended a #blacklivesmatter protest, after working a safe situation out with the immunocompromised person I live with. ⁣ ⁣ After the protest, I got tested for #COVID19 (still waiting on result). I don’t have symptoms, but doctors recommend everyone who protests gets tested.",17
338,2020-06-14 18:57:59+00:00,449,Check out my recent conversation with @tariqnasheed breaking down and deconstructing global racism. This was filmed 3 days before the death of #GeorgeFloyd #BlackLivesmatter #BlackLivesMatterUK Full interview here: https://www.facebook.com/102636314643635/videos/193493385257359/,178
339,2020-06-14 18:57:22+00:00,810,Here's my cover for @DissidentRPG! It's proceeds are going directly to the National Bail Fund Network (http://bit.ly/localbailfunds). When the book launches I'll be sharing the @itchio and @DriveThruRPG links here. (1) #blacklivesmatter #tabletop #rpg #dnd #drawingwhileblack,317
340,2020-06-14 18:55:52+00:00,569,"You wonder why we have multicultural, capitalist, globalist, #BlackLivesMatter societies today? Because of the ANTIFA (Anti-Fascists) of the 20th century. They came here and defeated the fascists. So we have an Anti-Fascist society. Enjoy. You harvest what you sow. ",86
341,2020-06-14 18:55:31+00:00,226,"WATCH: Hundreds are marching in the streets of Los Angeles, California in solidarity with #BlackLivesMatter and to celebrate #PrideMonth",83
342,2020-06-14 18:55:23+00:00,267,"It is beyond devastating and traumatic that this poignant image even exists with more Black blood staining the streets every day. However, we cannot look away and we must #SayTheirNames. #BlackLivesMatter (Artwork by @KadirNelson)",83
343,2020-06-14 18:51:18+00:00,248,"Take some time to witness the scale of this uprising, from Tuscaloosa to Salt Lake to Portland to Honolulu, in this NYT photo compilation. #BlackLivesMatter ",120
344,2020-06-14 18:50:46+00:00,197,Singing You about to loose yo job As we near 125th street and Amsterdam #puertoricandayparade #BlackLivesMatter #NYC,74
345,2020-06-14 18:50:42+00:00,97,"Bad move Starbucks... Tell me, what did all that bias training you held a couple of years ago do? It looks like you didn’t learn much. #BlackLivesMatter ",14
346,2020-06-14 18:50:29+00:00,315,"Just spotted a 2-person #BlackLivesMatter protest in downtown Luverne, Alabama. Population ~2,800.",42
347,2020-06-14 18:50:24+00:00,125,"All across the country, young people are rising up and demanding racial justice and an end to police violence against Black Americans. Please join us later today for a discussion with young Black Americans about how they are organizing with the #BlackLivesMatter movement. ",25
348,2020-06-14 18:49:45+00:00,260,Oh hey this is popular I guess so DEFUND THE POLICE #DefundThePolice #BlackLivesMatter,19
349,2020-06-14 18:49:22+00:00,313,The list of lives taken is too long to paint. Today I add 3 more beautiful souls who should still be on this Earth. Say her name. #RemMie Say his name. #Tony Say her name. #Riah #BlackTransLivesMatter @TransLifeline #BlackLivesMatter #DominqueFells #TonyMcDade #RiahMilton #Pride,220
350,2020-06-14 18:48:58+00:00,75,Hundreds here at Stadium High School for Teachers for #BlackLivesMatter march to Wright Park. #tacomaprotests,25
351,2020-06-14 18:48:25+00:00,64,We didn't get here by accident. These are policy choices made by people in power that uphold the system that keeps the boot of oppression on people's necks. We can and must build a better tomorrow and a just future for all. #BlackLivesMatter ,32
352,2020-06-14 18:47:22+00:00,312,One of these things is not like the other One of these things is not the same One of these things is orange and awful In five months we can stop playing this game http://Vote.gov #BlackLivesMatter,18
353,2020-06-14 18:46:46+00:00,385,NEW MURAL : A group of volunteers are putting on the finishing touches to this new #Blacklivesmatter mural on 14th street between V and W Streets. @fox5dc,129
354,2020-06-14 18:44:10+00:00,98,"Oooh let's play ""I Spy,"" who's that blue shirt wearing grumpy looking Boogaloo boy at the #BlackLivesMatter protest in #Indianapolis?",59
355,2020-06-14 18:42:51+00:00,899,"Bravo Patrick Hutchinson Thank you for showing such humanity, kindness &amp; strength to someone who had come to oppose our legitimate protest to end institutional racism #BlackLivesMatter. Great piece @kemenzerem!",165
356,2020-06-14 18:41:43+00:00,819,Marcelo celebrated by taking a knee after scoring a goal in support of the #BlackLivesMatter movement. ,107
357,2020-06-14 18:39:42+00:00,5038,Rayshard Brooks was unarmed and fatally shot in a Wendy’s parking lot last night by Atlanta police. #SayHisName #RayshardBrooks #BlackLivesMatter ,2234
358,2020-06-14 18:39:35+00:00,371,If y’all really cared about Wendy’s you would’ve said something when the quality went to shit after Dave died. #BlackLivesMatter,17
359,2020-06-14 18:37:15+00:00,8193,GEORGE FLOYD should’ve had more birthdays SANDRA BLAND should’ve had more birthdays ROBERT FULLER should’ve had more birthdays BRONNA TAYLOR should’ve had more birthdays REGIS KORCHINSKI should’ve had more birthdays #AllBirthdaysMatter #blacklivesmatter,2903
360,2020-06-14 18:35:49+00:00,494,"Today, on the birthday of the most dangerous traitor in American history, whose life should certainly end with a stint in federal prison, I celebrate the last legitimately elected American president, Barack Obama, who didn't require a national rebellion to know #BlackLivesMatter. ",110
361,2020-06-14 18:35:15+00:00,57,"~~DONATION DRIVE~~ For #Pride and #BlackLivesMatter I'm offering simple, duotone, single-character sketch commissions to raise money for The Okra Project, who aim to provide meals and other resources for black trans people. https://www.theokraproject.com/",34
362,2020-06-14 18:34:11+00:00,53,Passing 138th and Amsterdam #puertoricandayparade #BlackLivesMatter #NYC,24
363,2020-06-14 18:33:54+00:00,486,Cycling UK shared a ppst about #blacklivesmatter and THIS is just some of the responses they got... and everyone says cycling doesn't have a diversity issue #ukcyclechat,105
364,2020-06-14 18:32:25+00:00,85,"Now, would you look at that. Crowd out in Brooklyn this afternoon and we can't see the ends. #BlackLivesMatter #BlackTransLivesMatter #nycprotests",42
365,2020-06-14 18:32:19+00:00,125,"Katie Hopkins can be as openly racist as she wants on this platform and get away with it. If I tweeted dialled down versions of her tweets, I'd be banned for life. Why don't you act @Twitter, @TwitterUK, @TwitterMedia? Do #BlackLivesMatter to you?",58
366,2020-06-14 18:31:59+00:00,59,"Leaked today: Racism contributed to disproportionate UK BAME coronavirus deaths. Why is the British public having to rely on leaks for the truth? If the UK govt can’t face up to it, how will they address it? #BlackLivesMatter ",33
367,2020-06-14 18:31:56+00:00,98,#AllBirthdaysMatter all of their birthdays matter too. #BlackLivesMatter ,55
