,Datetime,Favorites,Text,Retweets
0,2020-06-22 23:59:22+00:00,1602,"Just watched @NASCAR for the first time in my life to see @BubbaWallace . It was an amazing finish, #BubbaWallace best #Talladega ever, and I might be a new fan. They got folks wearing #BlackLivesMatter shirts at a NASCAR race... Wow ",280
1,2020-06-22 23:59:02+00:00,117,NASCAR swapped out confederate flags for #BlackLivesMatter shirts. That’s a W.,14
2,2020-06-22 23:58:35+00:00,144,"Powerful message and image as Bubba Wallace apologizes for not wearing his mask, because he wanted whoever put the noose in his garage to see they can’t take away his smile. Surrounded by fans with #ICantBreathe and #BlackLivesMatter shirts. #GEICO500 #Talladega",27
3,2020-06-22 23:57:33+00:00,1005,Seeing #BlackLivesMatter shirts at Talladega instead of confederate flags is such a welcome and great sight. Chills. ,88
4,2020-06-22 23:55:56+00:00,1228,I never thought I’d see this in the sport in my lifetime. Thank you @BubbaWallace #BlackLivesMatter ,162
5,2020-06-22 23:55:26+00:00,115,If you haven’t fully grasped what’s going and why we’re protesting and keeping the conversation going here’s a glimpse #BlackLivesMatter ,99
6,2020-06-22 23:54:50+00:00,151,Here are some of those youth. Pictured at largest #BlackLivesMatter protest in #yxe. It was stunning to see those young Saskatchewanians lead 4000 people.,17
7,2020-06-22 23:54:01+00:00,2423,#BREAKING: Protesters have opened the fence surrounding the Andrew Jackson statue in Lafayette Square and have climbed on top. I’ve heard them say they’re trying to tear it down. @wusa9 #BlackLivesMatter ,1263
8,2020-06-22 23:52:09+00:00,150,"Such a tragedy! She was a beautiful soul! #OluwatoyinSalau #SayHerName Man Allegedly Admits to Kidnapping, Sexually Assaulting #BlackLivesMatter Activist Before Killing https://people.com/crime/oluwatoyin-salau-killing-suspect-allegedly-confesses-killing-sex-assault/?utm_source=twitter.com&amp;utm_medium=social&amp;utm_campaign=social-share-article",120
9,2020-06-22 23:51:31+00:00,319,Make it make sense. #BlackLivesMatter | @TheRoot,150
10,2020-06-22 23:51:01+00:00,369,"Y’all realized Disney Hipsters isn’t a thing anymore right? If you’re #antitrump, #blacklivesmatter, #translivesmatter and into protecting the earth? This is for you. We’re like 10% Disney at this point.",5
11,2020-06-22 23:50:14+00:00,100,#BlackLivesMatter isn't anti-white. It's pro-black. #TransLivesMatter isn't anti-women. It's pro-transgender.,25
12,2020-06-22 23:49:29+00:00,802,I’ve been saying for years that #BlackLivesMatter is run by a bunch of radical leftist fat lesbians! Here’s proof: WATCH: ‘Black Lives Matter’ Founder: ‘Goal’ Is To Remove Trump; Reveals ‘Marxist’ Ideology ,286
13,2020-06-22 23:47:47+00:00,103,After seeing @ScrapYardFP's tweet a little while ago... I'm wondering if #BlackLivesMatter to them? The only Pro team I've seen take this stance... and having members of @TeamUSA on their squad. Need to know where they stand... and if it's on the right side of THIS history. #BLM,11
14,2020-06-22 23:40:05+00:00,227,This Sikh community in New York City is cooking and giving out free meals to #BlackLivesMatter protesters and those affected by the #coronavirus,82
15,2020-06-22 23:36:40+00:00,303,"I don’t know @BubbaWallace, but I’m sooooo proud of him, and I’m a fan! Big ups to @NASCAR also! It’s incredible that they are on the correct side of history ... and our American president, is NOT! Say it @realDonaldTrump —&gt; #BlackLivesMatter ",50
16,2020-06-22 23:34:40+00:00,242,"Thousands of kids, academics, politicians and mainstream press are cheering on #Communist #blacklivesmatter as they tear down our society. You should be terrified.",76
17,2020-06-22 23:32:34+00:00,365,The last time Fascists flew planes over Manchester the RAF shot them down. Wish they had tonight. #kickitout #BlackLivesMatter ,51
18,2020-06-22 23:21:45+00:00,24618,WHERE IS THE OUTRAGE??? Over a 100 People were shot in Chicago Over the weekend. 14 killed 3 year old and 4 teens were killed. Where is #BlackLivesMatter ? Where are the Protests &amp; Riots for these people ? WHERE IS CNN? WHERE ARE THE CELEBRITIES? ,12759
19,2020-06-22 23:15:45+00:00,237,#BlackLivesMatter ISNT JUST A MOMENT ITS A MOVEMENT ! ,56
20,2020-06-22 23:59:31+00:00,144,I’m 50 today! I lost more followers than gained! Thought I was upset but I’m not! I need more followers that believe... #BlackLivesMatter!! I’m tired of hearing ALL lives matter from white people that have never ASKED a black person about thier experiences!!! #SorryNotSorry!,13
21,2020-06-22 23:56:47+00:00,64,"Tuesday June 23 (still daily), 5 - 8p Atlanta Line of solidarity in front of olympic rings at Centennial Olympic Park across from 135 Andrew Young Intl Blvd NW See retweet for demands, details Bring mask, signs, water, empty bladder #BlackLivesMatter #AtlantaProtests",48
22,2020-06-22 23:56:21+00:00,39,"It seems that #FirstNations lives still don’t matter in WA A WA police officer who dragged a handcuffed #Indigenous boy on to the ground, causing his head to hit the pavement, escaped any sanction over the incident #BlackLivesMatter #PoliceBrutality",52
23,2020-06-22 23:55:08+00:00,54,"(September 2016) Zianna Oliphant, a young girl from NC, testifies to the Charlotte City Council after the shooting death of Keith Lamont Scott #BlackLivesMatter ",20
24,2020-06-22 23:52:13+00:00,52,#Blacklivesmatter guya try to kill a homeless man with fireworks in harlem new york while he sleeps. #blm #newyork #nyc #harlem,32
25,2020-06-22 23:52:08+00:00,42,Summer issue live at http://www.wilpublication.com! From @JuliaGillard @sanditoksvig @afuahirsch @adilray @KateWilliamsme &amp; other influencers we feature unwavering thought leadership/In Focus analysis that provoke positive disruption at a time of great change #BlackLivesMatter #COVID19,22
26,2020-06-22 23:51:54+00:00,51,"Black, Indigenous, and racialized people are dying at the hands of the police. We MUST fundamentally change how we view policing and community health and safety. #onpoli #BlackLivesMatter Read this Document. ",32
27,2020-06-22 23:49:39+00:00,90,5/ A large contingent of the youth leaders at the #BlackLivesMatter protests in #sk were of African origin. #yxe #skpoli #canpoli,5
28,2020-06-22 23:49:25+00:00,66,My podcast: #InSearchOfBlackHistory-@audibleuk-is free. You'll find out how #Lloyds-world's biggest broker-came into being: by insuring slave ships mainly against revolts on board. Largely led by women. Policy title: #InsurrectionOfCargo #blacklivesmatter ,24
29,2020-06-22 23:48:25+00:00,77,"4/ Here is some of the fun info: This rapid growth of the Black population in the Prairies has been driven by immigration, mainly from African countries. #BlackInCanada #skpoli #canpoli #BlackLivesMatter",4
30,2020-06-22 23:47:00+00:00,32,“It’s about the long-term consequences of racial policies during the colonization of Africa.” - @fredbauma90 on why he’s protesting in New York City. #BlackLivesMatter #WhyIProtest @hrw,15
31,2020-06-22 23:43:54+00:00,100,"Education matters, everyone. #BlackLivesMatter ",51
32,2020-06-22 23:36:58+00:00,42,"I’m into #F1 racing, not #NASCAR but this show of support for its lone black driver, @BubbaWallce is m DEEP after a hangman’s noose was found hanging in his garage yesterday. He recently displayed #BLACKLIVESMATTER on his car and got @NASCAR to ban the confederate flag. ",8
33,2020-06-22 23:36:55+00:00,29,Aaaand day 25 is in the books. #DetroitWillBreathe #BlackLivesMatter ,11
34,2020-06-22 23:35:17+00:00,55,"We’re not going to change things until we have the political will to seize this moment, and tackle systemic racism in policing. No one should risk their lives calling for help. Here’s our commitment #BlackLivesMatter #onpoli ",15
35,2020-06-22 23:34:43+00:00,22,NOT GUNNA STOP TWEETING THIS SO UNFOLLOW ME IF IT’s ANNOYINg BUT AT LEAST DONATE FIRST #blackwomentwitter #BLACKLIVESMATTER #NC #pride,40
36,2020-06-22 23:34:35+00:00,115,Dirty-City PD mobilizing. #DefundThePolice #BlackLivesMatter ,42
37,2020-06-22 23:30:02+00:00,85,Sorry hard to believe. If you are pro #BlackLivesMatter and anti white supremacy I’m just not buying Bernie supporters are unfollowing you for that. I’ve been involved far too long.,8
38,2020-06-22 23:27:43+00:00,46,"The KY primary is tomorrow. This primary is highly significant Why? Mitch McConnell. Take a listen to @trymainelee’s 19 min podcast about KY, racism and the primary. Things are changing. #BlackLivesMatter #BlackVotesMatter #BreonnaTaylor #wtpEBRC",45
39,2020-06-22 23:27:30+00:00,98,#UBC board chair resigns after “liking” tweets critical of #BlackLivesMatter — but they still employ staff connected to an organization founded by a convicted pedophile. NEW from @YesThatAnna STORY: https://www.rebelnews.com/university_of_british_columbia_board_chair_resigns_after_liking_tweets_critical_of_black_lives_matter pic.twitter.com/nFGnavbMlW,54
40,2020-06-22 23:20:59+00:00,213,Let's call it what it is. Antifa and #BlackLivesMatter are black supremacist groups.,81
41,2020-06-22 23:17:49+00:00,28,ARREST THE COPS WHO KILLED BREONNA TAYLOR!! SAY HER NAME!! #BreonnaTaylor #NoJusticeNoPeace #BlackLivesMatter ,22
42,2020-06-22 23:14:51+00:00,280,Fact Check More Americans citizens would rather live next to a #refugee or #undocumented #Immigrant than having to live next to a racist #MAGA @realDonaldTrump supporter #VoteBlueToSaveAmerica #BlackLivesMatter #LockHimUp http://www.nestorgomezstoryteller.com/podcast.html,32
43,2020-06-22 23:14:04+00:00,312,A wonderful speech of raw honesty from Graeme Souness. With real emotion he calls himself out over not standing up to racists within football and then asks himself how he can do more to campaign against racism. #BlackLivesMatter ,84
44,2020-06-22 23:13:56+00:00,326,PEOPLE HAVE BEEN APPROACHED BY WHITE MEN SELLING FIREWORKS FOR DIRT CHEAP. THE NYPD & CITY GOV ARE NOT SLICK. WE SEE YOU. this is the beginning of psychological warfare. #fireworksnyc #nycfireworks #fireworks #BLACKLIVESMATTER ,181
45,2020-06-22 23:12:36+00:00,149,"Over 300 Planned Parenthood staffers have signed a letter saying Planned Parenthood created a ""climate of systemic racism."" But #BlackLivesMatter and the liberal media won't condemn that. ",121
46,2020-06-22 23:10:40+00:00,2643,#BlackLivesMatter to @mschlapp: can you hear us now?,560
47,2020-06-22 23:10:09+00:00,600,Naaaa..black lives still and forever will matter..love y’all niggas #blacklivesmatter https://twitter.com/elitelife_kd/status/1273001046722437130 pic.twitter.com/PZ1s88Sn3K,83
48,2020-06-22 23:09:25+00:00,201,Came home to this...Rest in Power indeed George Floyd. #BLM #BlackLivesMatter ,18
49,2020-06-22 23:09:14+00:00,117,Did you know that Canadian currency honours famous Canadian racists? #BlackLivesMatter #cdnpoli,65
50,2020-06-22 23:08:20+00:00,86,"So let me get this straight: #BlackLivesMatter redirects $$$in donations from the public into D Party campaigns, including @JoeBiden. Uncle Joe has a long history of unsavory words, actions, &amp; friends. ...and people believe BLM is fighting for black people's rights? #Blexit",133
51,2020-06-22 23:02:53+00:00,310,I’m not really interested in the people against #blacklivesmatter because their mindset hasn’t changed in generations. Far smarter people than me have beaten them in debate. What most interests me is the passion and sophistication of those who oppose them. That’s what excites me.,44
52,2020-06-22 23:02:15+00:00,461,Remember this? I paid a high price. Carol Swain blasts Black Lives Matter; Vanderbilt responds #blacklivesmatter #Marxism,191
53,2020-06-22 23:00:31+00:00,130,"Those fighting for ""civil rights"" today *are* the Republicans. Religious freedom Free speech Right to bear arms #BlackLivesMatter could have been, but is not, about civil rights. It wants to break the system, defund the police, erase history, cancel opposition, and seize power ",64
54,2020-06-22 22:59:09+00:00,206,I’m so confused. Someone is going to have to help me with this. A millionaire footballer wearing a badge that says #BlackLivesMatter has a huge problem with another sign that says #WhiteLivesMatter. I’m lost.,96
55,2020-06-22 22:58:41+00:00,185,"#blacklivesmatter, the longer it remains in the news, allows essential room and time for more and better alliances to emerge, for more and better progressive action to be proposed and executed. Every step that supports it, big or small, is vital oxygen.",29
56,2020-06-22 22:56:41+00:00,37,"We’re fighting for an America where #BlackLivesMatter and everyone can succeed -- that’s why we’re so thrilled to have @KamalaHarris’ support of #ACA5. Sen. Harris is one of the most inspiring voices for equality in America today, and we are honored to fight with her.",21
57,2020-06-22 22:54:18+00:00,1576,"Whatever #blacklivesmatter goes on to achieve, I have never seen so many white footballers in the UK step up or speak out in solidarity with their black peers in such a short space of time. This feels different, and I think it is. ",220
58,2020-06-22 22:54:12+00:00,723,#blacklivesmatter THEN NOW AND ALWAYS https://www.instagram.com/p/CBwT4eTp4DF/?igshid=2o0rylxu7mz9,80
59,2020-06-22 22:53:47+00:00,239,Real proud of MY Navy rn. BZ. #blacklivesmatter ,50
60,2020-06-22 22:53:11+00:00,2898,"BREAKING: 1,600+ Google workers signed this letter calling on @google management to cancel the company's police contracts. Thank you to those google workers who have signed on already. We encourage more Google workers to sign on in support of #BlackLivesMatter. ",1015
61,2020-06-22 22:49:02+00:00,81,"If you don't know what to do, do what Ben Mee did. Be the one who stands up to your own. Be the one who says intolerance is intolerable. Be the one who responds to that 'no offence mate' your friend gets so often in the pub, with 'I'm offended'. Be the one. #blacklivesmatter",14
62,2020-06-22 22:47:53+00:00,349,The enemy of 99% of white people isn't the #BlackLivesMatter movement. It's neoliberalism. AKA the #BillionaireLivesMatter movement.,128
63,2020-06-22 22:46:46+00:00,191,So someone paid money to fly a #WhiteLivesMatter banner over the Etihad. When was the value of white life ever in doubt? A timely reminder why the #BlackLivesMatter campaign exists in the first place.,42
64,2020-06-22 22:44:25+00:00,355,.@MayorBowser this is the #BlackLivesMatter Plaza you build. Now @ChiefNewsham @DCPoliceDept is preparing to attack your constituents and unarmed homeless people. #StopMPD #DefundMPD @CNN @MSNBC @wusa9 @nbcwashington @fox5dc The Police vs The People,232
65,2020-06-22 22:43:14+00:00,50,Arrest the police that murdered #BreonnaTaylor #BreonnaTaylorWasMurdered #JusticeForBreonnaTaylor #BlackLivesMatter #NoJusticeNoPeace We cannot let this go until there is justice. Please RT. Please go harder for Breonna.,33
66,2020-06-22 22:38:03+00:00,967,"So why is it OK for them to have #BlackLivesMatter on their shirts, but a banner saying #WhiteLivesMatter is offensive. Only racists can find one fine and the other offensive. #AllLivesMatter",129
67,2020-06-22 22:35:21+00:00,123,"BREAKING: 1,600+ Google workers ask CEO to cancel company contracts w/police. “We have a long way to go to address the full legacy of racism but to begin with — we should not be in the business of profiting from racist policing. https://techcrunch.com/2020/06/22/google-employees-demand-company-stop-selling-tech-to-police/ #BlackLivesMatter",59
68,2020-06-22 22:35:16+00:00,764,#DefundThePolice and invest in Black Lives today! #BlackLivesMatter ,198
69,2020-06-22 22:34:24+00:00,202,When Souness says he’s witnessed racism in football clubs Director/board rooms everything makes sense #BlackLivesMatter,15
70,2020-06-22 22:33:40+00:00,1363,"This young Black man was murdered by cops in 2019 He was walking home from buying tea @AuroraPD in Colorado beat him to death for 15 minutes because he “looked suspicious"" Say his name: #ElijahMcClain + tell @GovofCO disband this PD #BlackLivesMatter",1064
71,2020-06-22 22:29:07+00:00,84,"The #MagicArtChallenge for #BlackLivesMatter is fully underway! We're auctioning original #mtgart to raise money for great charities, like NAACP LDF, the Okra Project, and more. Check out all the auctions here: https://magicartchallenge.scryfall.com/",33
72,2020-06-22 22:28:23+00:00,507,"Democrats have been ""using"" black voters for decades. #BlackLivesMatter is just the latest and most perverse example.",220
73,2020-06-22 22:25:48+00:00,299,"As a @BurnleyOfficial season ticket holder embarrassed to see the banner at tonight's game. The individuals behind this do not represent the people of this town, the club or our supporters. I am proud of the quick response from the club &amp; captain Ben Mee. #BlackLivesMatter",32
74,2020-06-22 22:25:18+00:00,110,"the replies underneath the tweets made by players, clubs, the league and the media tell us that the #BlackLivesMatter movement is only at its very beginning. keep being vocally anti-racist. silence is complicity.",27
75,2020-06-22 22:24:51+00:00,80,Happy to see NASCAR marching in support for Bubba Wallace & #BlackLivesMatter ,17
76,2020-06-22 22:24:07+00:00,34,"Hi guys! My sister and her amazing friend have created tshirts and scrunchies, all proceeds will be going to Law for Black Lives and Black Legal Action Center. The graphics were designed and donated by black artists. Please share! #BlackLivesMatter : https://instagram.com/prxject.twenty?igshid=7jlfr6h0tvf0",38
77,2020-06-22 22:17:37+00:00,306,.@MayorBowser created #BlackLivesMatter Plaza &amp; now @ChiefNewsham @DCPoliceDept is prepared to attack the people at the place @MurielBowser created for them. #StopMPD vs The People. It’s hundreds of Cops against homeless &amp; unarmed constituents. This is DC tax dollars. #DefundMPD,253
78,2020-06-22 22:13:57+00:00,189,"Some #Burnley fans so angry about football players taking the knee and wearing #blacklivesmatter on their backs they fly this response over stadium. Grim. Thank you to the #BurnleyFC captain Ben Mee for this response, but just look at the replies to the clip. Scary times. https://twitter.com/SkySports/status/1275177772311351296",37
79,2020-06-22 22:13:44+00:00,66,So freaking sad full video here: https://youtu.be/opk8RgBRbcs #MekayJames #JusticeforMekayJames #HeWontGetaMainstreamHashtag #AllBlackLivesMatter #blacklivesmatter #ALLLIVESMATER,44
80,2020-06-22 22:11:22+00:00,331,"Do #BlackLivesMatter to Democrats? Considering exploding black-on-black crime and extreme black abortion numbers in Democrat-run cities, I don't think so.",129
81,2020-06-22 22:09:13+00:00,31,Gonna be playing a massive charity stream for @insomniacevents this Friday along side @CHEFSAYMYNAME @yehme2 @BlvkJvck @LitLords and @Gladez proceeds will be going to the Los Angeles Urban league so make sure to go to http://tv.insomniac.com to tune in! #BlackLivesMatter ,15
82,2020-06-22 22:08:52+00:00,54,So @BurnleyOfficial #BlackLivesMatter is ok but #WhiteLivesMatter is racist? Can someone please explain the logic? As far as I'm concerned #AllLifeMatters,29
83,2020-06-22 22:07:31+00:00,46,One of the most prominent #BlackLivesMatter activists in the country is calling for nationwide vandalism of churches just two days after video circulated of a BLM founder admitting that she and her associates are 'trained Marxists.' How much longer will we tolerate this? ,31
84,2020-06-22 22:06:52+00:00,50,"On another note since I see it’s getting a good amount of likes, a black man was found lynched 20 minutes away from me on Long Island and it was ruled yet another suicide. don’t stop fighting, signing petitions, ANYTHING! #BlackLivesMatter",19
85,2020-06-22 22:06:27+00:00,187,"Honestly, the last month has been a lot mentally. I try and support #BlackLivesMatter and #SpeakingOut amongst my normal support for women's wrestling &amp; it's all been taxing. A lot of people have showed their true face outside of wrestling. I need a moment, love y'all ",12
86,2020-06-22 22:06:19+00:00,412,#BlackLivesMatter activist Shaun King says statues of Jesus Christ should be torn down — but just the white ones ,381
87,2020-06-22 22:04:30+00:00,73,"Another day, another peaceful protest organized by the unstoppable @ProRockThrower. Are you listening, @MassGovernor? #BostonProtests #RayshardBrooks #BlackLivesMatter ",26
88,2020-06-22 22:03:19+00:00,132,I support #BlackLivesMatter I support @BurnleyOfficial I don't support the use of light aircraft to antagonise and attempt to undermine the most significant and most needed social movement of a generation.,21
89,2020-06-22 22:02:39+00:00,311,"Your favorite popular #BlackLivesMatter activist hasn’t said a word about #reparations for #ADOS...Process that for a minute...If your maxim is Black Lives Matter, understand that reparations cannot be absent in your fight for justice.",130
90,2020-06-22 22:00:18+00:00,33,"#BlackLivesMatter may catalyze #facialrecognition legislation, and big tech companies should have no choice about whether to erode our rights. It's time to #BanFacialRecognition. Contact your representatives at http://banfacialrecognition.com https://www.washingtonpost.com/technology/2020/06/12/facial-recognition-ban/",26
91,2020-06-22 22:00:18+00:00,137,Police brutality should not have to be on video for victims to seek justice. #BlackLivesMatter,27
92,2020-06-22 22:00:14+00:00,49,"It would be easy to look at a photo from the 1980s & conclude that things have changed. There is still a long way to go in how the medical field treats minority patients, especially Black people. #BlackLivesMatter ",45
93,2020-06-22 21:55:24+00:00,247,Pob nerth i chi @crwstcymru Keep supporting #blacklivesmatter ,32
94,2020-06-22 21:51:32+00:00,83,Absolutely brilliant response - didn’t even wait for a question. Well done Ben Mee #BlackLivesMatter #AntiRacism,8
95,2020-06-22 21:51:12+00:00,93,This is what progress looks like in the face of growing intolerance for hatred. Inspiring. #NASCAR #BlackLivesMatter #endracism @BubbaWallace,10
96,2020-06-22 21:48:59+00:00,587,The #Nats have created signage for #BlackLivesMatter on the stadium. by Sol Tucker for TalkNats ,86
97,2020-06-22 21:39:18+00:00,1272,Quality from Ben Mee #blacklivesmatter ,236
98,2020-06-22 21:35:51+00:00,3923,"Great win tonight!! Well done, guys! ¡Gran victoria esta noche! ¡Bien hecho, chicos! #ManchesterCity #PremierLeague #BlackLivesMatter ",194
99,2020-06-22 21:35:25+00:00,655,"In 1990, Nickelodeon ratified its first ever Kids’ Bill of Rights. We stand by these rights and for each other today, tomorrow, and always #BlackLivesMatter ",118
100,2020-06-22 21:33:42+00:00,101,"#BlackLivesMatter is a criminal organization structured to protect the crime going on in their high crime, high violence neighborhoods from the police, who are trying to confront it and contain it. Maybe they profit from it ",142
101,2020-06-22 21:33:20+00:00,1393," ""I didn't challenge them and I'm angry with myself now that I brushed it off at the time"" Graeme Souness on how his attitude has changed to hate #BlackLivesMatter ",309
102,2020-06-22 21:30:55+00:00,613,.@MicahRichards passionate speech on the #BlackLivesMatter movement following the White Lives Matter banner over the Etihad tonight ,106
103,2020-06-22 21:30:30+00:00,660,"""Tear them down."" Yes, you heard that from a prominent #BlackLivesMatter activist telling people to tear down statues of Jesus. ",308
104,2020-06-22 21:30:27+00:00,180,"Please read this, retweet this and if you live in the #Vallejo area. My sister was murdered. BEAT to death by some dude. #JusticeForSymphony #California #Oakland #BlackLivesMatter #BlackWOMENMatter",435
105,2020-06-22 21:28:32+00:00,3696,"The reaction we get for putting up a #BLM poster in the window!! The poster WILL stay up as we are proud supporters of this movement. The sooner people educate themselves, the better. #BlackLivesMatter ",421
106,2020-06-22 21:28:23+00:00,145,"Ben Mee continued: ""The group of lads in there are embarrassed. It is not what we are about. It doesn't represent us. I heard it's a small number of people who arranged it. I'm ashamed it is associated with my club. Hopefully these people can learn"" #MCI #MCIBUR #BlackLivesMatter",15
107,2020-06-22 21:27:48+00:00,302,"White supremacists are everywhere - law enforcement, the justice system, the federal government - even our military. #WhiteSupremacy #blacklivesmatter #RacismIsAPublicHealthCrisis",200
108,2020-06-22 21:26:41+00:00,150,WATCH NOW: @RealCandaceO discusses hot-button issues of the day: Reactions to her viral video on #BlackLivesMatter Rayshard Brooks Defunding the police The state of Black America You don’t want to miss this. ,54
109,2020-06-22 21:26:37+00:00,151,"I’m here in Monroe Park with @zklosko and a group of protesters starting their march, check back in this thread and Zachary’s for updates on tonight’s #RVAProtests for #BlackLivesMatter.",82
110,2020-06-22 21:25:04+00:00,373,"Pep “Everyone knows that White Lives Matter, but we have to be convinced that Black Lives Matter too.” #BlackLivesMatter ",84
111,2020-06-22 21:24:30+00:00,516,"Funny isn't it. 90% of people agree #AllLivesMatter but racist anti white obsession of Marxist anti-Capitalist #BlackLivesMatter is causing racial tensions across the UK so that even saying All Lives Matter is now ""racist"" In this climate a banner like this is understandable",157
112,2020-06-22 21:23:44+00:00,118,The #49ers are flying a #BlackLivesMatter flag at Levi’s Stadium https://www.instagram.com/p/CBv9EopD7Wv/?igshid=1m328gzqnbrh4,10
113,2020-06-22 21:21:54+00:00,130,We at Paizo strive to represent our company’s values of inclusivity through the content of our Pathfinder and Starfinder publications. Publisher Erik Mona discusses the Agents of Edgewatch Adventure Path and #BlackLivesMatter on the Paizo blog at https://buff.ly/2NmJ0TW.,25
