,Datetime,Favorites,Text,Retweets
436,2020-06-15 15:58:56+00:00,46,Please follow this amazingly talented poet @Kyla_Lacey #BlackLivesMatter #SocialistAnyDay,38
437,2020-06-15 15:56:52+00:00,55,THE INSTIGATOR PLEASE SHARE. This individual was involved in 3 separate incidents at the #BlackLivesMatter violence in London on Saturday. Many people was seriously injured after being attacked by thugs. ,63
438,2020-06-15 15:54:58+00:00,107,"The racism pandemic has presented new & welcome opportunities to speak up/out. Got choked up a bit in this one, and still learning, but hope you'll take a listen and share. Shout out to @umichsph for the opportunity &amp; to my #academicpeeps for the inspiration. #BlackLivesMatter ",37
439,2020-06-15 15:54:13+00:00,1999,"#LoveWins #BlackLivesMatter #TransRightsAreHumanRights ...because, and I can not stress this enough: we are not going back.",337
440,2020-06-15 15:53:11+00:00,35,"If #BlackLivesMatter how about you take that torturous police floodlight off of Marcus Garvey &amp; Madison, finance our public schools like they’re the upper east side and mandate affordable housing in the Stuy. And don’t forget to #DefundThePolice Political theater isn’t welcome.",16
441,2020-06-15 15:51:54+00:00,73,"As chair of @CheltenhamBC standards committee, I’ve asked that a meeting is called without delay to deal with the repeated use of a racial slur by a councillor during the debate on #BlackLivesMatter. There is no excuse for the use of such language, no matter the context.",16
442,2020-06-15 15:51:34+00:00,74,"From DC to Seattle, we demand that our cities #DefundThePolice and invest in our communities. (photo credit: Eleanor Goldfield) Out with @backboneprog shining a light on the issues. #defunddcpolice #BlackLivesMatter #acab #radicalart #artivism",47
443,2020-06-15 15:51:02+00:00,71,"I took a break yesterday from painting. But I am back in the house, the Baba Yaga's house again today. But here's a throwback pic of me painting mundane stuff. Enjoy! #MondayMotivaton #DnD #miniatures #BlackLivesMatter #BLACKCREATORSFUND #BlackArtist",10
444,2020-06-15 15:50:25+00:00,151,"Not watching any more slavery/Black People Struggle-based movies & TV shows for a while, if I can help it. It shouldn't take for Black people to be traumatized & terrorized & lynched/slaughtered/executed for y'all to acknowledge & respect our human rights. #BlackLivesMatter #BLM",39
445,2020-06-15 15:50:19+00:00,39,"#CalltoAction - Regional Chief @ORCRoseAnne Archibald calls for a Day of Action to end #SystemicRacism against Black, Indigenous and People of Colour on June 21, 2020. #NIPD #BlackLivesMatter #BIPOC Read more ",38
446,2020-06-15 15:47:50+00:00,229,While #BlackLivesMatter still cry for the criminal #GeorgeFloyd who died in an awful way. The same Black Lives Matter .org said nothing about #DavidDorn and all the other black lives who died as a result of rioting looting and shooting. #WalkAway #Blexit #MAGA @tophertownmusic,252
447,2020-06-15 15:45:30+00:00,17593,Proud to join the @CNN family today as a regular contributor. Looking forward to being heard. #blacklivesmatter #MoreThanAnAthlete,1434
448,2020-06-15 15:45:24+00:00,111,ANOTHER black man murdered by the police. Shot in the back three times whilst running away (again)... And you see white mass murderers with racial motivations getting apprehended alive and taken to Burger King. #RayshardBrooks #BlackLivesMatter,15
449,2020-06-15 15:45:00+00:00,597,"Neko Wilson, who suffers from severe asthma, is being wrongfully detained at Navajo County Jail which has a #COVID19 outbreak. We're demanding Navajo County officials #FreeNeko to home confinement &amp; save his life. #BlackLivesMatter Sign &amp; RT: https://www.change.org/FreeNekoNow #AZ01",388
450,2020-06-15 15:43:34+00:00,229," I ain't sorry I'm valid,so are YOU #ThisIsWhatAsexualLooksLike #ThisAceNeedsTheirSpACE #AceVisibility #BlackAsexual #BlackLivesMatter ",51
451,2020-06-15 15:43:12+00:00,128,"Pakistani's Monday : #BlackLivesMatter Sunday : Don't use word RiP for Hindu ""Double Standard""",7
452,2020-06-15 15:42:33+00:00,69,"AMERICA. We cannot keep doing this. Another hashtag. Another black man is dead. His family holding a press conference right now, with attorneys present. AMERICA. WE MUST DO SOMETHING IN THIS MOMENT. We must REFORM POLICING NOW! #BlackLivesMatter",14
453,2020-06-15 15:40:50+00:00,50,Proud to publish this w/ my Partner @Malik216_OHIO for @inclusv. We hope for managers/EDs/CEOs/HR in the political sector it will be a useful tool. And to the @inclusv members who spoke up we hope you feel heard. #BlackLivesMatter ,23
454,2020-06-15 15:37:44+00:00,78,"DO NOT SUPPORT PARALLEL WINE & WHISKEY BAR IN ASHBURN, VA!!!! Look at what they’re selling!! The owner literally think #BlackLivesMatter is a joke! don’t give them your business! ",44
455,2020-06-15 15:37:37+00:00,221,"#BlackLivesMatter Is the Trojan Horse for #MuslimBrotherhood can you believe this crap. Omg. I knew it where shit like this goes on all Muslim are behind it. And people say o some are good and some are bad. I say bull. We don’t know who is who that’s how they are doing it , pic.twitter.com/eVTAQGiXLq",201
456,2020-06-15 15:36:58+00:00,50,"Rest in Peace, Oluwatoyin ""Toyin"" Salau. Gone too soon(19years old). #BlackLivesMatter ",24
457,2020-06-15 15:35:24+00:00,120,Couldn't she have asked before she assumed he didn't live there. Instead she said she knew the owner and lied about it. He was under no obligation for anything. She and her husband kept saying it's private property. She was offend by the saying #BlackLivesMatter plain and simple,4
458,2020-06-15 15:31:16+00:00,807,"US diplomatic facilities often host displays promoting human rights. Kudos to diplomats at @USEmbassySeoul for raising the #BLM banner, despite knowing they wld be chastised by Pompeo. In insisting it be removed, @realDonaldTrump finds yet one more way to reject #BlackLivesMatter ",284
459,2020-06-15 15:29:22+00:00,305,"I live in the San Francisco Bay Area. To Lisa Alexander, CEO of LaFace Skincare: Apology not accepted. Start taking ACTION to make amends. #BlackLivesMatter #LaFaceSkincare",103
460,2020-06-15 15:27:16+00:00,2015,"What is happening in Southern Kaduna can NEVER happen in America. Yet, Nigerians are focused on #BlackLivesMatter. If Nigerians want Black Lives to Matter in America, let’s demonstrate it by the way we stand up for Nigerians being slaughtered daily by herdsmen #BuhariTormentor",585
461,2020-06-15 15:26:50+00:00,223,"rest in paradise to our ancestors who were lost at sea, may we never forget. #BLACKLIVESMATTER ",72
462,2020-06-15 15:26:43+00:00,65,"A CALL TO ACTION! Ontario AFN Regional Chief @ORCRoseAnne is calling for a Day of Action (to end of systemic racism that is killing/harming Black, Indigenous and People of Colour) on June 21st - National Indigenous Peoples Day. #IndigenousLivesMatter #BlackLivesMatter #BIPOC",51
463,2020-06-15 15:25:30+00:00,125,Hundreds at 8am rally outside #oakland city council member @DanKalb's house to demand his support to #DefundPolice - #BlackLivesMatter ,51
464,2020-06-15 15:24:30+00:00,59,Absolutely will never purchase LaFace skin care products since this is TheFace of their CEO. Racism is never OK #BlackLivesMatter PS shove your apology. Your true colors have been presented to the world. ,43
465,2020-06-15 15:22:24+00:00,158,It’s finished!!! My take from the protest. #pvprotest #pvamu #pvamu20 @Beyonce #BlackLivesMatter #SayHerName #saytheirnames #sayhisname,97
466,2020-06-15 15:21:13+00:00,206,"#WhyIProtest ""Enough of the silence. I think it's time for us to have these conversations and to fight, to make sure this is the last of it."" ~ Maliyamungu Muhande, New York City #BlackLivesMatter ",93
467,2020-06-15 15:20:40+00:00,299,"Tanzania's President Magufuli and his Opposition ""squeeze"". .@Gado ""has did it"" as one good Ugandan famously put it #GeorgeFloyd #BlackLivesMatter ",101
468,2020-06-15 15:19:55+00:00,99,"Lovelies, it’s Monday and #BlackLivesMatter... Today, tomorrow, always. ",16
469,2020-06-15 15:17:52+00:00,23,"Inviting all Black student survivors and student survivors of color to our check-in call in partnership with @ItsOnUs TOMORROW, 6/16 @4 PM ET, to come together in a safe community space to discuss the impacts of the ""double pandemic"". #BelieveSurvivors #BlackLivesMatter ",20
470,2020-06-15 15:17:30+00:00,441,Barr attacked peaceful protesters and lied about it. His job is to champion justice and stay out of partisan politics instead he champions the president and his political and personal agenda. He needs to be removed. #OneV1 #ImpeachBarr #BlackLivesMatter ,297
471,2020-06-15 15:17:21+00:00,50,"To ALL writers, #Blackwriters &amp; writers of colour: this is an #opencall to #submit short stories for an Anthology of Hope. This call is to address #racism, systemic racism and racial disparity. #Blacklivesmatter #BLM For details, visit https://susanmlane.com/excerpts/f/in-black-and-white via @@DutrizacSue",55
472,2020-06-15 15:17:12+00:00,43,"Today we’re making Universe Pro free for all organizers, groups, & grassroots movements to support the #blacklivesmatter movement. We believe in empowerment—build a website, take donations, link your social media accounts and send emails. Get started: http://empowerment.tools",19
473,2020-06-15 15:16:59+00:00,1655,I have always been #proud of my #almamater @sunyoswego but never more proud #blm #blacklivesmatter ,124
474,2020-06-15 15:15:00+00:00,56,"""They’re now finally getting it. That as long as Black people continue to be treated in this way, as long as the violence of racism remains what it is, then no one is safe.” Read powerful piece on groundbreaking activist Angela Davis. #BlackLivesMatter ",32
475,2020-06-15 15:14:19+00:00,339,"To the protestors outside the #Georgia Capitol right now, WE CAN HEAR YOU INSIDE THE HOUSE CHAMBER! Keep it up #gapol #BlackLivesMatter",78
476,2020-06-15 15:14:12+00:00,311,"Labour showing that #BlackLivesMatter by ... err ... allowing all of the anti-black racists exposed in the #LabourLeaks to remain in the party, whilst conducting a massive ideological purge of socialists.",154
477,2020-06-15 15:12:49+00:00,63,If #BlackLivesMatter - then Vote like their lives depended on it.,13
478,2020-06-15 15:11:20+00:00,214,"I find that what I experienced is all too familiar. In fact, it is a rite of passage. In reading statements affirming #BlackLivesMatter &amp; seeing Black works suddenly highlighted by mostly white corporations, I find that my silence stunts my healing and misleads my community. 13/",16
479,2020-06-15 15:11:16+00:00,951,That Black woman colleague? It me . A THREAD. 1/ #BlackTechTwitter #TrustBlackWomen #BelieveBlackWomen #InvestInBlackWomen #PayBlackWomen #Reparations #BlackLivesMatter ,439
480,2020-06-15 15:11:00+00:00,23,Seattle! Help our friends: Trader Joes on Cap Hill is closing in retaliation for workers organizing/protesting for #BlackLivesMatter. Stranger Article: https://www.thestranger.com/slog/2020/06/14/43907515/capitol-hill-trader-joes-crew-members-speak-out-after-corporate-closes-store-indefinitely Primary source &amp; petition: https://savetjs130.com,25
481,2020-06-15 15:09:53+00:00,1482,they really tried to come for Hellboy himself... @perlmutations I CANNOT! #BlackLivesMatter ,452
482,2020-06-15 15:09:42+00:00,73,“Let then vote!” #BlackLivesMatter activists chant near Gov. Reynolds’ office at the Statehouse. The GOP-run Senate derailed the constitutional amendment effort to restore former felon voting rights this weekend. Only option to get it done now before 2024 is Gov exec order ,21
483,2020-06-15 15:09:33+00:00,71,"1/8 We’ve gained lots of new followers recently through the focus on #BlackLivesMatter. If you’re new to our work, welcome! Here’s a thread about who we are and what we do…",29
484,2020-06-15 15:06:40+00:00,214,LIVE: Building a Youth centred economy now and beyond #COVID19: #JobsForAll - Alliance #YouthDay Commemoration #YouthDay2020 #BlackLivesMatter ,56
485,2020-06-15 15:06:24+00:00,67,Today I had to tell a CEO of a fundraising consultancy is it not acceptable to have a white only panel at a fundraising webinar. “It is something we are looking at in the future but had already decided speakers..” #changecollective #BlackLivesMatter @CharitySoWhite @IoFtweets,8
486,2020-06-15 15:06:18+00:00,42,"#Nederland: White supremacy Indon style. Thanks to 350 yrs Dutch colonization of #Indonesia. Now Indon think they are superior to Papuans cos of their skincolor &amp; cultures, if that doesnt reek of #racism idk what to say anymore #BlackLivesMatterNL #BlackLivesMatter #WestPapua",37
487,2020-06-15 15:04:10+00:00,107,"America continues to be a risky place for POC and the police, after weeks of protesting, of supporting #BlackLivesMatter, we bear witness to #RashardBrooks horrible death at the hands of Atlanta cops. People will stay in the streets until these cop killings of black men stop.",38
488,2020-06-15 15:02:29+00:00,71,"Now that SCOTUS has affirmed that the Civil Rights Act of 1964 protects LGB and T people from discrimination, let’s put this added protection right back to work to make sure it protects Black people! #BlackLivesMatter",25
489,2020-06-15 15:01:42+00:00,46,"#BLACKVOICESMATTER: Maria Alberts tells the awful story of how her black son was not only attacked by five men on his way home from a night out, but almost faced going to prison had it not been for her quick thinking. #BlackLivesMatter | #ShowRacismtheRedCard",33
490,2020-06-15 15:01:00+00:00,74," ""Time for actions, not words"" @abdoudoucoure16 on showing support for #BlackLivesMatter ",6
491,2020-06-15 14:58:00+00:00,141,"""We've never witnessed sustained demonstrations of this size that are so diverse. So I think that is what is giving people a great deal of hope."" #BlackLivesMatter ",69
492,2020-06-15 14:57:52+00:00,140,"This referee deserves to be honoured by the Bundesliga, Uefa and FIFA for helping Awoniyi. God bless him. Seeing this in the midst of the racist acts & #BlackLivesMatter protests going on in different parts of the world shows there’s hope ",47
493,2020-06-15 14:57:36+00:00,101,"When Will #BlackLivesMatter in Soaps? @notcoryon breaks down racism in front and behind the camera with @WrecklessLove, @SourceRyan, @Trish_AllDay, @rodrigosworld81. Listen now for their takes on racism in soaps on SoapBoxing with Coryon. #SoapBoxingPod",45
494,2020-06-15 14:56:45+00:00,157,Thousands took to the streets of Rome for a #BlackLivesMatter rally in solidarity with George Floyd ,68
495,2020-06-15 14:56:42+00:00,48,The United States has been protesting en masse for 22 days and for 22 days we have watched LE brutalize those protesters.. at the direction of Donald J. Trump. Never underestimate a sociopath. #BlackLivesMatter ,26
496,2020-06-15 14:55:29+00:00,70,"Last week during my virtual seminar, I shared some of my action items to support #BlackLivesMatter. During Q&amp;A, I provided some thoughts about how biomedical scientists/engineers can support the movement through their science (short thread):",9
497,2020-06-15 14:55:01+00:00,8240,I’m more terrified about being home right now. I’d rather be deployed where I know who my enemy is. LET THAT SINK IN...... #BlackLivesMatter #MondayMotivaton #KidVicious ,3805
498,2020-06-15 14:54:44+00:00,391,Please watch the whole thing before you make a comment #BlackLivesMatter #JusticeForToyin #JusticeForKirvan #JusticeForOluwatoyin #JusticeforKhalid,109
499,2020-06-15 14:52:48+00:00,298,"Radio channel LBC has fired N. #Farage after criticizing the #BlackLivesMatter mov., comparing it to the Taliban &amp; saying: ""Unless we get moral leadership quickly our cities won't be worth living in""(...) BLM is a far left Marxist organisation that wants to dismantle capitalism"" ",107
500,2020-06-15 14:52:38+00:00,60,"Over 160 faculty and staff at @LaSalleUniv have affirmed that #BlackLivesMatter and have stated our committment to addressing anti-Black racism in our community and beyond. I’m eager to keep learning, supporting, and acting. https://docs.google.com/document/d/e/2PACX-1vSAwxogD-V1vRygP3oZjCJtLJvu5YBE_0qmYkitoNKyxm-pciftHUA15amwFkk9oK1oILYaSz3h3Qfj/pub",13
501,2020-06-15 14:52:10+00:00,199, VERY true. They should be publicly posted. Remember tho that Minneapolis posts police disciplinary records on a public portal. That didn’t save #GeorgeFloyd. Only transformation will make big change. #BlackLivesMatter. ,58
502,2020-06-15 14:51:02+00:00,109,"REMINDER: Four-five or a hundred fascists on display is often reported by the news like it’s popular opinion, this is what popular opinion looks like. #seattleprotest #BlackLivesMatter ",51
503,2020-06-15 14:50:47+00:00,91,never thought we’d be protesting during a pandemic ... yet ... here we are #blacklivesmatter #blacktranslivesmatter #covid19,14
504,2020-06-15 14:50:39+00:00,329,LIVE: Building a Youth centred economy now and beyond #COVID19: #JobsForAll - Alliance #YouthDay Commemoration #YouthDay2020 #BlackLivesMatter ,73
505,2020-06-15 14:49:57+00:00,309,Say their names: Dominique “Rem’mie” Fells and Riah Milton. We must elect leaders who will demand justice for Black trans women. #BlackLivesMatter #BlackTransLivesMatter,291
506,2020-06-15 14:49:36+00:00,212,Yet another reminder that LGBTQ people owe our civil rights to Black Americans who fought for Civil Rights Act #BlackLivesMatter #AllBlackLivesMatter,77
507,2020-06-15 14:48:05+00:00,372,"Approximately 15000 (!!!!!) people dominated the streets of Brooklyn to show up for Black Trans Lives, because every single Black Life Matters. Black Trans Power matters. We will not be free until every single one of us is free. #BlackTransLivesMatter #BlackLivesMatter ",108
508,2020-06-15 14:47:21+00:00,83,Per SCOTUSBlog we are DONE. We'll be back on Thursday. Thanks all. Treasure today's victory. They are few & far between these days. And #BLACKLIVESMATTER!,17
509,2020-06-15 14:45:55+00:00,1010,“We’re taking this city back.” Rioters topple statue of Thomas Jefferson at Jefferson High School in Portland. They promise to go after other statues next. #BlackLivesMatter ,604
510,2020-06-15 14:45:15+00:00,57,Juneteenth is a day that honors Black freedom & Black resistance. This Juneteenth is a rare moment for our communities to proclaim in one voice that Black Lives Matter. #SixNineteen http://www.sixnineteen.com #DefendBlackLives #BlackLivesMatter #DefundPolice @Mvmnt4BlkLives,31
511,2020-06-15 14:42:12+00:00,48,"Many in corporate America have declared their support for #BlackLivesMatter. But their wokeness has limits. Why, for instance, have they deindustrialized black communities and shipped jobs to China? Invest, hire, and make your products in black communities.",18
512,2020-06-15 14:41:02+00:00,310,"""It was almost like a stampede."" A #BlackLivesMatter protester describes helping a far-right counter-protester under attack during demonstrations in London on Saturday ",113
513,2020-06-15 14:40:31+00:00,320,"I have never felt as black as I have these past 2 and a half weeks. And its with that feeling that I'm going to make this perfectly clear: #BlackLivesMatter. And as a fellow black man in America, you have me as an ally, if you agree. If you don't, get the fuck off my timeline.",41
514,2020-06-15 14:40:00+00:00,257,"Ron Perlman Challenges Ted Cruz to $50,000 Fight in Support of #BlackLivesMatter https://bit.ly/2YBFeLl",48
515,2020-06-15 14:39:10+00:00,76,MAGAT Michael Henkel gave an interview saying Trump is doing an amazing job in 2017. He tore down #BlackLivesMatter signs and said Black lives don’t matter to him! He’s a Writ Family Court Supervisor in Philadelphia... He’s about to lose his job! ,63
516,2020-06-15 14:37:33+00:00,136,"#BlackLivesMatter is feminism for black people. Complete with victim culture, explicit Marxism, anti-patriarchy, anti-father, ""muh privilege"", feelings over facts, no goals or vision, etc. Same old scam, new packaging.",50
517,2020-06-15 14:36:09+00:00,160,"About 10 days ago, my friends @bushtheatre asked me to write something in response to #GeorgeFloyd and the #BlackLivesMatter protests. I took a day and wrote this. It might be the most personal thing I've shared on the internet. x ",43
518,2020-06-15 14:34:09+00:00,1621,just a daily reminder: #BlackLivesMatter,108
519,2020-06-15 14:33:06+00:00,27,"Join me, @aintilatina &amp; other Black Latinas for an important virtual discussion on how Latinx sororities are addressing the Black experience and engaging with the communities they serve #IAmOPBSI @OmegaPhiBeta RSVP https://blacknessinlatinxgreekorganiza.splashthat.com #BlackLivesMatter #LasVidasNegrasImportan",17
520,2020-06-15 14:32:08+00:00,71,"Toyin Salau was 19, posted about her rapist on twitter and was found dead a couple days later. she pleaded for help and nothing happened, then she went missing and turned up dead. rest in peace beautiful angel, we will fight for you #JusticeForOluwatoyinSalau #BlackLivesMatter ",44
521,2020-06-15 14:32:01+00:00,106,VIDEO: The #MarchOnGeorgia has arrived at the Georgia State Capitol Building. #Atlanta #BlackLivesMatter #ATL #AtlantaProtest #Protests #gapol @FOX5Atlanta @Georgia_NAACP pic.twitter.com/FrR06GupMn,49
522,2020-06-15 14:32:00+00:00,86,another innocent soul was taken from us... HOW MANY MORE LIVES ARE GONNA BE TAKEN UNTIL EVERYONE OPENS UP THEIR FUCKING EYES!!! THIS IS WRONG RAYSHARD DID NOTHING HE JUST BEGGED TO WALK HOME #RayshardBrooks #JusticeForRayshard #BlackLivesMatter,23
523,2020-06-15 14:30:32+00:00,35,Hey all! I was invited to stream alongside @MikeChannell on the @OutsideXbox channel playing some Call Of Duty Warzone and raising money for #blacklivesmatter swing by say hello and show some support! https://www.youtube.com/watch?v=xAlW5M9zKQ0,10
524,2020-06-15 14:29:37+00:00,1569,"This weekend, #BlackTransLivesMatter protests in Brooklyn, LA and Chicago brought to light the unequal levels of violence and discrimination their community faces. As we continue to fight for #BlackLivesMatter, please remember how race intersects with gender and sexuality. ",316
525,2020-06-15 14:29:34+00:00,593,White academics: I notice a lot of us going back to business as usual. That’s privilege and it sucks. I’m starting an accountability group to push each other to keep taking concrete actions to support #BlackLivesMatter. Reply or message to join me. #AcademicChatter,89
526,2020-06-15 14:29:22+00:00,35,New @MassInc survey: 35% people of color unable to pay full May rent (12% for white tenants). We can't win racial justice without transforming housing + the economy; we can't win housing + economic justice without fighting racism! https://www.massincpolling.com/the-topline/2020/6/10/poll-more-renters-falling-behind-as-economic-toll-of-covid-spreads-in-massachusetts #mapoli #BlackLivesMatter ,36
527,2020-06-15 14:27:20+00:00,62," @just_security publishes ""Statement of Homeland and National Security Leaders"" including former cabinet members and senior officials from Republican and Democratic administrations #GeorgeFloydProtests #CountryAboveParty #BlackLivesMatter ",41
528,2020-06-15 14:27:03+00:00,41,it's been two weeks since a bunch of tech companies released statements about #BlackLivesMatter. how are you all feeling about the momentum in your own companies? do you still feel confident that your company will change? and how can we all keep the momentum going?,10
529,2020-06-15 14:26:21+00:00,280,"If we as a nation will be renaming streets and taking down statues then one of the most racist figures in our nations history, Planned Parenthood founder, Margaret Sanger must be included. #equaljustice #BlackLivesMatter #mondaythoughts #MondayMotivation @PPFA @PPact",128
530,2020-06-15 14:21:52+00:00,363,Tommy who is Chinese claims that he was attacked yesterday by racist thugs ‘defending’ statues of dead racists in George Sq. who profiteered from slavery- @policescotland had a horrendous job to do but their treatment of Tommy...... #BlackLivesMatter ,186
531,2020-06-15 14:20:37+00:00,4998,"Dear #BlackLivesMatter, (Black) Florida Wildlife Conservation officer, 30, shot dead; 3 in custody, investigators say https://www.foxnews.com/us/florida-wildlife-conservation-officer-shot-dead What time do the protests start? #AllLivesMatter",2256
532,2020-06-15 14:20:37+00:00,44,"Every moment we live, and breathe: We. Matter. And we deserve your love and support at ALL times. But we might not all HAVE time to live those lives we deserve. So fight for us Now, not just when we’re gone. #BlackLivesMatter",4
533,2020-06-15 14:20:15+00:00,32,"READ: “Racism Is Killing the Planet” from Hop Hopkins, Sierra Club Director of Strategic Partnerships, on the intersection between #BlackLivesMatter and the climate: “White supremacy leads the way toward disposable people and a disposable natural world.” ",23
534,2020-06-15 14:20:07+00:00,43,Monday Morning Education...#BlackLivesMatter ,11
535,2020-06-15 14:17:58+00:00,85,Supreme Court rules in a 6-3 decision LGBT are protected from discrimination in their jobs and can sue. #OneV1 #LGBT #BlackLivesMatter #StopDiscrimination,45
536,2020-06-15 14:17:21+00:00,441,"over 120,000 Americans have died and Millions are unemployed due to @realDonaldTrump inept handling of #COVID19Pandemic @POTUS has American blood on his tiny hands #RacistTrump #BlackLivesMatter #VoteBlueToSaveAmerica http://nestorgomezstoryteller.com/immigration-stories.html",52
537,2020-06-15 14:15:00+00:00,52,"It’s my birthday, if you send me a screenshot of a $10 donation to anything cool (reply or DM), I’ll send you my album (digitally). Cool things: anything #BlackLivesMatter, @PPFA, supplies for healthcare workers fighting COVID, @WDCharities, @RizzoFoundation, you get it",12
