,Datetime,Favorites,Text,Retweets
0,2020-06-14 23:59:46+00:00,70,8 minutes 46 seconds 8 minutes 46 seconds 8 minutes 46 seconds 8 minutes 46 seconds 8 minutes 46 seconds 8 minutes 46 seconds 8 minutes 46 seconds 8 minutes 46 seconds 8 minutes 46 seconds 8 minutes 46 seconds 8 minutes 46 seconds 8 minutes 46 seconds #BlackLivesMatter,22
1,2020-06-14 23:59:25+00:00,8610,Newest mural in Flint. That’s me skateboarding #BlackLivesMatter #Flint,1650
2,2020-06-14 23:58:10+00:00,200,Nope. Take that craziness somewhere else Pam! #rayshardbrooks #atlanta #BlackLivesMatter #blackconservative #conservative,100
3,2020-06-14 23:55:32+00:00,1559,Question: all of the Black celebrities outchea talking about #BlackLivesMatter...how many of them have Black representation...how many are with a black-owned agency?,312
4,2020-06-14 23:53:14+00:00,327,Chicago says #CPACNow #BlackLivesMatter #BlackTransLivesMatter,60
5,2020-06-14 23:52:38+00:00,170,"Thousands join Black-led Drag March for Change in Chicago's Boystown neighborhood. Marchers are demanding classification of violence against trans people as a federal hate crime, and that City Council pass the Civilian Police Accountability Council. #CPACNow #BlackLivesMatter ",62
6,2020-06-14 23:51:50+00:00,213,"After somebody told me that #YouTube is censoring certain comments related to #BlackLivesMatter"", I tried it on my computer too, with ""Black Lives Matter violence"". Deleted in 18 seconds indeed. pic.twitter.com/1pYhEyHVPU",157
7,2020-06-14 23:50:51+00:00,272,"Today I witnessed ONE person who made a #BlackLivesMatter / #ColumbusSucks sign, go across enemy lines to stand up for what she believed in. An older gentleman assaulted her and was ultimately detained BUT it took a ton of balls for her to do what she did. #southphilly pic.twitter.com/T8Cg6zkmMw – at Marconi Plaza",65
8,2020-06-14 23:49:33+00:00,130,“He should have complied” or “don’t resist” is the most callous and sinister justification for an execution that I will never agree with. #BlackLivesMatter,29
9,2020-06-14 23:49:25+00:00,72,"#TraderJoes is not your friend. They punish workers. They give lip service to #BlackLivesMatter, but it means nothing. ",16
10,2020-06-14 23:49:02+00:00,901,My name is Don Lewis. I am a black man. This is my story about the police. #BlackLivesMatter ,511
11,2020-06-14 23:48:35+00:00,101,Murderers who hunt in packs. #BlackLivesMatter pic.twitter.com/zfQFHkHjAx,63
12,2020-06-14 23:48:00+00:00,1182,What an amazing dad #girldad #blacklivesmatter ,361
13,2020-06-14 23:43:22+00:00,118,Today the LGBTQ community marches in solidarity with our black siblings. Today and tomorrow we stand united. Pride for #BlackLivesMatter! ,31
14,2020-06-14 23:42:59+00:00,176,"Hollywood Blvd. At least 30,000 peaceful protestors. Hundreds gathered outside their homes and businesses, handing out snacks / water / sunscreen / hand sanitizer. Keep showing up, Los Angeles. #BlackLivesMatter ",17
15,2020-06-14 23:41:51+00:00,495,“This is reality.” Powerful. #BlackLivesMatter ,341
16,2020-06-14 23:41:21+00:00,56,This is how life in this country is for Black people. Can y’all understand why we’re so exhausted now?? Do you believe us now? #BlackLivesMatter,17
17,2020-06-14 23:40:19+00:00,453,"Black Lives Matter is a scam front group, a communist, Anti Semitic, violent nightmare, designed to suck in donations for the DemocRacist party. @realDonaldTrump, it’s time to declare #BlackLivesMatter a terrorist group &amp; for sure OFFICIALLY, Klantifa. Also, STOP the COVIDHOAX! pic.twitter.com/zROgj31kXI",396
18,2020-06-14 23:39:00+00:00,383,SAY HER NAME. Breonna Taylor. Sandra Bland. Atatiana Jefferson. Mya Hall. Meagan Hockaday. Kayla Moore. & so many more. #BlackLivesMatter,126
19,2020-06-14 23:37:40+00:00,80,NOW: Drag March For Change in Boystown Photo by Steven Koch for @GoPride (photos available with permission) #lgbt #lgbtq #BlackLivesMatter #BlackTransLivesMatter #lgbtchicago #GayChicago #Boystown #BoystownChicago #Pride2020,32
20,2020-06-14 23:58:50+00:00,48,With everything going on I was inspired to continue writing my book about what it took to get a #PhD in #STEM as a black man in this country! I’m putting my story out there for the masses to read I hope everyone else is inspired to do the same! #BlackintheIvory #BlackLivesMatter,3
21,2020-06-14 23:56:26+00:00,33,"It is not a distraction from #BlackLivesMatter to call out and discuss the rampant ableism and inaccessibility in leftist/progressive spaces, cuz #BlackDisabledLivesMatter too and we're calling y'all out as well!",6
22,2020-06-14 23:55:15+00:00,20,The betterment and voices of ALL Black UT students should be taken into consideration! We side with our Black athletes and admire their courage to speak out against injustice #BlackLivesMatter ,6
23,2020-06-14 23:51:50+00:00,16,"Everyone keeps telling me to post these on Twitter, so here it goes! This piece is for non-profit; $90. 75% will go to @NAACP (other 25% towards cost of material). I will make NO MONEY on this sale! #BlackLivesMatter #NAACP",5
24,2020-06-14 23:51:21+00:00,43,"Boricuas March for Black Lives, with Bomba & Plena music on what would have been the 63rd annual Puerto Rican Day Parade. Here they arrive in #EastHarlem #ElBarrio #BlackLivesMatter #LasVidasNegrasImportan #Boricua",21
25,2020-06-14 23:50:43+00:00,48,"This is the #BlackLivesMatter movement. Once again, another reason why I believe the organization pushing the movement is corrupt and should be exposed. #DefundBlackLivesMatter https://www.instagram.com/p/CBbxUbRF0eF/?igshid=1rvgytkgg3h1r",8
26,2020-06-14 23:50:32+00:00,23,"Taiwan #BlackLivesMatter gets indigenous twist. FYI, one of the chains of migration into the Pacific started from Taiwan over 5000 years ago. ",6
27,2020-06-14 23:50:17+00:00,22,"Thank you, North Carolina Activists #BlackLivesMatter ",13
28,2020-06-14 23:49:54+00:00,32,Anyone know who this woman is at the protest in West Hollywood?? She was amazing (the guy on roller blades falling was also pretty good). #westhollywood #AllBlackLivesMatter #ABLM #Pride⁠ ⁠ #LAProtest #WestHollywoodProtest #PrideMarch #BlackLivesMatter #losangelesprotest #BLM,7
29,2020-06-14 23:49:45+00:00,27,got some pictures of these idiots in miami lakes earlier. how can you be part of an oppressed minority and still have the audacity to side with @realDonaldTrump ? #BlackLivesMatter ,9
30,2020-06-14 23:49:43+00:00,72,We started as Sunday School friends. Now we’re doing work together for our people. Mad love to Queusha & Neicey Harris for your organization of today’s march in Covington. Proud beyond words. Honored to have been able to join y’all. #blacklivesmatter in rural Tennessee too! ,4
31,2020-06-14 23:49:13+00:00,23,Just got a delicious hot dog from Earl’s First Amendment Grill. #DCProtests #BlackLivesMatter ,10
32,2020-06-14 23:48:38+00:00,60,I seem to have gained a bunch of new followers (I think because I told @SUEtheTrex I'm gay??) so I'd like to take this time to say: #BlackLivesMatter #BlackTransLivesMatter,2
33,2020-06-14 23:46:54+00:00,36,The movement has just begun. #BlackLivesMatter ,11
34,2020-06-14 23:45:22+00:00,36,"Much like how people like to morph #BlackLivesMatter into ""All Lives Matter"", #SayHerName is being morphed into ""Say Their Names"" and I do not appreciate it one bit.",7
35,2020-06-14 23:45:18+00:00,37,BLACK LIVES. LGBTQ+ LIVES. MATTER. EVERY. SINGLE. DAY. You are not alone. You are loved. #BlackLivesMatter #PrideMonth https://www.instagram.com/p/CBbzXqahocg/?igshid=ba5hhm3ugqrm,3
36,2020-06-14 23:45:02+00:00,23,The #COVID19 crisis isn’t over. And communities of color continue to suffer the most due to racial disparities and a denial of resources. #ProtectAllWorkers #BlackLivesMatter ,12
37,2020-06-14 23:37:48+00:00,25,"We will not let you sleep. Families want answers after hanging deaths of 2 Black men in Victorville, Palmdale. #BlackLivesMatter ",28
38,2020-06-14 23:35:57+00:00,32,I don’t kno if any body told you this but if you not black and you supporting #BlackLivesMatter I thank you and my daughter thanks you too,4
39,2020-06-14 23:34:48+00:00,28,"Y’all can defund schools, arts and music but cry bloody murder when we say DEFUND the police ? #BlackLivesMatter",13
40,2020-06-14 23:34:03+00:00,58,Miami Police attacked #BlackLivesMatter protesters on the other side of the same park earlier the week. Here they are saluting a few of their friends who are pro police demonstrators. This is what @MiamiMayor Suarez means by ‘the police are with protestors.’,57
41,2020-06-14 23:33:52+00:00,784,"By making unfounded claims that #BlackLivesMatter protests are secretly run by antifascists while also declaring that antifascists are terrorists, the State is setting up a justification to use counter-terrorism resources against Black organizers and protesters.",350
42,2020-06-14 23:27:26+00:00,85,"#YouTube censoring ""#BlackLivesMatter violence"", ""Black Lives Matter crime"", ""black crime"". This video was recorded by someone in Sweden. (words are in Swedish). He also tried on his own channel and allowed every comment filter. Still same thing. I tried it too. Same for me. ",71
43,2020-06-14 23:25:45+00:00,46,Protest in NYC for BLACK TRANS LIVES MATTER. #BlackTransLivesMatter #BlackLivesMatter #lgbtq,19
44,2020-06-14 23:25:30+00:00,149,"Chicago Police reports that we have surpassed 20,000 participants at the Drag March for Change. $120,000+ has been raised. #ChicagoProtest #BlackLivesMatter #BlackTransLivesMatter",56
45,2020-06-14 23:23:58+00:00,102,"#TomikaMiller is a widow at only 26. Her husband, #RayshardBrooks, was not serving in a war--he was executed by police. The video of his killing is so shocking--as so many other extrajudicial killings of black people have been. We must #EndPoliceViolenceNow. #BlackLivesMatter",36
46,2020-06-14 23:23:39+00:00,127,Big community effort in the Chinatown-International District today to paint #BlackLivesMatter murals on shops shuttered by COVID. https://www.seattletimes.com/seattle-news/seattle-area-protests-live-updates-on-sunday-june-14/,47
47,2020-06-14 23:23:29+00:00,561,"Years ago, I ""fell asleep"" in the left-turn lane. I was awakened by a motorcycle cop telling me to follow him. He led me to the Denny's on the corner, took me inside, asked them not to let me leave for an hour. He even paid for my coffee. See the difference? #BlackLivesMatter",201
48,2020-06-14 23:23:14+00:00,182,Notice that the man carrying the American flag was a Black man ...where was #BlackLivesMatter ???? Maybe Black people who don’t agree with their ideology don’t matter either ,57
49,2020-06-14 23:23:02+00:00,96,#westhollywood was beautiful today fam. #BlackLivesMatter #blacktranslivesmatters #LAPride #LAProtests #DefundThePolice ,24
50,2020-06-14 23:21:41+00:00,104,This took my breath away. #BlackLivesMatter #NoJusticeNoPeace,60
51,2020-06-14 23:17:32+00:00,229,"In review of Supplementary Estimates this week, I will seek answers as to what the additional $18 million to #RCMP policing operations is for. Better training in de-escalation? #GPC #DefundTheRCMP #stopkillingIndigenouspeople #BlackLivesMatter",65
52,2020-06-14 23:17:10+00:00,324,#FlagDay I firmly believe that #AllLivesMatter-&amp; if that isn’t good enough 4 the #BLM #BlackLivesMatter platform then I challenge you-tell any #Racist #WhiteSupremacist to come at me who’s devaluing you’re life-I’ll defend you-because you matter to me-as a HUMAN&amp; as an American,273
53,2020-06-14 23:16:26+00:00,555,Change is definitely in the air. Even my Dad today said “I always thought protesting during the anthem was about the flag. Now I get it. It was never about the flag.” He’s also now talking to HIS friends about #BlackLivesMatter ,41
54,2020-06-14 23:15:50+00:00,202,"#BlackLivesMatter , we have a case here where the family of a slain, young, black boy could use some real support. Please march on this community that would allow him to be hunted and murdered.",21
55,2020-06-14 23:15:30+00:00,179,"Thank you, @USEmbassySeoul #BlackLivesMatter ",41
56,2020-06-14 23:14:21+00:00,222,"The scene on Sunset Blvd near my house. For THREE HOURS and still going. Gotta be 100K people, peaceful and impassioned. So grateful to them, hopeful for America, proud of my city. #BlackLivesMatter #Pride #protest2020 #EndRacism #DumpTrump",24
57,2020-06-14 23:14:05+00:00,218,"the #BlackLivesMatter viral sekejap je,i hope this #PalestinianLivesMatter also get the same attention :')",59
58,2020-06-14 23:12:57+00:00,94,"There are thousands of people gathered in Chicago, listening to the voices of the gay community. The voices of the transgender community have been silenced for so long, and now they are on the forefront and being heard. #ChicagoProtest #BlackLivesMatter #BlackTransLivesMatter",31
59,2020-06-14 23:10:53+00:00,136,"Trader Joe's, just ""indefinitely closed"" a Seattle location a day after management closed the store early so employees could participate in the June 12 protest organized by the local chapter of Black Lives Matter. #TraderJoes #BlackLivesMatter https://www.savetjs130.com/statement",69
60,2020-06-14 23:09:52+00:00,85,Ma people still dyin #BlackLivesMatter,29
61,2020-06-14 23:09:14+00:00,60,"“Take swift and decisive action in charging the officers. The next months cannot look like the last three,"" Beyoncé #JusticeForBreonnaTaylor #BlackLivesMatter ",31
62,2020-06-14 23:08:33+00:00,221,Laying on an empty floor. Contemplating this crazy world around us. Tired of the ugly. We have to do better. #BlackLivesMatter ,17
63,2020-06-14 23:08:27+00:00,107,"The solidarity of black, brown, and queer voices today was absolutely incredible. #ABLMLA #Pride #BlackLivesMatter ",27
64,2020-06-14 23:08:17+00:00,276,"If #BlackLivesMatter wasn’t fake and they were actually for real, they’d care &amp; focus on saving THE MOST BLACK LIVES POSSIBLE ",97
65,2020-06-14 23:05:13+00:00,46,"Despite the rain, fears of coronavirus, and 2 groups of counter protesters, @blmtokyojp was 3600人 strong. #BlackLivesMatter #blmtokyomarch #blm東京行進",26
66,2020-06-14 23:05:05+00:00,193,"Although we are not the organizers, we stand in solidarity with the #GeorgiaViaducts protestors and their list of demands. @CityofVancouver it is time for you to commit to our land trust proposal that is now 2 years overdue! #HogansAlley #landtrust #blacklivesmatter ",88
67,2020-06-14 23:04:12+00:00,77,The media doesn't wanna cover rallies with these type of numbers because it shows that the movement is only growing. And seeing that this is for Black Trans Lives Matter is a gorgeous sight to see #BlackLivesMatter ,46
68,2020-06-14 23:03:54+00:00,2344,5.75 miles from #Hollywood to #WestHollywood in solidarity of #LGBTQ + #BlackLivesMatter! #LApride,840
69,2020-06-14 23:03:52+00:00,72,Don’t let #BlackLivesMatter stop trending. ,25
70,2020-06-14 23:03:07+00:00,82,"Here's a video of peaceful protesters being assaulted by #trumpsters. This happened in Bethel, Ohio. Roughly an hour out of Downtown, Cincinnati. The police, yet again, do nothing. #TalkingAboutRace #BlackLivesMatter #FTP #ObamaDayJune14th #confederateflag #alllivesmatter",55
71,2020-06-14 23:02:53+00:00,373,"Thread of scenes from my walk to #WestHollywood this morning, featuring a drum line that increased in membership as we marched. #BlackLivesMatter #ABLM",58
72,2020-06-14 23:02:33+00:00,138,Swiss Tamils show solidarity at Black Lives Matter protests https://www.tamilguardian.com/content/swiss-tamils-show-solidarity-black-lives-matter-protests #BlackLivesMatter #blm #tamil #eelam (Photographs by Keerthana Kirubagaran and Shawmya Thilipkumar),52
73,2020-06-14 23:01:53+00:00,29,#TrevorNoah might claim #BlackLivesMatter but here is saying rubber bullets &amp; tear gas don't work &amp; siding with police in regards to a confrontation cops had with miners during a strike in #SouthAfrica.,20
74,2020-06-14 23:01:41+00:00,155,"Oh shit, since I regained access to my account I realize I may need to remind some folks: • #BlackLivesMatter • #BlackTransLivesMatter Recognize",18
75,2020-06-14 22:59:37+00:00,56,Hi just wanted to say #BlackLivesMatter ,31
76,2020-06-14 22:57:36+00:00,116,When you’re making an essential trip out to take your Mom essentials and find yourself in the middle of an unexpected protest... #blacklivesmatter #onelove #blacktranslivesmatter #justice #noracism #equality #losangeles #westhollywood,17
77,2020-06-14 22:57:13+00:00,60,"Shoutout to @jaimetoons for getting his camera out and proving (again) the value of social media to shine a light on everyday racism + cop-calling – this time in SF's Pacific Heights. If you haven't seen this story, treat yourself. #BlackLivesMatter ",24
78,2020-06-14 22:56:41+00:00,630,"Atlanta is angry. Today, more than ever. I love this city and stand by those who were on the streets demanding change last week, today and every day. : @davidsluse #BlackLivesMatter ",81
79,2020-06-14 22:56:18+00:00,85,This is what #BlackLivesMatter looks like in a town that’s 95% white....this is fucking change you guys! pic.twitter.com/rmM4oLGz6E,28
80,2020-06-14 22:53:00+00:00,55,Comment this post with “I demand justice for Breonna Taylor”. When I wake up from my nap this tweet better have 500 comments. Send this to all your group chats PLEASE #JusticeForBreonnaTaylor #BlackLivesMatter ,16
81,2020-06-14 22:52:44+00:00,106,Together we stand! #goMAD #BlackLivesMatter ,15
82,2020-06-14 22:52:42+00:00,32,"@AGOWA Attorney General Ferguson, please seek a restraining order to stop Trader Joe's throwing Washingtonians out of work &amp; closing an essential business permanently during the pandemic, apparent after-the-fact retaliation for approved #BlackLivesMatter protest attendance. ",24
83,2020-06-14 22:51:37+00:00,26,"Before you post that mildly,racist pro cop post on Facebook. #BlackLivesMatter ",13
84,2020-06-14 22:48:58+00:00,379,And finally the single best sign and my favorite photo from today’s #AllBlackLivesMatter protest march. #BlackLivesMatter #WestHollywood #BunkerBitch #GoodDog pic.twitter.com/rwzOMYjlIT,78
85,2020-06-14 22:47:11+00:00,52,"Ignoring misuse of ""defamation"" (ffs), more evidence statues of dead white men are more important than saving black lives. And how often have we seen memorials to Indigenous history vandalised? Yet to see any laws to stop that. #auspol #BlackLivesMatter ",25
86,2020-06-14 22:46:17+00:00,92,More photos from #AllBlackLivesMatter protest march. #WestHollywood #BlackLivesMatter ,19
87,2020-06-14 22:45:11+00:00,56,Hordes of protesters are taking a knee in solidarity of the black lives lost to police violence in Boystown - Chicago. #ChicagoProtest #BlackLivesMatter #BlackTransLivesMatter,21
88,2020-06-14 22:44:50+00:00,71,Goodnight Tweeps. I'll just leave this here #BlackLivesMatter ,16
89,2020-06-14 22:43:44+00:00,527,Massive Drag March protest in #Boystown #Chicago. People have been walking past for 20-30 minutes and no sign of the end. This movement is only getting stronger #BlackLivesMatter ,156
90,2020-06-14 22:43:12+00:00,288,"#BlackLivesMatter protesters in #NewOrleans tore down this statue of #JohnMcDonogh, a slave owner who profited from black people who were forced to work for their freedom over a period of 15 years. The statue was thrown into the Mississippi River.",109
91,2020-06-14 22:43:07+00:00,23,"Today I’m honoring George Floyd (rip) in my vision. He was a father that was once again murdered by an untrained, unprofessional pig. This isn’t a trend, it’s a movement. Yes, we got justice, but this fight for change is far from over. Keep spreading awareness! #BlackLivesMatter ",7
92,2020-06-14 22:42:46+00:00,408,IT IS ACTIVE ON HALSTED #BlackLivesMatter ,138
93,2020-06-14 22:42:29+00:00,73,"Get in girls, we’re going protesting. #BlackLivesMatter ",8
94,2020-06-14 22:41:35+00:00,87,Refuse Fascism Chicago taking over Lakeview to drive out the fascist Trump/Pence regime on Trump’s BDay! #RefuseFascism #OutNow #DegenerateArtists #TransLivesMatter #BlackLivesMatter ,38
95,2020-06-14 22:40:48+00:00,2976,"If you get nothing else, understand this: #BlackLivesMatter shouldn’t center around just violent Black deaths but actually caring about Black livelihoods and tearing down systems made to safeguard white wealth while crushing everyone else.",787
96,2020-06-14 22:40:27+00:00,115,"A few dozen people showed to ""defend"" a Columbus Statue. A few HUNDRED families marched to Columbus Sq. Park on Friday to stand in solidarity with #BlackLivesMatter . All are #SouthPhilly, but the families have the numbers and most importantly the future.",21
97,2020-06-14 22:40:04+00:00,110," Timelapse: Protesters painted a huge #BlackLivesMatter mural in Seattle’s Capitol Hill Autonomous Zone, or #CHAZ",21
98,2020-06-14 22:39:38+00:00,119,What are you doing today? I'm casually looking through the list of herpers I've followed/looked up to see who hasn't said anything about #BlackLivesMatter. Am I excluding non-Americans? No. Their platforms cross-over. No excuses anymore. Racism isn't specific to America.,13
99,2020-06-14 22:39:13+00:00,67,"In a show of inclusivity & solidarity, volunteers painted “All Black Lives Matter” in the middle of the busy Hollywood Boulevard and Highland Avenue intersection to honor LGBTQ+ BLM people & the fight for justice nationwide. #BlackLivesMatter #LosAngelesProtest #hollywoodprotest",25
100,2020-06-14 22:37:08+00:00,42,"What a difference to the peaceful #BlackLivesMatter protest organized by a young artist last Sunday. Profanity, people telling members of media to go back to Massachusetts &amp; Cuba. Pura chusmeria in #MiamiLakes, that’s a first for the town by group that calls itself Cubans4Trump",24
101,2020-06-14 22:36:50+00:00,73,Boris Johnson is not a healer. He is not someone who understands the concept of justice. He doesn’t know why you shouldn’t abuse people in the way that’s he has been responsible for doing in the past. #BlackLivesMatter #BorisJohnson,39
102,2020-06-14 22:35:39+00:00,82,Downtown #SanDiego #BlackLivesMatter Protest has arrived at Police Headquarters. ,28
103,2020-06-14 22:31:44+00:00,61,Monday's front cover of AS has just been unveiled and it features Real Madrid's 3-1 win over Eibar and Marcelo's #BlackLivesMatter gesture of support. https://en.as.com/en/2020/06/14/football/1592151987_093948.html,10
104,2020-06-14 22:31:03+00:00,133,"LAPD just waiting to pounce. Smh. We were PEACEFULLY gathering, and they come armed to the teeth. Soon after they cleared out though #DefundThePolice #blacklivesmatter #westhollywood #AllBlackLivesMatter",35
105,2020-06-14 22:30:35+00:00,163,We marched at the #BlackLivesMatter/#Pride march today in Hollywood/#WestHollywood! It was wonderful to see so many compassionate activists standing up for Black lives &amp; Black LGBTQ lives. #AllBlackLivesMatter #lgbt #activism #losangeles #pridemarch #lapride,36
106,2020-06-14 22:30:03+00:00,57,Please include Black Disabled Lives when you say BLM. I know to many black people with disabilities aren’t seen as much but we are in this fight too. I am a black woman with a disability who’s being a voice for black people in the disabled community #BlackLivesMatter,16
107,2020-06-14 22:27:51+00:00,40,"#blacklivesmatter today’s protest was beautiful, shoutout to everyone who pulled up. #LatinosForBlackLivesMatter",8
108,2020-06-14 22:27:32+00:00,30,To Joe Biden #BlackLivesMatter because he gets to see his crime bill in action. To Trump #BlackLivesMatter because he gets to play KKK Grand Wizard. Are we done being stupid yet America? Is this idiotic experiment just about over?,8
109,2020-06-14 22:26:44+00:00,61,"A protest sign spotted at a #BlackLivesMatter demonstration in Malibu, California recently. ",11
110,2020-06-14 22:26:38+00:00,45,"All the while, most Republicans don’t believe racism is a major issue in this country. #BlackLivesMatter",13
111,2020-06-14 22:25:46+00:00,471,Attended a small peaceful protest today in my little Canadian hometown that's always been super white and has its own shameful history & ongoing racism. There were opening BIPOC led speeches and chants & it was powerful & peaceful. #BlackLivesMatter ,26
112,2020-06-14 22:25:00+00:00,355,Demonstrators gathered for #BlackLivesMatter protests in London and Leeds ,124
113,2020-06-14 22:24:35+00:00,76,"Great turnout in Georgetown at todays Solidarity march for support of Black Indegenious People of Color. My guess about 1,000 marched. #BlackLivesMatter well organized and powerful messaging. @CP24",4
114,2020-06-14 22:24:33+00:00,4794,This is the #BlackLivesMatter protest in LA today. Unbelievable. This movement will not stop. ,2541
115,2020-06-14 22:24:00+00:00,101,It was an honor to participate in the Unity March today with @MemphisFB and Coach @RSilverfield! Thank you to Bertha Rogers Looney of the Memphis State 8 for speaking to all of us! #BlackLivesMatter #GoTigersGo,18
116,2020-06-14 22:22:41+00:00,94," Puerto Ricans gathered in East Harlem today to learn from the Young Lords &amp; Black Panthers about transnational solidarity &amp; why #BlackLivesMatter. Proud to see mi gente honor our African roots, center our revolutionary struggle &amp; dance bomba y plena Pa’lante ",26
117,2020-06-14 22:22:00+00:00,1377,"The Drag March for Change has kicked off in Chicago, in support of Black Lives Matter and demand justice for victims of police brutality and excessive force through the Boystown community. #ChicagoProtest #BlackLivesMatter #BlackTransLivesMatter",527
118,2020-06-14 22:21:51+00:00,109,I tweeted this yesterday - this one human gesture has done more to promote the true meaning of anti-racism and should be what #BlackLivesMatter stands for not tearing down statues. ,29
